{"run":81,"commit":"dfbed23","metric":6.105521221127159,"metrics":{"evals_per_second":163.7861803738661,"visits_per_position":83.75,"evals_per_position":83.9375,"total_eval_ms":5.9010991875,"readback_synced_ms":5.77053575,"readback_map_async_ms":5.814673999999999,"readback_map_wait_ms":5.768508562500001,"readback_overlap_hidden_ms":0.011119750000000001,"legal_priors_prep_ms":0.011119750000000001,"readback_bytes":7444,"readback_maps":0.26140568750000004,"dispatch_count":160},"status":"discard","description":"hard-reset browser harness then mixed-tvm-ffn JS-legal recovery control","timestamp":1780692353176,"segment":2,"confidence":1.2981127480568417,"asi":{"hypothesis":"Hard-reset all wrapper-owned agent-browser Chrome-for-Testing and agent-browser CLI processes, then rerun the default 16-position mixed-tvm-ffn JS-legal depth1 control to test whether accumulated browser/GPU harness state caused the degraded readback window.","rollback_reason":"No implementation changed; the large improvement to 6.11 ms/eval is recovery/calibration evidence from resetting the browser harness, not a code optimization to keep. Treat it as evidence that the prior degraded window was environmental and that single-run post-reset results may be overly favorable/noisy.","next_action_hint":"Before promoting any code, run another adjacent mixed-tvm-ffn JS-legal confirmation and/or hand/ONNX control after the hard reset. Consider adding a safe pre-iteration browser-harness cleanup hook, but do not overfit to this single unusually fast control.","artifact":"/tmp/lc0_autoresearch/20260605_134500_57155_rep3.json","input_backend":"wasm","encoder_kernel":"mixed-tvm-ffn","legal_priors_backend":"js","batch_size":4,"batch_pipeline_depth":1,"max_positions":16,"reps":3,"control_run":true,"cleanup_before_run":"killed all wrapper-owned agent-browser-darwin-arm64 and .agent-browser Chrome-for-Testing processes, killed 5179/5180 listeners, waited 20s, verified no matching processes remained","defaults_changed":false,"noise_note":"Hard browser-harness reset immediately reduced readback wait from ~10ms degraded controls to ~5.77ms and produced a very fast no-code result; use as environment diagnosis, not optimization evidence."}}
{"run":82,"commit":"dfbed23","metric":6.181993217825799,"metrics":{"evals_per_second":161.7601257012862,"visits_per_position":82.75,"evals_per_position":82.9375,"total_eval_ms":5.967189,"readback_synced_ms":5.829958562500001,"readback_map_async_ms":5.8765008125,"readback_map_wait_ms":5.827940625,"readback_overlap_hidden_ms":0.0117120625,"legal_priors_prep_ms":0.0117120625,"readback_bytes":7444,"readback_maps":0.26151868750000007,"dispatch_count":160},"status":"discard","description":"adjacent mixed-tvm-ffn JS-legal confirmation after hard reset","timestamp":1780692455812,"segment":2,"confidence":1.2876474227151784,"asi":{"hypothesis":"Run an adjacent default 16-position mixed-tvm-ffn JS-legal depth1 confirmation immediately after the hard browser-harness reset recovery run, without another code change, to test whether the recovered low readback-wait state persists beyond a single unusually fast run.","rollback_reason":"No implementation changed; although the 6.18 ms/eval result remains much faster than historical mixed-tvm-ffn controls, it is calibration/evidence about browser-harness state rather than a new optimization to keep. Do not treat this as an implementation improvement over the current best code.","next_action_hint":"The recovered state persisted for at least one adjacent run. Next run an adjacent hand-kernel or ONNX control after the reset to recalibrate cross-runtime conditions, or add a safe pre-iteration cleanup hook only after verifying it does not alter workload semantics or hide failures.","artifact":"/tmp/lc0_autoresearch/20260605_134650_58233_rep3.json","input_backend":"wasm","encoder_kernel":"mixed-tvm-ffn","legal_priors_backend":"js","batch_size":4,"batch_pipeline_depth":1,"max_positions":16,"reps":3,"control_run":true,"adjacent_to_run":81,"defaults_changed":false,"noise_note":"Second consecutive post-hard-reset mixed-tvm-ffn JS-legal control stayed near 6.1 ms/eval with readback wait around 5.83 ms, confirming the prior degraded ~10 ms readback-wait window was environmental."}}
{"run":83,"commit":"dfbed23","metric":7.1366116420068915,"metrics":{"evals_per_second":140.1225189435682,"visits_per_position":71.5,"evals_per_position":71.6875,"total_eval_ms":6.9395928125,"readback_synced_ms":6.782488625000001,"readback_map_async_ms":6.8320451874999995,"readback_map_wait_ms":6.779649749999999,"readback_overlap_hidden_ms":0.012489625,"legal_priors_prep_ms":0.012489625,"readback_bytes":7444,"readback_maps":0.26337431249999993,"dispatch_count":160},"status":"discard","description":"adjacent hand-kernel JS-legal control after hard reset","timestamp":1780692518947,"segment":2,"confidence":1.2773494898076925,"asi":{"hypothesis":"Run an adjacent default hand-kernel, JS-legal, WASM-input b4/depth1 control after the hard browser-harness reset and two recovered mixed-tvm-ffn confirmations, to recalibrate cross-kernel conditions in the recovered browser/WebGPU state without making code changes.","rollback_reason":"No implementation changed; the 7.14 ms/eval result is calibration evidence from the recovered browser/GPU state, not a new optimization to keep. It should not replace implementation evidence or be used to claim a code improvement.","next_action_hint":"Recovered-state hand is faster than the old hand baseline but still slower than adjacent recovered mixed-tvm-ffn controls (~6.1-6.2 ms/eval), supporting mixed-tvm-ffn as the robust opt-in candidate. Next run an adjacent ONNX b1 control or default GPU-legal mixed-tvm-ffn control only as calibration; avoid new hot-path changes until the post-reset baseline is characterized.","artifact":"/tmp/lc0_autoresearch/20260605_134752_58808_rep3.json","input_backend":"wasm","encoder_kernel":"hand/default","legal_priors_backend":"js","batch_size":4,"batch_pipeline_depth":1,"max_positions":16,"reps":3,"control_run":true,"adjacent_to_runs":[81,82],"defaults_changed":false,"noise_note":"Post-hard-reset recovered state also improves the hand-kernel path (readback wait ~6.78 ms), but mixed-tvm-ffn remains materially faster than hand under adjacent conditions."}}
{"run":84,"commit":"dfbed23","metric":6.578777152064915,"metrics":{"evals_per_second":152.0039327804446,"visits_per_position":77.5,"evals_per_position":77.6875,"total_eval_ms":6.422169937499999,"readback_synced_ms":6.261209125000001,"readback_map_async_ms":6.2631039374999995,"readback_map_wait_ms":6.258183875,"readback_overlap_hidden_ms":0,"legal_priors_prep_ms":0,"readback_bytes":3084,"readback_maps":0.26225081250000004,"dispatch_count":161},"status":"discard","description":"adjacent GPU-legal mixed-tvm-ffn control after hard reset","timestamp":1780692589462,"segment":2,"confidence":1.2626735925870503,"asi":{"hypothesis":"Run an adjacent default 16-position mixed-tvm-ffn GPU-legal control in the recovered post-hard-reset browser/WebGPU state to compare against the two JS-legal mixed-tvm-ffn confirmations and the hand-kernel control without changing code.","rollback_reason":"No implementation changed; the 6.58 ms/eval result is calibration/config-comparison evidence, not a new optimization to keep. It is slower than adjacent mixed-tvm-ffn JS-legal controls around 6.1-6.2 ms/eval despite reducing readback bytes to 3084 and eliminating legal-prior prep.","next_action_hint":"Favor mixed-tvm-ffn with JS legal priors as the robust opt-in depth1 candidate under recovered conditions; treat GPU legal priors as low-confidence/optional unless a larger alternating matrix shows otherwise. Next run an adjacent ONNX b1 control or document the recovered-state calibration before new code changes.","artifact":"/tmp/lc0_autoresearch/20260605_134859_59376_rep3.json","input_backend":"wasm","encoder_kernel":"mixed-tvm-ffn","legal_priors_backend":"gpu","batch_size":4,"batch_pipeline_depth":1,"max_positions":16,"reps":3,"control_run":true,"adjacent_to_runs":[81,82,83],"defaults_changed":false,"noise_note":"Post-hard-reset GPU legal is much better than the degraded 12.01 ms/eval control but remains slower than adjacent JS-legal mixed-tvm-ffn; byte reduction alone still does not guarantee lower E2E time."}}
{"run":85,"commit":"dfbed23","metric":10.656539473800283,"metrics":{"evals_per_second":93.83909311822639,"visits_per_position":46.5,"evals_per_position":47.5,"total_eval_ms":10.872170062499999,"readback_synced_ms":0.0044121874999999994,"readback_map_async_ms":0,"readback_map_wait_ms":0,"readback_overlap_hidden_ms":0,"legal_priors_prep_ms":0,"readback_bytes":7448,"readback_maps":0,"dispatch_count":0},"status":"discard","description":"adjacent ONNX b1 control after hard reset","timestamp":1780692651925,"segment":2,"confidence":1.2443606397208433,"asi":{"hypothesis":"Run an adjacent default 16-position ONNX b1 control in the recovered post-hard-reset browser/WebGPU state to compare the stable ONNX runtime against the recovered mixed-tvm-ffn, hand-kernel, and GPU-legal controls without changing code.","rollback_reason":"No implementation changed and this used LC0_AR_RUNTIME=onnx with batchSize=1, so it is a diagnostic/non-comparable control rather than a keepable hybrid b4 optimization. The recovered ONNX metric of 10.66 ms/eval is much better than the degraded 17.72 ms/eval ONNX control but still slower than adjacent recovered WGSL mixed-tvm-ffn JS-legal controls around 6.1-6.2 ms/eval.","next_action_hint":"Recovered-state calibration now favors opt-in mixed-tvm-ffn with JS legal priors over hand, GPU-legal, and ONNX controls under this fixed-suite window. Next either document/update notes with the hard-reset environmental finding, add a safe pre-iteration cleanup hook only if it cannot hide failures, or run one more 32-position mixed-tvm-ffn JS-legal confirmation before further code changes.","artifact":"/tmp/lc0_autoresearch/20260605_135005_59954_rep3.json","runtime":"onnx","batch_size":1,"max_positions":16,"reps":3,"diagnostic_control":true,"non_comparable_to_default_primary":true,"adjacent_to_runs":[81,82,83,84],"defaults_changed":false,"noise_note":"Hard-reset recovered ONNX from the degraded 17.72 ms/eval window to 10.66 ms/eval, confirming broader browser/GPU state affected both ONNX and WGSL paths; mixed-tvm-ffn JS-legal remains fastest among adjacent recovered controls."}}
{"run":86,"commit":"dfbed23","metric":6.10607927061609,"metrics":{"evals_per_second":163.7712115550544,"visits_per_position":83.875,"evals_per_position":83.96875,"total_eval_ms":5.914790625,"readback_synced_ms":5.798046218750001,"readback_map_async_ms":5.837455812499998,"readback_map_wait_ms":5.7960773437499995,"readback_overlap_hidden_ms":0.00996725,"legal_priors_prep_ms":0.00996725,"readback_bytes":7444,"readback_maps":0.261672125,"dispatch_count":160},"status":"discard","description":"32-position mixed-tvm-ffn JS-legal confirmation after hard reset","timestamp":1780692741876,"segment":2,"confidence":1.2258906387914943,"asi":{"hypothesis":"Run a stronger 32-position mixed-tvm-ffn JS-legal WASM-input b4/depth1 confirmation in the recovered post-hard-reset browser/WebGPU state to test whether the opt-in candidate remains strong beyond the default 16-position corpus before further code changes or documentation updates.","rollback_reason":"No implementation changed and this used LC0_AR_MAX_POSITIONS=32, so it is stronger diagnostic/non-comparable evidence rather than a keepable default-workload optimization. The 6.11 ms/eval result matches adjacent recovered 16-position mixed-tvm-ffn JS-legal controls, but should not be logged as a new implementation improvement.","next_action_hint":"Recovered-state 32-position evidence strongly supports opt-in mixed-tvm-ffn with JS legal priors as the preferred candidate. Next update docs/notes with cautious opt-in/non-default language and the browser-harness reset finding, or add a safe pre-iteration cleanup hook if it can be scoped to stale wrapper-owned browser sessions without hiding workload failures.","artifact":"/tmp/lc0_autoresearch/20260605_135111_60500_rep3.json","input_backend":"wasm","encoder_kernel":"mixed-tvm-ffn","legal_priors_backend":"js","batch_size":4,"batch_pipeline_depth":1,"max_positions":32,"reps":3,"control_run":true,"stronger_diagnostic":true,"non_comparable_to_default_primary":true,"adjacent_to_runs":[81,82,83,84,85],"defaults_changed":false,"noise_note":"The 32-position recovered-state mixed-tvm-ffn JS-legal result stayed near 6.1 ms/eval with readback wait around 5.8 ms, reinforcing that the prior degraded window was environmental and that JS-legal mixed-tvm-ffn is stronger than adjacent hand/GPU-legal/ONNX controls."}}
