{"run":18,"commit":"pending","metric":10.917929293531358,"metrics":{"evals_per_second":91.59245980760095,"visits_per_position":25,"evals_per_position":24.75,"total_eval_ms":11.167779750000001,"readback_synced_ms":8.56618125,"readback_map_async_ms":8.635271,"readback_map_wait_ms":8.56219175,"readback_overlap_hidden_ms":0.020236,"legal_priors_prep_ms":0.020236,"readback_bytes":7444,"readback_maps":0.2945535,"dispatch_count":159},"status":"discard","description":"skip full mapped-policy sanity scan in WGSL search path","timestamp":1780682167151,"segment":0,"confidence":0.9242804976441152,"asi":{"hypothesis":"Remove the hot full mapped-policy nonzero/variation sanity scan from WGSL evaluation result handling while retaining WDL validation; this preserves search outputs but reduces one post-readback pass over the 1858 policy logits.","rollback_reason":"Primary metric was 10.92 ms/eval, better than baseline but worse than the kept best and not enough to justify weakening mapped-policy validation in the opt-in WGSL path.","next_action_hint":"If sanity-scan cost is revisited, prefer an opt-in/profile-only validation toggle or stronger repeated evidence; continue toward WDL-vs-policy readback attribution rather than removing correctness guardrails.","artifact":"/tmp/lc0_autoresearch/20260605_105550_5153_rep1.json"}}
{"run":19,"commit":"pending","metric":15.519065403117116,"metrics":{"evals_per_second":64.51141807752569,"visits_per_position":18,"evals_per_position":18,"total_eval_ms":15.868148875,"readback_synced_ms":13.344588125000001,"readback_map_async_ms":13.409326375,"readback_map_wait_ms":13.3415825,"readback_overlap_hidden_ms":0.019666749999999997,"legal_priors_prep_ms":0.019666749999999997,"readback_bytes":7444,"readback_maps":0.306022375,"dispatch_count":159},"status":"discard","description":"two-rep revert test for combined WGSL readback sanity scans","timestamp":1780682252329,"segment":0,"confidence":0.8879507714972549,"asi":{"hypothesis":"Because the combined sanity-scan keep has weak confirmation evidence, temporarily revert it and run a two-repetition benchmark to test whether the older separate nonzero/variation scans are more stable.","rollback_reason":"Two-rep primary metric regressed badly to 15.52 ms/eval and readback wait rose to 13.34 ms; reverting the scan consolidation did not improve stability or E2E throughput.","next_action_hint":"Do not spend more iterations toggling scan consolidation. Treat readback/fence variability as dominant and focus on attribution or structural changes with stronger evidence.","artifact":"/tmp/lc0_autoresearch/20260605_105714_5624_rep2.json"}}
{"run":20,"commit":"pending","metric":12.785060241279831,"metrics":{"evals_per_second":78.21629160347987,"visits_per_position":21,"evals_per_position":20.75,"total_eval_ms":13.542510750000002,"readback_synced_ms":10.989463999999998,"readback_map_async_ms":11.05626275,"readback_map_wait_ms":10.98626175,"readback_overlap_hidden_ms":0.02000125,"legal_priors_prep_ms":0.02000125,"readback_bytes":7444,"readback_maps":0.3057955,"dispatch_count":159},"status":"discard","description":"single-allocation JS legal-prior normalization loop","timestamp":1780682305622,"segment":0,"confidence":1.1185290555495835,"asi":{"hypothesis":"Rewrite legalPolicyPriorsFromCandidates to build the legal-prior objects once and normalize in simple loops instead of map/spread/reduce/map, preserving priors and sort order while reducing JS allocation after readback.","rollback_reason":"Primary metric regressed to 12.79 ms/eval and readback wait dominated; the JS legal-prior allocation cleanup did not produce a reliable E2E improvement in the noisy b4 workload.","next_action_hint":"Stop spending iterations on small JS legal-prior CPU cleanups unless telemetry shows legal-prior postprocess dominates; focus on readback/fence attribution or larger structural reductions.","artifact":"/tmp/lc0_autoresearch/20260605_105810_6095_rep1.json"}}
{"run":21,"commit":"a6ca037","metric":13.483945782644202,"metrics":{"evals_per_second":74.30559313583186,"visits_per_position":21,"evals_per_position":20.75,"total_eval_ms":14.0010415,"readback_synced_ms":11.484768249999998,"readback_map_async_ms":11.55231075,"readback_map_wait_ms":11.481153375000002,"readback_overlap_hidden_ms":0.019542249999999997,"legal_priors_prep_ms":0.019542249999999997,"readback_bytes":7444,"readback_maps":0.303636,"dispatch_count":159},"status":"discard","description":"two-rep unchanged confirmation of current WGSL readback path","timestamp":1780682359030,"segment":0,"confidence":1.0809166703706283,"asi":{"hypothesis":"Run a two-repetition unchanged confirmation of the current kept WGSL readback path to avoid building on single-run fast-loop wins and quantify current readback/fence variability.","rollback_reason":"No code change; two-rep metric was 13.48 ms/eval, far worse than the single-run kept results, reinforcing that the fast workload is dominated by readback/fence variability and current keeps remain low-confidence.","next_action_hint":"Use stronger attribution or alternating A/B before finalizing low-confidence keeps; next code experiment should avoid CPU micro-tuning and target structural readback/fence changes only.","artifact":"/tmp/lc0_autoresearch/20260605_105900_6457_rep2.json"}}
{"run":22,"commit":"pending","metric":11.48708333261311,"metrics":{"evals_per_second":87.05430012515784,"visits_per_position":24,"evals_per_position":24,"total_eval_ms":11.808048,"readback_synced_ms":8.730577,"readback_map_async_ms":8.7936405,"readback_map_wait_ms":8.72758825,"readback_overlap_hidden_ms":0.01988925,"legal_priors_prep_ms":0.01988925,"readback_bytes":7444,"readback_maps":0.29401350000000004,"dispatch_count":158},"status":"discard","description":"direct mapped-policy WGSL shader without full policy-logits matrix","timestamp":1780682473042,"segment":0,"confidence":1.1311105272867752,"asi":{"hypothesis":"Replace separate 64x64 policy-logits plus mapped-policy WGSL dispatches with one direct mapped-policy shader that computes only the 1858 LC0 mapped outputs from Q/K, reducing dispatch count and avoiding the full policy-logits intermediate while preserving logits and readback shape.","rollback_reason":"Checks passed and dispatch_count dropped from 159 to 158, but primary metric regressed to 11.49 ms/eval; the direct shader's extra per-output dot products and/or fence variability outweighed the removed dispatch/intermediate.","next_action_hint":"Do not pursue direct mapped-policy fusion without timestamp/microbench evidence; focus on attribution of policy head GPU work versus readback fence, or stronger A/B for structural shader changes.","artifact":"/tmp/lc0_autoresearch/20260605_110054_7102_rep1.json"}}
{"run":23,"commit":"pending","metric":12.380574712122995,"metrics":{"evals_per_second":80.77169463068667,"visits_per_position":22,"evals_per_position":21.75,"total_eval_ms":12.187938249999998,"readback_synced_ms":9.727834000000001,"readback_map_async_ms":9.73034575,"readback_map_wait_ms":9.7257825,"readback_overlap_hidden_ms":0.018811,"legal_priors_prep_ms":0.018811,"readback_bytes":7444,"readback_maps":0.29889075,"dispatch_count":159},"status":"discard","description":"start WGSL readback mapAsync after JS legal-candidate prep","timestamp":1780682523689,"segment":0,"confidence":1.156427959618264,"asi":{"hypothesis":"Delay WGSL batch readback mapAsync until after JS legal-candidate prep to test whether eager mapAsync-before-CPU-prep adds contention or lifecycle overhead beyond the tiny overlap it hides.","rollback_reason":"Primary metric regressed to 12.38 ms/eval and readback wait remained dominant; delaying mapAsync did not improve the b4 path, so the existing eager mapAsync scheduling is preferable.","next_action_hint":"Keep eager mapAsync-before-prep. Future iterations should avoid map scheduling micro-toggles and focus on structural readback/fence attribution or stronger A/B for larger shader/readback changes.","artifact":"/tmp/lc0_autoresearch/20260605_110146_7477_rep1.json"}}
{"run":24,"commit":"pending","metric":0,"metrics":{"evals_per_second":0,"visits_per_position":0,"evals_per_position":0,"total_eval_ms":0,"readback_synced_ms":0,"readback_map_async_ms":0,"readback_map_wait_ms":0,"readback_overlap_hidden_ms":0,"legal_priors_prep_ms":0,"readback_bytes":0,"readback_maps":0,"dispatch_count":0},"status":"crash","description":"pad WGSL batch readback stride to 256-byte alignment","timestamp":1780682608974,"segment":0,"confidence":1.156427959618264,"asi":{"hypothesis":"Pad each physical WGSL batch readback slot to a 256-byte stride to test whether aligned destination offsets reduce WebGPU copy/map overhead despite a small increase in mapped bytes.","rollback_reason":"The module crashed at load time because the padded head readback constant referenced WGSL_BATCH_READBACK_ALIGNMENT_BYTES before that constant was initialized; no benchmark data collected.","next_action_hint":"If retrying alignment, define the alignment constant before both padded readback constants or inline the alignment value; then rerun the same hypothesis.","error":"ReferenceError: Cannot access 'WGSL_BATCH_READBACK_ALIGNMENT_BYTES' before initialization"}}
{"run":25,"commit":"pending","metric":13.382409639387244,"metrics":{"evals_per_second":74.72495813136595,"visits_per_position":21,"evals_per_position":20.75,"total_eval_ms":13.20996625,"readback_synced_ms":10.50667525,"readback_map_async_ms":10.5799245,"readback_map_wait_ms":10.50225825,"readback_overlap_hidden_ms":0.021561,"legal_priors_prep_ms":0.021561,"readback_bytes":7680,"readback_maps":0.30267849999999996,"dispatch_count":159},"status":"discard","description":"pad WGSL batch readback stride to 256-byte alignment","timestamp":1780682665086,"segment":0,"confidence":1.1562600953208986,"asi":{"hypothesis":"Pad each physical WGSL batch readback slot to a 256-byte stride so copyBufferToBuffer destination offsets and per-slot mapped ranges are aligned, testing whether alignment reduces WebGPU copy/map overhead despite slightly higher readback bytes.","rollback_reason":"Primary metric regressed to 13.38 ms/eval and readback wait rose; increasing readback bytes from 7444 to 7680 for 256-byte alignment did not improve b4 fence/readback behavior.","next_action_hint":"Do not revisit simple stride padding; alignment is not the bottleneck. Focus future work on attribution or more substantial readback/fence reductions.","artifact":"/tmp/lc0_autoresearch/20260605_110409_8197_rep1.json"}}
{"run":26,"commit":"pending","metric":12.729999999205273,"metrics":{"evals_per_second":78.55459544873759,"visits_per_position":22,"evals_per_position":21.75,"total_eval_ms":12.49968275,"readback_synced_ms":10.00318,"readback_map_async_ms":10.07608075,"readback_map_wait_ms":9.999068999999999,"readback_overlap_hidden_ms":0.02108125,"legal_priors_prep_ms":0.02108125,"readback_bytes":7444,"readback_maps":0.29889075,"dispatch_count":159},"status":"discard","description":"pack WDL into mapped-policy buffer to reduce head readback copy commands","timestamp":1780682864680,"segment":0,"confidence":1.087500131945497,"asi":{"hypothesis":"Write the WDL softmax output into the tail of an enlarged mapped-policy buffer so the standard WGSL-head path can copy policy+WDL to readback with one copyBufferToBuffer per slot instead of two, preserving readback shape and search semantics.","rollback_reason":"Primary metric regressed to 12.73 ms/eval and readback wait stayed high; reducing per-slot copy commands did not overcome the added shader/buffer complexity or the dominant fence variability.","next_action_hint":"Do not pursue simple copy-command packing further. Focus on attribution or substantial reductions in GPU work/readback dependence rather than copy-command count micro-optimizations.","artifact":"/tmp/lc0_autoresearch/20260605_110728_9037_rep1.json"}}
{"run":27,"commit":"pending","metric":12.960602408432099,"metrics":{"evals_per_second":77.15690740959737,"visits_per_position":21,"evals_per_position":20.75,"total_eval_ms":12.7397635,"readback_synced_ms":10.282390999999999,"readback_map_async_ms":10.2824205,"readback_map_wait_ms":10.27714175,"readback_overlap_hidden_ms":0,"legal_priors_prep_ms":0.02417925,"readback_bytes":1036,"readback_maps":0.300974,"dispatch_count":160},"status":"discard","description":"compact JS legal-prior readback with one GPU logits-gather dispatch","timestamp":1780683087213,"segment":0,"confidence":1.108718997779287,"asi":{"hypothesis":"Replace full mapped-policy readback for the JS legal-prior batch path with a single WGSL gather dispatch that copies only legal-move logits plus WDL to the readback buffer, preserving CPU legal-prior normalization and search semantics while reducing readback bytes.","rollback_reason":"Primary metric regressed to 12.96 ms/eval despite reducing readback bytes from 7444 to 1036; the extra dispatch and unchanged fence/map latency outweighed byte reduction, and readback wait remained dominant.","next_action_hint":"Avoid compact readback designs that add a dispatch unless timestamp evidence shows GPU work can be hidden. Next focus should be WDL-vs-policy/fence attribution or stronger no-code repeated baselines rather than more byte-only reductions.","artifact":"/tmp/lc0_autoresearch/20260605_111109_10164_rep1.json"}}
{"type":"config","name":"LC0 WGSL-head readback b4 stronger loop","metricName":"hybrid_b4_ms_per_eval","metricUnit":"ms","bestDirection":"lower"}
{"run":28,"commit":"1fcf310","metric":11.648955740044887,"metrics":{"evals_per_second":85.84460464231678,"visits_per_position":45,"evals_per_position":45.1875,"total_eval_ms":11.620926062499999,"readback_synced_ms":9.2374935625,"readback_map_async_ms":9.2782965,"readback_map_wait_ms":9.2344953125,"readback_overlap_hidden_ms":0.011211437500000001,"legal_priors_prep_ms":0.011211437500000001,"readback_bytes":7444,"readback_maps":0.27118581249999996,"dispatch_count":159},"status":"keep","description":"switch autoresearch loop to stronger 16-position 500ms 3-rep median baseline","timestamp":1780683200475,"segment":1,"confidence":null,"asi":{"hypothesis":"Improve experiment quality by changing the autoresearch default workload from noisy 4-position/250ms/1-rep screening to a 16-position/500ms/3-rep median baseline before making more code changes, reducing false keeps without changing search semantics or stable runtime defaults.","next_action_hint":"Use this stronger baseline for future keep/discard decisions, then prioritize benchmark-only attribution modes (no-readback queue completion, WDL-only, policy-only, full readback, sanity-scan toggles) to guide structural work.","artifact":"/tmp/lc0_autoresearch/20260605_111235_10652_rep3.json"}}
{"run":29,"commit":"pending","metric":12.501806596676627,"metrics":{"evals_per_second":79.98843945208938,"visits_per_position":41.5,"evals_per_position":41.6875,"total_eval_ms":12.439794249999998,"readback_synced_ms":9.229079312500001,"readback_map_async_ms":9.2807831875,"readback_map_wait_ms":9.22570025,"readback_overlap_hidden_ms":0.013871624999999999,"legal_priors_prep_ms":0.013871624999999999,"readback_bytes":7444,"readback_maps":0.2729268125,"dispatch_count":159},"status":"discard","description":"five-rep unchanged confirmation of stronger benchmark baseline","timestamp":1780683299505,"segment":1,"confidence":null,"asi":{"hypothesis":"Before more code changes, run an unchanged LC0_AR_REPS=5 confirmation under the new 16-position/500ms workload to quantify remaining full-search variance and avoid false keeps from noisy 3-rep medians.","rollback_reason":"No implementation change and primary metric was worse than the new 3-rep baseline (12.50 vs 11.65 ms/eval); this is calibration data, not an optimization to keep.","next_action_hint":"Proceed with benchmark-only attribution modes rather than hot-path micro-optimizations; account for residual search-output variance when evaluating future changes.","artifact":"/tmp/lc0_autoresearch/20260605_111352_11317_rep5.json"}}
{"run":30,"commit":"pending","metric":0,"metrics":{"evals_per_second":0,"visits_per_position":0,"evals_per_position":0,"total_eval_ms":0,"readback_synced_ms":0,"readback_map_async_ms":0,"readback_map_wait_ms":0,"readback_overlap_hidden_ms":0,"legal_priors_prep_ms":0,"readback_bytes":0,"readback_maps":0,"dispatch_count":0},"status":"crash","description":"exploratory scheduler sweep depth2 on stronger WGSL b4 workload","timestamp":1780683505948,"segment":1,"confidence":null,"asi":{"hypothesis":"Explore batchPipelineDepth=2 under the stronger 16-position/500ms/3-rep WGSL b4 workload as a scheduler/deferred-readback lane to test whether overlapping batches hides the command/fence floor. This is speed/quality exploration only, not parity-preserving promotion evidence.","rollback_reason":"The benchmark command failed before emitting metrics, likely due the default 120s per-runtime timeout under depth=2; no performance data collected.","next_action_hint":"If retrying scheduler sweeps, raise LC0_AR_TIMEOUT_MS (for example 240000) and consider one smaller screening point first; still treat batchPipelineDepth>1 as speculative semantics, not a keepable parity optimization.","error":"LC0_AR_PIPELINE_DEPTH=2 ./autoresearch.sh exited with code 1 after 122.3s and emitted no METRIC lines."}}
{"run":31,"commit":"pending","metric":0,"metrics":{"evals_per_second":0,"visits_per_position":0,"evals_per_position":0,"total_eval_ms":0,"readback_synced_ms":0,"readback_map_async_ms":0,"readback_map_wait_ms":0,"readback_overlap_hidden_ms":0,"legal_priors_prep_ms":0,"readback_bytes":0,"readback_maps":0,"dispatch_count":0},"status":"crash","description":"retry exploratory scheduler sweep depth2 with raised browser timeout","timestamp":1780683786256,"segment":1,"confidence":null,"asi":{"hypothesis":"Retry batchPipelineDepth=2 under the stronger 16-position/500ms/3-rep WGSL b4 workload with LC0_AR_TIMEOUT_MS raised to 240000 to determine whether the previous failure was only the default browser timeout. This remains speculative scheduler exploration, not parity-preserving promotion evidence.","rollback_reason":"The benchmark still failed before emitting METRIC lines after 242.6s, so depth=2 is too slow/hung for this stronger fixed-suite configuration or needs a separate smaller scheduler-sweep harness.","next_action_hint":"Stop retrying full-strength depth=2 in this loop. If scheduler exploration continues, use a separate small screening matrix or dedicated timeout-aware script; otherwise prioritize benchmark-only attribution modes at batchPipelineDepth=1.","error":"LC0_AR_PIPELINE_DEPTH=2 LC0_AR_TIMEOUT_MS=240000 ./autoresearch.sh exited with code 1 after 242.6s and emitted no metrics."}}
{"run":32,"commit":"pending","metric":11.603845089962538,"metrics":{"evals_per_second":86.17833073840426,"visits_per_position":45,"evals_per_position":45.1875,"total_eval_ms":11.496694250000001,"readback_synced_ms":8.395230375,"readback_map_async_ms":8.4445884375,"readback_map_wait_ms":8.391836625,"readback_overlap_hidden_ms":0.012977812500000001,"legal_priors_prep_ms":0.012977812500000001,"readback_bytes":7444,"readback_maps":0.27116349999999995,"dispatch_count":159},"status":"discard","description":"unchanged stronger-loop rerun after failed depth2 scheduler probes","timestamp":1780683927855,"segment":1,"confidence":null,"asi":{"hypothesis":"Run an unchanged 16-position/500ms/3-rep baseline after the failed full-strength depth2 scheduler probes to recalibrate stronger-loop variance before making more code changes or adding attribution modes.","rollback_reason":"No implementation changed; the marginal primary improvement versus the 11.65 ms/eval baseline is small and should be treated as benchmark variance, not a keepable optimization.","next_action_hint":"Do not treat tiny unchanged improvements as signal. Next iteration should either add/run benchmark-only attribution through autoresearch.sh or use a dedicated smaller scheduler-sweep harness rather than changing runtime hot paths.","artifact":"/tmp/lc0_autoresearch/20260605_112439_15137_rep3.json"}}
