{"run":70,"commit":"9b043f1","metric":8.52924819758697,"metrics":{"evals_per_second":117.24362767200424,"visits_per_position":60.5,"evals_per_position":60.6875,"total_eval_ms":8.3418795,"readback_synced_ms":8.210749875,"readback_map_async_ms":8.248852937499999,"readback_map_wait_ms":8.207298,"readback_overlap_hidden_ms":0.010506062500000002,"legal_priors_prep_ms":0.010506062500000002,"readback_bytes":7444,"readback_maps":0.26565968749999996,"dispatch_count":160},"status":"discard","description":"default 16-position JS-legal mixed-tvm-ffn control under readback-matrix branch","timestamp":1780691113817,"segment":2,"confidence":1.872473339320321,"asi":{"hypothesis":"Run a default 16-position, 3-repetition mixed-tvm-ffn JS-legal control under the current readback-matrix branch to recalibrate the robust JS-legal candidate after mixed 32-position GPU-legal evidence and avoid over-promoting the low-confidence GPU-legal keep.","rollback_reason":"No implementation changed and the default JS-legal control regressed to 8.53 ms/eval, slower than the mixed-tvm-ffn JS-legal keep/confirmations and slower than the current GPU-legal keep at 7.50 ms/eval. This is calibration evidence, not a new optimization.","next_action_hint":"Do not infer a preference from this noisy single control alone. If continuing comparisons, run an adjacent default GPU-legal control under the same branch or move to readback-matrix attribution/lifecycle validation; keep GPU legal and TVM paths opt-in and stable defaults unchanged.","artifact":"/tmp/lc0_autoresearch/20260605_132425_35521_rep3.json","input_backend":"wasm","encoder_kernel":"mixed-tvm-ffn","legal_priors_backend":"js","batch_size":4,"batch_pipeline_depth":1,"max_positions":16,"reps":3,"comparison_current_gpu_legal_keep_ms_per_eval":7.496654578424645,"comparison_recent_js_legal_32pos_ms_per_eval":7.663285980460029,"control_run":true,"defaults_changed":false}}
{"run":71,"commit":"9b043f1","metric":0,"metrics":{"evals_per_second":0,"visits_per_position":0,"evals_per_position":0,"total_eval_ms":0,"readback_synced_ms":0,"readback_map_async_ms":0,"readback_map_wait_ms":0,"readback_overlap_hidden_ms":0,"legal_priors_prep_ms":0,"readback_bytes":0,"readback_maps":0,"dispatch_count":0},"status":"crash","description":"aborted default GPU-legal control before readback matrix request","timestamp":1780691177391,"segment":2,"confidence":1.872473339320321,"asi":{"hypothesis":"Run an adjacent default 16-position, 3-repetition mixed-tvm-ffn GPU-legal control under the current branch to compare against the immediately preceding JS-legal control.","rollback_reason":"The experiment was aborted by a follow-up user request before metrics were emitted, so no performance or correctness conclusion can be drawn.","next_action_hint":"Follow the user's requested readback-strategy matrix diagnostics next; if returning to fixed-suite controls, rerun the adjacent GPU-legal default control from a clean state.","input_backend":"wasm","encoder_kernel":"mixed-tvm-ffn","legal_priors_backend":"gpu","batch_size":4,"batch_pipeline_depth":1,"aborted":true}}
{"run":72,"commit":"9b043f1","metric":10.769725765348698,"metrics":{"evals_per_second":92.85287497453956,"visits_per_position":48,"evals_per_position":49,"total_eval_ms":19.658207,"readback_synced_ms":10.915972125000001,"readback_map_async_ms":19.573245937499998,"readback_map_wait_ms":10.91177725,"readback_overlap_hidden_ms":0.0199850625,"legal_priors_prep_ms":0.0199850625,"readback_bytes":7444,"readback_maps":0.5208975625000001,"dispatch_count":160},"status":"discard","description":"fixed-suite depth2 b2 check after readback-matrix pipe2 signal","timestamp":1780691475506,"segment":2,"confidence":1.745011542482258,"asi":{"hypothesis":"After the fixed-FEN readback matrix showed speculative pipe2 batch=2 had lower search readback wait and higher visits/sec than pipe2 batch=4, run the normal fixed-suite harness with mixed-tvm-ffn, JS legal priors, batchSize=2, batchPipelineDepth=2 to see whether that signal transfers beyond the short fixed-visit matrix.","rollback_reason":"The default fixed-suite metric regressed to 10.77 ms/eval versus the depth1 b4 lane baseline and mixed-tvm-ffn candidates. Depth2 is also speculative search semantics and not promotion evidence; the matrix pipe2 b2 signal did not transfer to this full-search workload.","next_action_hint":"Do not promote or prioritize batchPipelineDepth=2 b2 for fixed-suite throughput. If scheduler work continues, keep it in a dedicated fixed-visit/readback matrix lane; for parity-preserving optimization return to depth1 mixed-tvm-ffn JS/GPU legal comparisons, lifecycle validation, or documentation updates.","artifact":"/tmp/lc0_autoresearch/20260605_133024_47722_rep3.json","input_backend":"wasm","encoder_kernel":"mixed-tvm-ffn","legal_priors_backend":"js","batch_size":2,"batch_pipeline_depth":2,"timeout_ms":240000,"speculative_scheduler":true,"non_comparable_to_depth1_primary":true,"matrix_context":{"pipe2_b2_visits_per_second_median":200.236,"pipe2_b2_search_readback_synced_ms_median":8.6357,"pipe2_b4_visits_per_second_median":170.7305,"pipe2_b4_search_readback_synced_ms_median":18.50755},"defaults_changed":false}}
{"run":73,"commit":"9b043f1","metric":8.00637172279733,"metrics":{"evals_per_second":124.90052106281821,"visits_per_position":65.75,"evals_per_position":66.75,"total_eval_ms":17.015058874999998,"readback_synced_ms":9.3860226875,"readback_map_async_ms":16.905374625,"readback_map_wait_ms":9.383940187499999,"readback_overlap_hidden_ms":0.010108625000000001,"legal_priors_prep_ms":0.010108625000000001,"readback_bytes":7444,"readback_maps":0.27728093749999994,"dispatch_count":160},"status":"discard","description":"fixed-suite depth2 b4 check after readback-matrix pipe2 signal","timestamp":1780691550190,"segment":2,"confidence":1.872473339320321,"asi":{"hypothesis":"After the fixed-FEN readback matrix showed speculative pipe2 batch=4 improved visits/sec and lowered search readback wait versus pipe1, run the normal fixed-suite harness with mixed-tvm-ffn, JS legal priors, batchSize=4, batchPipelineDepth=2 to see whether the now-preallocated depth2 path transfers beyond the short fixed-visit matrix.","rollback_reason":"The fixed-suite depth2 b4 metric was 8.01 ms/eval, slower than the current depth1 mixed-tvm-ffn candidates and not comparable as promotion evidence because batchPipelineDepth=2 changes search scheduling semantics. Total eval/mapAsync timing also roughly doubled, so the matrix overlap signal did not produce a robust full-search win.","next_action_hint":"Stop treating fixed-suite depth2 as a near-term parity optimization: b2 depth2 regressed badly and b4 depth2 is only a speculative/noisy diagnostic. Return to depth1 mixed-tvm-ffn JS/GPU legal evidence, readback-matrix attribution, lifecycle validation, or documentation updates rather than more depth2 fixed-suite retries.","artifact":"/tmp/lc0_autoresearch/20260605_133136_48365_rep3.json","input_backend":"wasm","encoder_kernel":"mixed-tvm-ffn","legal_priors_backend":"js","batch_size":4,"batch_pipeline_depth":2,"timeout_ms":240000,"speculative_scheduler":true,"non_comparable_to_depth1_primary":true,"matrix_context":{"pipe2_b4_visits_per_second_median":170.7305,"pipe2_b4_search_readback_synced_ms_median":18.50755,"pipe1_b4_visits_per_second_median":150.359,"pipe1_b4_search_readback_synced_ms_median":22.37555},"defaults_changed":false}}
{"run":74,"commit":"9b043f1","metric":12.010937053076015,"metrics":{"evals_per_second":83.25745073685977,"visits_per_position":43.5,"evals_per_position":43.6875,"total_eval_ms":12.448373437499999,"readback_synced_ms":12.300488875000001,"readback_map_async_ms":12.3012345625,"readback_map_wait_ms":12.296842937500001,"readback_overlap_hidden_ms":0,"legal_priors_prep_ms":0,"readback_bytes":3084,"readback_maps":0.2727820000000001,"dispatch_count":161},"status":"discard","description":"default 16-position GPU-legal mixed-tvm-ffn control after depth2 checks","timestamp":1780691626958,"segment":2,"confidence":1.745011542482258,"asi":{"hypothesis":"Run the adjacent default 16-position, 3-repetition mixed-tvm-ffn GPU-legal control that was previously aborted, under the current readback-matrix branch, to compare against the recent noisy JS-legal control and avoid overfitting the earlier 7.50 GPU-legal keep.","rollback_reason":"No implementation changed and the default GPU-legal control regressed badly to 12.01 ms/eval. This is calibration/control evidence showing the GPU-legal speed signal is highly unstable; byte reduction to 3084 did not imply lower E2E time in this run.","next_action_hint":"Treat GPU legal priors as low-confidence opt-in only and do not build further optimization decisions on it without a larger alternating matrix. Favor mixed-tvm-ffn with JS legal as the more robust depth1 candidate, or move to lifecycle/docs/readback-matrix attribution rather than more single-run GPU-legal toggles.","artifact":"/tmp/lc0_autoresearch/20260605_133258_49030_rep3.json","input_backend":"wasm","encoder_kernel":"mixed-tvm-ffn","legal_priors_backend":"gpu","batch_size":4,"batch_pipeline_depth":1,"max_positions":16,"reps":3,"comparison_recent_js_legal_default_control_ms_per_eval":8.52924819758697,"comparison_gpu_legal_keep_ms_per_eval":7.496654578424645,"readback_bytes":3084,"dispatch_count":161,"control_run":true,"defaults_changed":false}}
{"run":75,"commit":"9b043f1","metric":11.157630522008562,"metrics":{"evals_per_second":89.6247637907966,"visits_per_position":46.5,"evals_per_position":46.6875,"total_eval_ms":10.898706999999998,"readback_synced_ms":10.6595184375,"readback_map_async_ms":10.732751937500002,"readback_map_wait_ms":10.655273125,"readback_overlap_hidden_ms":0.0171291875,"legal_priors_prep_ms":0.0171291875,"readback_bytes":7444,"readback_maps":0.27051156249999997,"dispatch_count":160},"status":"discard","description":"five-rep JS-legal mixed-tvm-ffn recalibration after GPU/depth2 noise","timestamp":1780691727669,"segment":2,"confidence":1.7051166859587548,"asi":{"hypothesis":"Run a five-repetition default 16-position mixed-tvm-ffn JS-legal control after the noisy GPU-legal and depth2 fixed-suite checks to recalibrate the robust depth1 candidate without changing code or defaults.","rollback_reason":"No implementation changed and the five-rep JS-legal metric regressed badly to 11.16 ms/eval, slower than prior mixed-tvm-ffn JS-legal confirmations and the WASM-input hand baseline. This is calibration/noise evidence rather than an optimization; readback wait rose materially despite unchanged readback bytes and dispatch count.","next_action_hint":"Current browser/GPU conditions appear noisy or degraded. Before drawing further conclusions, run a plain hand-kernel or mixed-tvm-ffn 3-rep control, or inspect artifacts/logs for lifecycle/readback regressions. Avoid adding new micro-optimizations based on this noisy window.","artifact":"/tmp/lc0_autoresearch/20260605_133414_49693_rep5.json","input_backend":"wasm","encoder_kernel":"mixed-tvm-ffn","legal_priors_backend":"js","batch_size":4,"batch_pipeline_depth":1,"max_positions":16,"reps":5,"control_run":true,"defaults_changed":false,"noise_note":"Both recent GPU-legal and JS-legal depth1 controls regressed substantially; readback wait dominated, suggesting environmental variance or degraded browser/GPU state rather than a semantic change."}}
{"run":76,"commit":"9b043f1","metric":15.394514388532093,"metrics":{"evals_per_second":64.95820360172807,"visits_per_position":34.5,"evals_per_position":34.75,"total_eval_ms":16.341295312499998,"readback_synced_ms":16.086019124999996,"readback_map_async_ms":16.160791500000002,"readback_map_wait_ms":16.0814744375,"readback_overlap_hidden_ms":0.0204905625,"legal_priors_prep_ms":0.0204905625,"readback_bytes":7444,"readback_maps":0.278238375,"dispatch_count":160},"status":"discard","description":"hand-kernel depth1 control to diagnose degraded browser/GPU window","timestamp":1780691805655,"segment":2,"confidence":1.5484051768170566,"asi":{"hypothesis":"Run a plain hand-kernel, JS-legal, WASM-input b4/depth1 fixed-suite control after multiple degraded mixed-tvm-ffn/GPU-legal controls, to determine whether the slowdown is environmental/browser-GPU state rather than a mixed-kernel-specific regression.","rollback_reason":"No implementation changed and the hand-kernel control regressed severely to 15.39 ms/eval with readback wait around 16.08 ms, far slower than the original hand baseline and recent mixed-tvm-ffn controls. This supports the diagnosis that current browser/GPU conditions are degraded/noisy rather than an actionable optimization signal.","next_action_hint":"Do not make keep/discard decisions for new code from this degraded window. Consider clearing browser/GPU state more aggressively, inspecting artifacts/logs, running a short readback matrix/control after cooldown, or documenting noise; avoid hot-path micro-optimizations based on these inflated readback waits.","artifact":"/tmp/lc0_autoresearch/20260605_133545_51799_rep3.json","input_backend":"wasm","encoder_kernel":"hand","legal_priors_backend":"js","batch_size":4,"batch_pipeline_depth":1,"max_positions":16,"reps":3,"control_run":true,"defaults_changed":false,"noise_note":"Recent JS-legal mixed, GPU-legal mixed, and now hand controls all show large readback-wait inflation, indicating environmental variance/degraded WebGPU state."}}
{"run":77,"commit":"dfbed23","metric":11.660618982092057,"metrics":{"evals_per_second":85.75874072686558,"visits_per_position":45.25,"evals_per_position":45.4375,"total_eval_ms":11.318934250000002,"readback_synced_ms":10.947574000000001,"readback_map_async_ms":11.0509230625,"readback_map_wait_ms":10.9419420625,"readback_overlap_hidden_ms":0.026452625000000007,"legal_priors_prep_ms":0.026452625000000007,"readback_bytes":7444,"readback_maps":0.27083043749999997,"dispatch_count":160},"status":"discard","description":"post-cleanup mixed-tvm-ffn JS-legal control in degraded window","timestamp":1780691913291,"segment":2,"confidence":1.4180747238459475,"asi":{"hypothesis":"After aggressively clearing known lc0 autoresearch/readback-matrix browser/server sessions and waiting briefly, rerun the default 16-position mixed-tvm-ffn JS-legal depth1 control to test whether the recent inflated readback waits were due to stale browser/session state.","rollback_reason":"No implementation changed and the post-cleanup control still regressed to 11.66 ms/eval with readback wait around 10.94 ms, so the degraded/noisy WebGPU window persists and this is not a keepable optimization signal.","next_action_hint":"Avoid new hot-path changes while readback waits remain inflated. Consider a longer cooldown, browser/GPU process inspection, lifecycle smoke, or documenting the degraded window; if continuing benchmarks, use controls only until the hand/mixed depth1 path returns near prior baselines.","artifact":"/tmp/lc0_autoresearch/20260605_133719_52556_rep3.json","input_backend":"wasm","encoder_kernel":"mixed-tvm-ffn","legal_priors_backend":"js","batch_size":4,"batch_pipeline_depth":1,"max_positions":16,"reps":3,"control_run":true,"cleanup_before_run":"killed Vite listeners and lc0-autoresearch/readback-matrix command-line sessions; waited 5s","defaults_changed":false,"noise_note":"Third consecutive depth1 control after cleanup remains much slower than historical mixed-tvm-ffn JS-legal evidence; readback wait is inflated despite unchanged bytes/maps/dispatch."}}
{"run":78,"commit":"dfbed23","metric":17.718253275322603,"metrics":{"evals_per_second":56.438971972071705,"visits_per_position":27.625,"evals_per_position":28.625,"total_eval_ms":19.812477937500002,"readback_synced_ms":0.012971937499999999,"readback_map_async_ms":0,"readback_map_wait_ms":0,"readback_overlap_hidden_ms":0,"legal_priors_prep_ms":0,"readback_bytes":7448,"readback_maps":0,"dispatch_count":0},"status":"discard","description":"ONNX b1 control during degraded WebGPU window","timestamp":1780692001193,"segment":2,"confidence":1.4102869951268608,"asi":{"hypothesis":"Run a default 16-position ONNX b1 control during the degraded browser/GPU window to determine whether the slowdown is limited to custom WGSL-head readback or affects the broader browser/WebGPU inference/search environment.","rollback_reason":"No implementation changed and this used LC0_AR_RUNTIME=onnx with batchSize=1, so it is a diagnostic/non-comparable control rather than a keepable hybrid b4 optimization. The ONNX control was also very slow (17.72 ms/eval, 56.44 eval/s), suggesting the degraded window affects broader browser/WebGPU runtime conditions rather than only mixed-tvm-ffn or WGSL legal-prior paths.","next_action_hint":"Pause hot-path optimization decisions until controls recover. Consider longer cooldown or browser/GPU process reset; if continuing, run only no-code controls/lifecycle diagnostics and document the noisy/degraded interval. Do not use this window to discard previously supported mixed-tvm-ffn evidence.","artifact":"/tmp/lc0_autoresearch/20260605_133853_53343_rep3.json","runtime":"onnx","batch_size":1,"max_positions":16,"reps":3,"diagnostic_control":true,"non_comparable_to_default_primary":true,"defaults_changed":false,"noise_note":"ONNX b1 also regressed severely during the same interval where WGSL hand/mixed depth1 controls had inflated readback waits, pointing to environment/browser/GPU state rather than a specific WGSL hot-path regression."}}
{"run":79,"commit":"dfbed23","metric":10.378430884252598,"metrics":{"evals_per_second":96.35367919801057,"visits_per_position":50,"evals_per_position":50.1875,"total_eval_ms":10.273074562500002,"readback_synced_ms":10.0867854375,"readback_map_async_ms":10.140995000000002,"readback_map_wait_ms":10.08299375,"readback_overlap_hidden_ms":0.010283625000000003,"legal_priors_prep_ms":0.010283625000000003,"readback_bytes":7444,"readback_maps":0.26907268749999996,"dispatch_count":160},"status":"discard","description":"post-cooldown mixed-tvm-ffn JS-legal control in degraded window","timestamp":1780692102511,"segment":2,"confidence":1.3828060028217015,"asi":{"hypothesis":"After confirming the degraded window affects both WGSL and ONNX, wait briefly and rerun the default 16-position mixed-tvm-ffn JS-legal depth1 control to see whether browser/WebGPU conditions have recovered enough for reliable optimization decisions.","rollback_reason":"No implementation changed and the post-cooldown control still regressed to 10.38 ms/eval with readback wait around 10.08 ms, far slower than historical mixed-tvm-ffn JS-legal evidence. This remains calibration/noise evidence, not a keepable optimization.","next_action_hint":"Continue avoiding new hot-path optimization decisions until controls recover near baseline. Consider longer cooldown, browser/GPU reset, lifecycle smoke, or documenting the degraded interval; if forced to continue, run only no-code controls or diagnostics rather than benchmark-driven code changes.","artifact":"/tmp/lc0_autoresearch/20260605_134054_54366_rep3.json","input_backend":"wasm","encoder_kernel":"mixed-tvm-ffn","legal_priors_backend":"js","batch_size":4,"batch_pipeline_depth":1,"max_positions":16,"reps":3,"control_run":true,"cooldown_before_run_seconds":30,"defaults_changed":false,"noise_note":"The result is slightly better than the immediately preceding 11.66 ms/eval mixed control but still materially degraded versus prior 7.6-8.0 ms/eval mixed-tvm-ffn JS-legal evidence."}}
{"run":80,"commit":"dfbed23","metric":10.316827757207879,"metrics":{"evals_per_second":96.9290196108341,"visits_per_position":50.25,"evals_per_position":50.4375,"total_eval_ms":10.353430375,"readback_synced_ms":10.1904636875,"readback_map_async_ms":10.234470625000002,"readback_map_wait_ms":10.1872335625,"readback_overlap_hidden_ms":0.010592062499999997,"legal_priors_prep_ms":0.010592062499999997,"readback_bytes":7444,"readback_maps":0.2689740624999999,"dispatch_count":160},"status":"discard","description":"repeat post-cooldown mixed-tvm-ffn JS-legal control in degraded window","timestamp":1780692238838,"segment":2,"confidence":1.3006865936095071,"asi":{"hypothesis":"After another cleanup and longer 60s cooldown, rerun the default 16-position mixed-tvm-ffn JS-legal depth1 control to check whether the degraded browser/WebGPU window is recovering before making further optimization decisions.","rollback_reason":"No implementation changed and the control remained degraded at 10.32 ms/eval with readback wait around 10.19 ms. This is only calibration/noise evidence and remains far slower than historical mixed-tvm-ffn JS-legal evidence around 7.6-8.0 ms/eval.","next_action_hint":"Do not use this window for new code keeps or discards. Continue with no-code controls/diagnostics only, consider a longer browser/GPU reset or lifecycle smoke, and resume optimization only when mixed-tvm-ffn or hand controls return near historical baselines.","artifact":"/tmp/lc0_autoresearch/20260605_134309_55660_rep3.json","input_backend":"wasm","encoder_kernel":"mixed-tvm-ffn","legal_priors_backend":"js","batch_size":4,"batch_pipeline_depth":1,"max_positions":16,"reps":3,"control_run":true,"cooldown_before_run_seconds":60,"cleanup_before_run":"killed Vite listeners and lc0-autoresearch/readback-matrix command-line sessions","defaults_changed":false,"noise_note":"Second post-cooldown mixed control is nearly identical to prior 10.38 ms/eval; degraded readback wait persists rather than recovering."}}
