{"type":"config","name":"LC0 WGSL-head readback b4","metricName":"hybrid_b4_ms_per_eval","metricUnit":"ms","bestDirection":"lower"}
{"run":1,"commit":"a1b5729","metric":11.21352631543812,"metrics":{"evals_per_second":89.17801339827055,"visits_per_position":24,"evals_per_position":23.75,"total_eval_ms":11.067112499999999,"readback_synced_ms":8.65555575,"readback_map_async_ms":8.7135585,"readback_map_wait_ms":8.64888125,"readback_overlap_hidden_ms":0.01826625,"legal_priors_prep_ms":0.01826625,"readback_bytes":7444,"readback_maps":0.29483975,"dispatch_count":159},"status":"keep","description":"baseline hybrid-wgsl-heads b4 depth1 4-FEN smoke","timestamp":1780680330657,"segment":0,"confidence":null,"asi":{"hypothesis":"baseline for LC0 hybrid-wgsl-heads batchSize=4 batchPipelineDepth=1 using existing autoresearch.sh; no code change","artifact":"/tmp/lc0_autoresearch/20260605_102514_96986_rep1.json","note":"readback wait dominates total eval time; JS legal-prior prep overlap remains tiny"}}
{"run":2,"commit":"pending","metric":11.536483516404918,"metrics":{"evals_per_second":86.68152635748984,"visits_per_position":23,"evals_per_position":22.75,"total_eval_ms":11.7683325,"readback_synced_ms":9.2767215,"readback_map_async_ms":9.34409075,"readback_map_wait_ms":9.2681585,"readback_overlap_hidden_ms":0.022055500000000002,"legal_priors_prep_ms":0.022055500000000002,"readback_bytes":7444,"readback_maps":0.299099,"dispatch_count":159},"status":"discard","description":"omit mappedPolicy arrays from evaluator search path","timestamp":1780680432970,"segment":0,"confidence":null,"asi":{"hypothesis":"Avoid Array.from(mappedPolicyF32) allocation in Lc0WebHybridEvaluator search path by returning empty mappedPolicy while computing priors from typed readback data.","rollback_reason":"Primary metric worsened from 11.21 to 11.54 ms/eval; readback wait also worsened, so any allocation saving is below benchmark noise or harmful.","next_action_hint":"Focus on actual readback bytes/backend path rather than mappedPolicy result allocation; consider measuring opt-in GPU legal-prior backend separately before changing defaults.","artifact":"/tmp/lc0_autoresearch/20260605_102655_97537_rep1.json"}}
{"run":3,"commit":"pending","metric":15.224583331909447,"metrics":{"evals_per_second":65.68324256888424,"visits_per_position":18,"evals_per_position":18,"total_eval_ms":15.050326000000002,"readback_synced_ms":12.54079825,"readback_map_async_ms":12.604331,"readback_map_wait_ms":12.5321165,"readback_overlap_hidden_ms":0.021208,"legal_priors_prep_ms":0.021208,"readback_bytes":7444,"readback_maps":0.30641625,"dispatch_count":159},"status":"discard","description":"use subarray views for batched WGSL readback slices","timestamp":1780680486317,"segment":0,"confidence":null,"asi":{"hypothesis":"Replace per-slot Float32Array.slice copies with subarray views in finishWgslBatch to reduce CPU copying after readback.","rollback_reason":"Primary metric regressed badly to 15.22 ms/eval; readback wait increased, so this did not produce a reliable E2E gain on the fast workload.","next_action_hint":"Do not revisit slice-vs-subarray without a focused microbench; main bottleneck remains GPU completion/fence variability rather than this CPU copy.","artifact":"/tmp/lc0_autoresearch/20260605_102751_97904_rep1.json"}}
{"run":4,"commit":"ceea73a","metric":11.487417582627181,"metrics":{"evals_per_second":87.05176710145321,"visits_per_position":23,"evals_per_position":22.75,"total_eval_ms":11.600125499999999,"readback_synced_ms":9.128352,"readback_map_async_ms":9.19804175,"readback_map_wait_ms":9.12118475,"readback_overlap_hidden_ms":0.0233185,"legal_priors_prep_ms":0.0233185,"readback_bytes":7444,"readback_maps":0.29796475,"dispatch_count":159},"status":"discard","description":"unchanged rerun to estimate fast-loop noise","timestamp":1780680506923,"segment":0,"confidence":null,"asi":{"hypothesis":"No code change; rerun baseline workload to characterize benchmark noise after two discarded micro-optimizations.","rollback_reason":"Unchanged rerun was slower than best baseline (11.49 vs 11.21 ms/eval), confirming fast-loop readback timing has noticeable run-to-run noise.","next_action_hint":"Require clear primary improvements or repeated confirmation before keeping tiny changes; consider using LC0_AR_REPS=2 for promising candidates.","artifact":"/tmp/lc0_autoresearch/20260605_102812_98165_rep1.json"}}
{"run":5,"commit":"pending","metric":13.626708859884287,"metrics":{"evals_per_second":73.38529136289858,"visits_per_position":20,"evals_per_position":19.75,"total_eval_ms":13.91075725,"readback_synced_ms":11.388939749999999,"readback_map_async_ms":11.3865415,"readback_map_wait_ms":11.381403,"readback_overlap_hidden_ms":0,"legal_priors_prep_ms":0,"readback_bytes":3084,"readback_maps":0.3046015,"dispatch_count":160},"status":"discard","description":"benchmark opt-in GPU legal-prior backend in arena fixed suite","timestamp":1780680628930,"segment":0,"confidence":null,"asi":{"hypothesis":"Expose fixed-suite arena legalPriorsBackend param and test opt-in gpu legal priors to reduce readback bytes from full mapped policy to compact legal output.","rollback_reason":"Despite reducing readback bytes from 7444 to 3084, primary metric worsened to 13.63 ms/eval and dispatch_count increased to 160; fence/GPU work dominated over byte reduction.","next_action_hint":"GPU legal-prior path needs deeper shader/fence redesign before E2E use; don't promote or use as fast-loop default. Consider documenting as negative evidence and focus on avoiding extra dispatch/work.","artifact":"/tmp/lc0_autoresearch/20260605_103011_98741_rep1.json"}}
{"run":6,"commit":"6c6e9be","metric":10.12196261693384,"metrics":{"evals_per_second":98.79506947862265,"visits_per_position":27,"evals_per_position":26.75,"total_eval_ms":10.09786675,"readback_synced_ms":7.6378005,"readback_map_async_ms":7.691815,"readback_map_wait_ms":7.63517925,"readback_overlap_hidden_ms":0.015828500000000002,"legal_priors_prep_ms":0.015828500000000002,"readback_bytes":7444,"readback_maps":0.29039400000000004,"dispatch_count":159},"status":"keep","description":"process WGSL batch readback from mapped range without full buffer copy","timestamp":1780680732835,"segment":0,"confidence":1.293006198437329,"asi":{"hypothesis":"Avoid copying the entire mapped WGSL batch readback ArrayBuffer before per-slot postprocessing; process the mapped range view and rely on finally unmap for lifecycle cleanup.","artifact":"/tmp/lc0_autoresearch/20260605_103157_99299_rep1.json","why_keep":"Primary improved 11.21 -> 10.12 ms/eval and readback wait dropped; implementation is small and checks passed.","risk":"Keeps readback buffer mapped through per-slot postprocessing; finally cleanup should unmap on success/error, but lifecycle smoke/auto-review should be run before finalization."}}
{"run":7,"commit":"6c6e9be","metric":13.821518987039976,"metrics":{"evals_per_second":72.35094789058063,"visits_per_position":20,"evals_per_position":19.75,"total_eval_ms":13.773821750000002,"readback_synced_ms":11.29587325,"readback_map_async_ms":11.35563625,"readback_map_wait_ms":11.292493750000002,"readback_overlap_hidden_ms":0.01799325,"legal_priors_prep_ms":0.01799325,"readback_bytes":7444,"readback_maps":0.304099,"dispatch_count":159},"status":"discard","description":"confirmation rerun of mapped-range readback optimization","timestamp":1780680761734,"segment":0,"confidence":0.7716843907449095,"asi":{"hypothesis":"Rerun kept mapped-range readback optimization to estimate whether the prior 10.12 ms/eval result was stable.","rollback_reason":"Confirmation run was much slower (13.82 ms/eval), so the apparent improvement is not yet reliable in the noisy 4-FEN fast loop.","next_action_hint":"Before building on this change, use stronger repeated/median benchmark or targeted lifecycle smoke; consider updating autoresearch.sh to use REPS=2 or 3 if iteration speed allows.","artifact":"/tmp/lc0_autoresearch/20260605_103221_99594_rep1.json"}}
{"run":8,"commit":"6c6e9be","metric":12.077557470949216,"metrics":{"evals_per_second":82.8186266594104,"visits_per_position":22,"evals_per_position":21.75,"total_eval_ms":12.330807499999999,"readback_synced_ms":9.895244000000002,"readback_map_async_ms":9.955226249999999,"readback_map_wait_ms":9.892498875000001,"readback_overlap_hidden_ms":0.01765325,"legal_priors_prep_ms":0.01765325,"readback_bytes":7444,"readback_maps":0.30004800000000004,"dispatch_count":159},"status":"discard","description":"two-rep confirmation of mapped-range readback optimization","timestamp":1780680805714,"segment":0,"confidence":0.9581204836795527,"asi":{"hypothesis":"Use a two-repetition median to confirm the kept mapped-range readback optimization under a less noisy fast loop.","rollback_reason":"Two-rep metric was 12.08 ms/eval, worse than both baseline and the kept single-run result; improvement remains unconfirmed.","next_action_hint":"Treat mapped-range no-copy as suspect despite kept commit; either run stronger A/B manually before finalization or try structurally different readback reductions.","artifact":"/tmp/lc0_autoresearch/20260605_103255_99940_rep2.json"}}
{"run":9,"commit":"pending","metric":13.971018143947617,"metrics":{"evals_per_second":71.58992279848702,"visits_per_position":19.5,"evals_per_position":19.25,"total_eval_ms":14.405783249999999,"readback_synced_ms":11.635639625,"readback_map_async_ms":11.700599125,"readback_map_wait_ms":11.627607625,"readback_overlap_hidden_ms":0.021965,"legal_priors_prep_ms":0.021965,"readback_bytes":7444,"readback_maps":0.30729462500000004,"dispatch_count":159},"status":"discard","description":"restore early unmap/full-copy readback for two-rep stability check","timestamp":1780681466883,"segment":0,"confidence":0.7046204175401152,"asi":{"hypothesis":"Because the kept mapped-range no-copy result was not confirmed, restore the older copy-then-unmap path and run a two-repetition benchmark to test whether earlier unmap/lifecycle behavior is faster or more stable.","rollback_reason":"Two-rep primary metric regressed to 13.97 ms/eval; readback wait also rose to 11.63 ms, so restoring the full-buffer copy path is not a promising fix for the noisy kept change.","next_action_hint":"Continue with structurally different readback reductions rather than toggling copy/no-copy behavior; next candidate is split WDL/policy readback attribution or a compact policy/top-k readback path without extra dispatch.","artifact":"/tmp/lc0_autoresearch/20260605_104403_801_rep2.json"}}
{"run":10,"commit":"pending","metric":14.025047090317345,"metrics":{"evals_per_second":71.46993492573908,"visits_per_position":19.5,"evals_per_position":19.25,"total_eval_ms":14.113284750000002,"readback_synced_ms":11.591062,"readback_map_async_ms":11.64613825,"readback_map_wait_ms":11.572415375,"readback_overlap_hidden_ms":0.0222425,"legal_priors_prep_ms":0.0222425,"readback_bytes":7444,"readback_maps":0.306191125,"dispatch_count":159},"status":"discard","description":"pre-copy per-slot readback slices then unmap before legal-prior postprocess","timestamp":1780681549564,"segment":0,"confidence":0.8772640650591561,"asi":{"hypothesis":"Keep the no-full-buffer-copy approach but copy each slot's policy/WDL slices immediately and unmap the readback buffer before JS legal-prior postprocessing, reducing mapped lifetime without restoring the whole-buffer copy.","rollback_reason":"Two-rep primary metric regressed to 14.03 ms/eval; readback wait remained high, so earlier unmap with per-slot pre-copy did not stabilize or improve the kept no-copy path.","next_action_hint":"Stop toggling mapped lifetime/copy placement; pursue readback shape changes or telemetry split (WDL vs policy) to distinguish fence latency from byte/copy cost.","artifact":"/tmp/lc0_autoresearch/20260605_104528_1338_rep2.json"}}
{"run":11,"commit":"pending","metric":12.854518072432784,"metrics":{"evals_per_second":77.79365934725742,"visits_per_position":21,"evals_per_position":20.75,"total_eval_ms":13.849634,"readback_synced_ms":10.850680500000001,"readback_map_async_ms":10.8511105,"readback_map_wait_ms":10.84595,"readback_overlap_hidden_ms":0.017144,"legal_priors_prep_ms":0.017144,"readback_bytes":142.77636375,"readback_maps":0.3057955,"dispatch_count":159},"status":"discard","description":"compact JS legal-prior readback with per-legal-move buffer copies","timestamp":1780681730756,"segment":0,"confidence":0.9325387767635249,"asi":{"hypothesis":"Avoid full mapped-policy readback for the JS legal-prior path by copying only each legal move's mapped-policy logit plus WDL into the readback buffer, preserving legal-prior semantics without the extra GPU legal-prior dispatch.","rollback_reason":"Primary metric worsened to 12.85 ms/eval even though reported readback bytes dropped from 7444 to about 143 and dispatch count stayed 159; many tiny copyBufferToBuffer commands and/or unchanged fence latency outweighed byte reduction.","next_action_hint":"Byte reduction alone is not enough even without an extra dispatch. Avoid per-legal-move copy-command gather; if compact readback is revisited, it needs an integrated shader/top-k design with fewer commands or a separate microbench first.","artifact":"/tmp/lc0_autoresearch/20260605_104834_2201_rep1.json"}}
{"run":12,"commit":"pending","metric":10.124485981241563,"metrics":{"evals_per_second":98.77044640614636,"visits_per_position":27,"evals_per_position":26.75,"total_eval_ms":10.0920085,"readback_synced_ms":7.618619000000001,"readback_map_async_ms":7.674613000000001,"readback_map_wait_ms":7.6153195,"readback_overlap_hidden_ms":0.016300500000000002,"legal_priors_prep_ms":0.016300500000000002,"readback_bytes":7444,"readback_maps":0.29039400000000004,"dispatch_count":159},"status":"discard","description":"avoid Array.from allocation for three-value WDL readback","timestamp":1780681780920,"segment":0,"confidence":0.8370910780464957,"asi":{"hypothesis":"Remove tiny Array.from(wdlF32) allocations in single and batched WGSL-head result handling by reading the three WDL values directly from the Float32Array.","rollback_reason":"Single-run primary metric was 10.1245 ms/eval, effectively tied but slightly worse than the kept 10.122 ms/eval best; the change is too small and noise-prone to keep.","next_action_hint":"Do not spend more iterations on tiny CPU allocation cleanups unless paired with stronger repeated evidence; focus on readback/fence attribution or larger structural changes.","artifact":"/tmp/lc0_autoresearch/20260605_104924_2585_rep1.json"}}
{"run":13,"commit":"a6ca037","metric":9.863918919284064,"metrics":{"evals_per_second":101.3795843399513,"visits_per_position":28,"evals_per_position":27.75,"total_eval_ms":9.8320595,"readback_synced_ms":7.36059375,"readback_map_async_ms":7.41916475,"readback_map_wait_ms":7.3571997499999995,"readback_overlap_hidden_ms":0.0169415,"legal_priors_prep_ms":0.0169415,"readback_bytes":7444,"readback_maps":0.28927800000000004,"dispatch_count":159},"status":"keep","description":"combine WGSL readback sanity scans into one pass","timestamp":1780681833603,"segment":0,"confidence":0.7738745285958587,"asi":{"hypothesis":"The hot WGSL result sanity checks scan mapped policy and WDL twice (nonzero and variation). Combine those checks into one pass while preserving the zero/uniform validation semantics.","artifact":"/tmp/lc0_autoresearch/20260605_105018_2950_rep1.json","why_keep":"Primary improved from the kept 10.12 ms/eval result to 9.86 ms/eval and checks passed; the code change preserves validation semantics while reducing CPU scanning after readback.","risk":"Single-run improvement may still be readback noise; run a confirmation iteration before building larger changes on this result."}}
{"run":14,"commit":"a6ca037","metric":13.044827586617961,"metrics":{"evals_per_second":76.65873645013524,"visits_per_position":22,"evals_per_position":21.75,"total_eval_ms":13.202147,"readback_synced_ms":10.6869295,"readback_map_async_ms":10.75450125,"readback_map_wait_ms":10.683343749999999,"readback_overlap_hidden_ms":0.02010925,"legal_priors_prep_ms":0.02010925,"readback_bytes":7444,"readback_maps":0.30058725000000003,"dispatch_count":159},"status":"discard","description":"confirmation rerun of combined readback sanity scans","timestamp":1780681853297,"segment":0,"confidence":1.034977905306086,"asi":{"hypothesis":"Rerun the kept combined sanity-scan optimization without code changes to check whether the 9.86 ms/eval result is stable under the noisy fast loop.","rollback_reason":"Confirmation run regressed to 13.04 ms/eval with readback wait at 10.68 ms, so the single-run improvement is not stable enough to treat as strong evidence.","next_action_hint":"Keep the small semantics-preserving scan consolidation for now but require stronger repeated/alternating evidence before finalization; avoid further CPU micro-optimizations based only on single fast-loop wins.","artifact":"/tmp/lc0_autoresearch/20260605_105038_3236_rep1.json"}}
{"run":15,"commit":"a6ca037","metric":13.597469879920222,"metrics":{"evals_per_second":73.58471149781505,"visits_per_position":21,"evals_per_position":20.75,"total_eval_ms":13.585182875000001,"readback_synced_ms":10.787481375,"readback_map_async_ms":10.854640750000002,"readback_map_wait_ms":10.783974125,"readback_overlap_hidden_ms":0.020283375,"legal_priors_prep_ms":0.020283375,"readback_bytes":7444,"readback_maps":0.302404875,"dispatch_count":159},"status":"discard","description":"two-rep confirmation of combined readback sanity scans","timestamp":1780681886440,"segment":0,"confidence":1.152989268555797,"asi":{"hypothesis":"Use a two-repetition run to confirm the kept combined sanity-scan change under a less noisy workload before treating it as reliable.","rollback_reason":"Two-rep metric was 13.60 ms/eval, far worse than the kept 9.86 single-run result, so the apparent improvement is not confirmed.","next_action_hint":"Mark the scan consolidation as low-confidence despite being committed; finalization should either revert it or require stronger alternating evidence. Future iterations should focus on measuring/attributing fence latency rather than CPU scan micro-optimizations.","artifact":"/tmp/lc0_autoresearch/20260605_105108_3522_rep2.json"}}
{"run":16,"commit":"pending","metric":11.240368420826762,"metrics":{"evals_per_second":88.96505546447624,"visits_per_position":24,"evals_per_position":23.75,"total_eval_ms":11.04553425,"readback_synced_ms":8.51646125,"readback_map_async_ms":8.58576925,"readback_map_wait_ms":8.512585,"readback_overlap_hidden_ms":0.01977625,"legal_priors_prep_ms":0.01977625,"readback_bytes":7444,"readback_maps":0.29483975,"dispatch_count":158},"status":"discard","description":"fuse value WDL dense2 and softmax WGSL dispatch","timestamp":1780682036024,"segment":0,"confidence":1.0891920333480938,"asi":{"hypothesis":"Reduce one WGSL-head dispatch per evaluated position by fusing the value head dense2 projection and three-way WDL softmax into a single compute shader, preserving the WDL math and readback shape.","rollback_reason":"Dispatch count dropped from 159 to 158 and checks passed, but the primary metric was 11.24 ms/eval, worse than the kept best and effectively baseline-level; the extra specialized shader did not translate into a reliable E2E gain.","next_action_hint":"Do not assume small dispatch-count reductions overcome readback/fence variability. Next promising path is explicit WDL-vs-policy readback attribution or stronger repeated A/B before keeping kernel micro-fusions.","artifact":"/tmp/lc0_autoresearch/20260605_105338_4311_rep1.json"}}
{"run":17,"commit":"pending","metric":11.302263157618674,"metrics":{"evals_per_second":88.47785492641941,"visits_per_position":24,"evals_per_position":23.75,"total_eval_ms":11.161896,"readback_synced_ms":8.740658,"readback_map_async_ms":8.809787,"readback_map_wait_ms":8.73738025,"readback_overlap_hidden_ms":0.02133875,"legal_priors_prep_ms":0.02133875,"readback_bytes":7444,"readback_maps":0.295974,"dispatch_count":159},"status":"discard","description":"map only active WGSL batch readback bytes","timestamp":1780682088105,"segment":0,"confidence":0.8879507714972549,"asi":{"hypothesis":"When the reusable WGSL batch readback buffer has grown larger than the current batch, map and expose only the active batch byte range instead of mapping the whole buffer capacity.","rollback_reason":"Primary metric was 11.30 ms/eval, worse than kept results and slightly worse than the baseline-level comparison; exact-range mapAsync/getMappedRange did not reduce the dominant fence/readback time on this workload.","next_action_hint":"Partial-batch map range is not a useful lever for b4. Continue with attribution experiments or larger structural reductions, not WebGPU mapping API micro-tuning.","artifact":"/tmp/lc0_autoresearch/20260605_105433_4680_rep1.json"}}
