{"run":46,"commit":"pending","metric":8.819122340577715,"metrics":{"evals_per_second":113.38996800156566,"visits_per_position":58.5,"evals_per_position":58.75,"total_eval_ms":8.582406937500002,"readback_synced_ms":8.429813062500001,"readback_map_async_ms":8.465334687499999,"readback_map_wait_ms":8.4270045,"readback_overlap_hidden_ms":0.0156618125,"legal_priors_prep_ms":0.0156618125,"readback_bytes":7444,"readback_maps":0.265909375,"dispatch_count":160},"status":"discard","description":"WASM-input deferred-readback attribution preflight","timestamp":1780687421721,"segment":2,"confidence":1.3077585628970283,"asi":{"hypothesis":"Run the deferred-readback fixture attribution using the current WASM input backend rather than the old JS-input attribution URL, to see whether double-buffered readback still has a material overlap signal in this lane before investing in a dedicated scheduler/quality harness.","rollback_reason":"The parity-preserving fixed-suite primary was slower than baseline (8.82 vs 8.59 ms/eval), and the attribution preflight is diagnostic rather than a direct b4/depth1 optimization.","next_action_hint":"WASM-input fixture attribution still shows a strong deferred-readback speedup (1.43x with matching best moves), so the next structural path is a dedicated scheduler/quality harness; do not resume fixed-suite depth2 directly because it repeatedly timed out.","artifact":"/tmp/lc0_autoresearch/20260605_122233_59923_rep3.json","deferred_readback_attr_artifact":"/tmp/lc0_autoresearch/20260605_122233_59923_deferred_readback_attr.json","input_backend":"wasm","batch_size":4,"batch_pipeline_depth":1,"attr_immediate_ms_per_eval":7.638802083209158,"attr_deferred_ms_per_eval":5.33911458340784,"attr_deferred_over_immediate_speedup":1.4307245075705939,"attr_all_best_moves_match":true,"benchmark_script_note":"Updated autoresearch.sh attribution preflight to pass LC0_AR_INPUT_BACKEND through to lc0_browser_wgsl_deferred_readback_bench.mjs so future attr runs match the current WASM lane."}}
{"run":47,"commit":"pending","metric":0,"metrics":{"evals_per_second":0,"visits_per_position":0,"evals_per_position":0,"total_eval_ms":0,"readback_synced_ms":0,"readback_map_async_ms":0,"readback_map_wait_ms":0,"readback_overlap_hidden_ms":0,"legal_priors_prep_ms":0,"readback_bytes":0,"readback_maps":0,"dispatch_count":0},"status":"crash","description":"attempt scheduler fixture preflight outside autoresearch.sh rejected","timestamp":1780687470929,"segment":2,"confidence":1.3077585628970283,"asi":{"hypothesis":"Run an existing hybrid search fixture parity scheduler preflight for WASM-input WGSL heads at depths 1/2/4 before the normal primary benchmark, to build a dedicated scheduler/quality signal without using fixed-suite depth2 timeouts as promotion evidence.","rollback_reason":"run_experiment rejected the custom shell command because autoresearch.sh exists and the tool requires experiments to be invoked through autoresearch.sh.","next_action_hint":"Add an opt-in scheduler fixture preflight mode inside autoresearch.sh (for example LC0_AR_SCHEDULER_FIXTURE=1) and then rerun via ./autoresearch.sh so the tool accepts the command.","error":"run_experiment guard: autoresearch.sh exists — you must run it instead of a custom command"}}
{"run":48,"commit":"pending","metric":0,"metrics":{"evals_per_second":0,"visits_per_position":0,"evals_per_position":0,"total_eval_ms":0,"readback_synced_ms":0,"readback_map_async_ms":0,"readback_map_wait_ms":0,"readback_overlap_hidden_ms":0,"legal_priors_prep_ms":0,"readback_bytes":0,"readback_maps":0,"dispatch_count":0},"status":"crash","description":"WASM scheduler fixture preflight depths 1/2/4 timed out","timestamp":1780687763309,"segment":2,"confidence":1.3077585628970283,"asi":{"hypothesis":"Add and run an opt-in scheduler fixture preflight inside autoresearch.sh using the existing hybrid search fixture parity harness for WASM-input WGSL heads at depths 1/2/4, visits=16, fixtureLimit=4, before the normal b4/depth1 primary benchmark.","rollback_reason":"The scheduler fixture preflight timed out before the primary benchmark emitted metrics; no performance data collected. The log shows Vite port 5179 was already in use and the launched server moved to 5180 while the harness URL still targeted 5179, so this may be a port/session issue or another depth>1 hang.","next_action_hint":"Retry the scheduler fixture preflight with an explicit unused port/base URL or a much smaller depths=1,2 fixtureLimit=1 smoke before using larger depth matrices. Keep depth>1 as speculative quality/scheduler evidence only.","error":"agent-browser wait timed out after 12948ms near the 240s script deadline during lc0_browser_hybrid_search_fixture_parity.mjs","artifact":"/var/folders/rq/nfghkvc91vb6cmc094jvnrhw0000gn/T/pi-experiment-6c0e783e583d19fd.log","input_backend":"wasm","batch_size":4,"scheduler_depths":"1,2,4","scheduler_visits":16,"scheduler_fixture_limit":4}}
{"run":49,"commit":"pending","metric":0,"metrics":{"evals_per_second":0,"visits_per_position":0,"evals_per_position":0,"total_eval_ms":0,"readback_synced_ms":0,"readback_map_async_ms":0,"readback_map_wait_ms":0,"readback_overlap_hidden_ms":0,"legal_priors_prep_ms":0,"readback_bytes":0,"readback_maps":0,"dispatch_count":0},"status":"crash","description":"tiny WASM scheduler fixture depth2 smoke still times out","timestamp":1780688058470,"segment":2,"confidence":1.3077585628970283,"asi":{"hypothesis":"Retry the scheduler fixture preflight with the smallest practical WASM-input WGSL-head smoke (visits=8, fixtureLimit=1, depths=1,2) after clearing the stale 5179 Vite listener, to distinguish the prior port conflict from a depth>1 scheduler hang.","rollback_reason":"Even the tiny depth2 scheduler fixture timed out after 240s before the normal depth1 primary benchmark emitted metrics, and the log confirms the server stayed on 5179 this time, so the failure is not just a port mismatch.","next_action_hint":"Stop running depth>1 browser fixture/full-suite preflights in this loop until the scheduler hang is diagnosed. Next promising iteration should use depth1-only attribution or a no-code b4 control, or inspect the pipelined batch scheduler for a logic/liveness issue before benchmarking.","error":"agent-browser wait timed out near the 240s script deadline during lc0_browser_hybrid_search_fixture_parity.mjs with depths=1,2 visits=8 fixtureLimit=1","artifact":"/var/folders/rq/nfghkvc91vb6cmc094jvnrhw0000gn/T/pi-experiment-c527d34592917b11.log","input_backend":"wasm","batch_size":4,"scheduler_depths":"1,2","scheduler_visits":8,"scheduler_fixture_limit":1,"port_conflict_cleared":true}}
{"run":50,"commit":"pending","metric":0,"metrics":{"evals_per_second":0,"visits_per_position":0,"evals_per_position":0,"total_eval_ms":0,"readback_synced_ms":0,"readback_map_async_ms":0,"readback_map_wait_ms":0,"readback_overlap_hidden_ms":0,"legal_priors_prep_ms":0,"readback_bytes":0,"readback_maps":0,"dispatch_count":0},"status":"crash","description":"depth1-only WASM scheduler fixture harness smoke times out","timestamp":1780688237468,"segment":2,"confidence":1.3077585628970283,"asi":{"hypothesis":"Run a depth1-only minimal scheduler fixture preflight (visits=8, fixtureLimit=1, depths=1) after depth2 hangs, to verify whether the hybrid search fixture harness itself works for WASM-input WGSL heads before further scheduler exploration.","rollback_reason":"The depth1-only fixture harness still timed out before the normal fixed-suite primary emitted metrics, so the scheduler fixture preflight path is currently unusable for this WASM/WGSL lane and the run collected no primary metric.","next_action_hint":"Stop using lc0_browser_hybrid_search_fixture_parity.mjs as a preflight for now. Next iteration should either run an unchanged depth1 fixed-suite control to recalibrate after crashes, or inspect/fix the fixture harness/browser wait path separately before reintroducing it.","error":"agent-browser wait timed out near the 120s script deadline during lc0_browser_hybrid_search_fixture_parity.mjs with depths=1 visits=8 fixtureLimit=1","artifact":"/var/folders/rq/nfghkvc91vb6cmc094jvnrhw0000gn/T/pi-experiment-1191ec3f8c289698.log","input_backend":"wasm","batch_size":4,"scheduler_depths":"1","scheduler_visits":8,"scheduler_fixture_limit":1,"port_conflict_cleared":true}}
{"run":51,"commit":"pending","metric":8.596345549603408,"metrics":{"evals_per_second":116.32850194652016,"visits_per_position":59.5,"evals_per_position":59.6875,"total_eval_ms":8.493318187499998,"readback_synced_ms":8.359220437500001,"readback_map_async_ms":8.399175000000001,"readback_map_wait_ms":8.3565395,"readback_overlap_hidden_ms":0.009398625,"legal_priors_prep_ms":0.009398625,"readback_bytes":7444,"readback_maps":0.266018375,"dispatch_count":160},"status":"discard","description":"unchanged WASM-input b4 depth1 control after scheduler harness crashes","timestamp":1780688303657,"segment":2,"confidence":1.7848436815508373,"asi":{"hypothesis":"Run an unchanged parity-preserving WASM-input b4/depth1 fixed-suite control after multiple scheduler fixture crashes, to recalibrate the lane and verify the normal autoresearch path remains healthy before more code changes.","rollback_reason":"No implementation change and the metric was essentially tied but slightly slower than the 8.59 ms/eval lane baseline, so this is calibration evidence rather than a keepable optimization.","next_action_hint":"Normal depth1 fixed-suite path is healthy again. Avoid the broken fixture harness for now; next promising work is depth1-only attribution/readback-shape diagnostics or inspecting the scheduler fixture wait/liveness separately before any depth>1 benchmark retries.","artifact":"/tmp/lc0_autoresearch/20260605_123738_12499_rep3.json","input_backend":"wasm","batch_size":4,"batch_pipeline_depth":1,"control_after_crashes":true}}
{"run":39,"commit":"adb40b0","metric":9.580318655848917,"metrics":{"evals_per_second":104.38066163795985,"visits_per_position":53.75,"evals_per_position":53.9375,"total_eval_ms":9.410559625,"readback_synced_ms":9.254590499999999,"readback_map_async_ms":9.304971187500001,"readback_map_wait_ms":9.251462249999998,"readback_overlap_hidden_ms":0.013117250000000004,"legal_priors_prep_ms":0.013117250000000004,"readback_bytes":7444,"readback_maps":0.267816375,"dispatch_count":160},"status":"discard","description":"unchanged WASM-input b4 depth1 control after scheduler fixture crashes","timestamp":1780688353048,"segment":2,"confidence":null,"asi":{"hypothesis":"Run an unchanged parity-preserving WASM-input hybrid-wgsl-heads b4/depth1 fixed-suite control after several unusable scheduler fixture preflights, to recalibrate current benchmark variance before making further structural changes.","rollback_reason":"No implementation change and primary metric regressed to 9.58 ms/eval versus the WASM lane baseline/best; this is calibration evidence, not a keepable optimization.","next_action_hint":"Avoid more scheduler fixture preflights until their timeout/liveness path is diagnosed. Prefer benchmark-only depth1 attribution modes, or inspect the scheduler/fixture harness separately before reintroducing depth>1 exploration."}}
{"run":52,"commit":"pending","metric":9.378392857166805,"metrics":{"evals_per_second":106.6280774574097,"visits_per_position":57.375,"evals_per_position":56,"total_eval_ms":9.391456250000001,"readback_synced_ms":9.16940125,"readback_map_async_ms":9.232043562500001,"readback_map_wait_ms":9.166380750000002,"readback_overlap_hidden_ms":0.015056999999999997,"legal_priors_prep_ms":0.015056999999999997,"readback_bytes":7444,"readback_maps":0.188996,"dispatch_count":160},"status":"discard","description":"WASM-input depth1 batch-size interpolation b6","timestamp":1780688419454,"segment":2,"confidence":1.187505486730275,"asi":{"hypothesis":"Interpolate the WASM-input depth1 physical batch-size sweep at batchSize=6: it may reduce readback map pressure relative to b4 without the latency/search-throughput penalty observed at b8/b16.","rollback_reason":"Primary metric regressed to 9.38 ms/eval versus the b4 baseline 8.59. Although readback_maps fell to about 0.19, readback wait and total eval time increased, so b6 has the same latency tradeoff pattern as larger batches.","next_action_hint":"Stop batch-size interpolation; b2 increased map pressure, b6/b8/b16 do not robustly beat b4. Return to depth1 readback attribution or inspect the scheduler/fixture liveness issue rather than more batch-size sweeps.","artifact":"/tmp/lc0_autoresearch/20260605_123929_15827_rep3.json","input_backend":"wasm","batch_size":6,"batch_pipeline_depth":1,"readback_map_reduction_without_e2e_gain":true}}
{"run":53,"commit":"pending","metric":9.035102925411671,"metrics":{"evals_per_second":110.6794253762678,"visits_per_position":57.5,"evals_per_position":57.6875,"total_eval_ms":8.84320325,"readback_synced_ms":8.7177915,"readback_map_async_ms":8.719094562499999,"readback_map_wait_ms":8.714734812500001,"readback_overlap_hidden_ms":0,"legal_priors_prep_ms":0,"readback_bytes":7444,"readback_maps":0.2665517499999999,"dispatch_count":160},"status":"discard","description":"opt-in WASM legal-priors backend in WASM-input b4 lane","timestamp":1780688584676,"segment":2,"confidence":1.1613521170119954,"asi":{"hypothesis":"Expose fixed-suite/arena plumbing for opt-in legalPriorsBackend and test legalPriorsBackend=wasm with the current WASM input, WGSL-head, b4/depth1 lane; WASM legal priors might reduce JS legal-prior postprocess without changing stable defaults.","rollback_reason":"Primary metric regressed to 9.04 ms/eval versus the 8.59 b4 baseline. The run eliminated reported legal_priors_prep_ms but readback wait increased and E2E throughput fell, so legal-prior CPU prep is not the limiting lever in this lane.","next_action_hint":"Do not pursue WASM legal priors for b4/depth1 unless telemetry changes. Return to readback/fence attribution or debug scheduler fixture liveness; keep JS legal priors as the lane default.","artifact":"/tmp/lc0_autoresearch/20260605_124215_19087_rep3.json","input_backend":"wasm","legal_priors_backend":"wasm","batch_size":4,"batch_pipeline_depth":1,"plumbing_added":"fixed-suite --legal-priors-backend and arena query parsing were added for this test but should not be kept on a regression"}}
{"run":54,"commit":"ecadf81","metric":7.60110803335107,"metrics":{"evals_per_second":131.55976676194325,"visits_per_position":67.5,"evals_per_position":67.6875,"total_eval_ms":7.527102812500001,"readback_synced_ms":7.3997685,"readback_map_async_ms":7.436232812499999,"readback_map_wait_ms":7.3971480000000005,"readback_overlap_hidden_ms":0.0095538125,"legal_priors_prep_ms":0.0095538125,"readback_bytes":7444,"readback_maps":0.2643348125,"dispatch_count":160},"status":"keep","description":"opt-in mixed-tvm-ffn encoder kernel for WASM-input WGSL-head b4","timestamp":1780688770075,"segment":2,"confidence":4.566046329504982,"asi":{"hypothesis":"Expose opt-in encoderKernel plumbing through the fixed-suite/arena path and run the existing mixed-tvm-ffn encoder kernel with WASM input, WGSL heads, batchSize=4, depth1; reducing FFN encoder GPU work may lower the command/fence floor without changing defaults or search semantics.","next_action_hint":"The mixed-tvm-ffn screen produced a large primary improvement; run a 5-rep confirmation and/or adjacent hand-kernel control before treating it as robust, because this lane has shown noisy single-run wins.","artifact":"/tmp/lc0_autoresearch/20260605_124500_20024_rep3.json","input_backend":"wasm","encoder_kernel":"mixed-tvm-ffn","batch_size":4,"batch_pipeline_depth":1,"defaults_changed":false,"cleanup_note":"Removed the unused broken scheduler fixture preflight block from autoresearch.sh before keeping; retained useful opt-in attribution input-backend and encoder-kernel plumbing."}}
{"run":55,"commit":"ecadf81","metric":8.004607177497576,"metrics":{"evals_per_second":124.92805428493531,"visits_per_position":64.25,"evals_per_position":64.4375,"total_eval_ms":7.911285125,"readback_synced_ms":7.791296625000001,"readback_map_async_ms":7.8263305625,"readback_map_wait_ms":7.788932499999999,"readback_overlap_hidden_ms":0.0099461875,"legal_priors_prep_ms":0.0099461875,"readback_bytes":7444,"readback_maps":0.2649906875,"dispatch_count":160},"status":"discard","description":"five-rep confirmation of mixed-tvm-ffn WASM-input b4","timestamp":1780688862420,"segment":2,"confidence":3.5510340191223104,"asi":{"hypothesis":"Run a five-repetition confirmation of the opt-in mixed-tvm-ffn encoder kernel with WASM input, WGSL heads, batchSize=4, depth1 to test whether the prior 7.60 ms/eval screen is robust under stronger repetition.","rollback_reason":"No implementation change and the confirmation metric (8.00 ms/eval) was slower than the prior mixed-tvm-ffn keep (7.60), so this is confirmation/calibration evidence rather than a new keep. It still remains materially faster than the hand-kernel b4 baseline around 8.59 ms/eval.","next_action_hint":"Mixed-tvm-ffn still looks promising but noisy. Run an adjacent 5-rep hand-kernel control or test the other opt-in TVM variants (mixed-tvm-ffn-outproj, tvm-packed-f16) before changing lane defaults or overclaiming.","artifact":"/tmp/lc0_autoresearch/20260605_124630_20779_rep5.json","input_backend":"wasm","encoder_kernel":"mixed-tvm-ffn","batch_size":4,"batch_pipeline_depth":1,"reps":5,"confirmation_of_commit":"ecadf81"}}
{"run":56,"commit":"ecadf81","metric":9.951676792174323,"metrics":{"evals_per_second":100.48557854957343,"visits_per_position":51.25,"evals_per_position":51.4375,"total_eval_ms":9.866657312500003,"readback_synced_ms":9.734387437499999,"readback_map_async_ms":9.7753035625,"readback_map_wait_ms":9.731789124999999,"readback_overlap_hidden_ms":0.013750124999999997,"legal_priors_prep_ms":0.013750124999999997,"readback_bytes":7444,"readback_maps":0.2687871875,"dispatch_count":160},"status":"discard","description":"adjacent five-rep hand-kernel control for mixed-tvm-ffn comparison","timestamp":1780688948906,"segment":2,"confidence":4.426353848270097,"asi":{"hypothesis":"Run an adjacent five-repetition hand-kernel control under the same WASM-input WGSL-head b4/depth1 workload to compare against the prior five-rep mixed-tvm-ffn confirmation and avoid overfitting to isolated kernel timings.","rollback_reason":"No implementation change and the hand-kernel control regressed to 9.95 ms/eval, so this is calibration evidence rather than a keepable optimization. Adjacent evidence strengthens the case that mixed-tvm-ffn is materially faster than hand under current conditions, though both are noisy.","next_action_hint":"Continue the opt-in encoder-kernel matrix: test mixed-tvm-ffn-outproj and/or tvm-packed-f16 with the same WASM-input b4/depth1 workload before deciding which TVM variant is preferred. Keep defaults unchanged.","artifact":"/tmp/lc0_autoresearch/20260605_124800_21571_rep5.json","input_backend":"wasm","encoder_kernel":"hand","batch_size":4,"batch_pipeline_depth":1,"reps":5,"adjacent_mixed_tvm_ffn_confirmation_ms_per_eval":8.004607177497576,"comparison_note":"hand 5-rep control (9.95 ms/eval) is much slower than adjacent mixed-tvm-ffn 5-rep confirmation (8.00 ms/eval)"}}
{"run":57,"commit":"ecadf81","metric":7.771087768198062,"metrics":{"evals_per_second":128.68211373089113,"visits_per_position":66.5,"evals_per_position":66.6875,"total_eval_ms":7.6407751875,"readback_synced_ms":7.522113625,"readback_map_async_ms":7.556971500000001,"readback_map_wait_ms":7.5198064375000016,"readback_overlap_hidden_ms":0.008964812500000002,"legal_priors_prep_ms":0.008964812500000002,"readback_bytes":7444,"readback_maps":0.26455137500000003,"dispatch_count":160},"status":"discard","description":"WASM-input b4 opt-in mixed-tvm-ffn-outproj encoder kernel screen","timestamp":1780689028895,"segment":2,"confidence":2.9415407400017606,"asi":{"hypothesis":"Screen the opt-in mixed-tvm-ffn-outproj encoder kernel with WASM input, WGSL heads, batchSize=4, depth1 to see whether adding TVM-packed attention output projection on top of mixed-tvm-ffn improves the current mixed-kernel candidate.","rollback_reason":"Primary metric was 7.77 ms/eval, which is faster than the original hand-kernel baseline but slower than the current mixed-tvm-ffn keep at 7.60 ms/eval. The added out-projection TVM kernel did not clearly improve the current best candidate.","next_action_hint":"Prefer mixed-tvm-ffn over mixed-tvm-ffn-outproj unless later repeated evidence contradicts this. Next run should test tvm-packed-f16 or run another mixed-tvm-ffn confirmation/32-position check before promotion claims.","artifact":"/tmp/lc0_autoresearch/20260605_124939_22407_rep3.json","input_backend":"wasm","encoder_kernel":"mixed-tvm-ffn-outproj","batch_size":4,"batch_pipeline_depth":1,"comparison_current_best_mixed_tvm_ffn_ms_per_eval":7.60110803335107,"comparison_mixed_tvm_ffn_5rep_ms_per_eval":8.004607177497576}}
