{"run":58,"commit":"ecadf81","metric":7.625602409671698,"metrics":{"evals_per_second":131.13718055004819,"visits_per_position":67.25,"evals_per_position":67.4375,"total_eval_ms":7.460389812499998,"readback_synced_ms":7.225308062500001,"readback_map_async_ms":7.2907751875,"readback_map_wait_ms":7.222039687500001,"readback_overlap_hidden_ms":0.011544250000000002,"legal_priors_prep_ms":0.011544250000000002,"readback_bytes":7444,"readback_maps":0.26435650000000005,"dispatch_count":180},"status":"discard","description":"WASM-input b4 opt-in tvm-packed-f16 encoder kernel screen","timestamp":1780689098172,"segment":2,"confidence":2.6777666993031115,"asi":{"hypothesis":"Screen the opt-in tvm-packed-f16 encoder kernel with WASM input, WGSL heads, batchSize=4, depth1 to test whether fully packed/generated f16 kernels improve over the current mixed-tvm-ffn candidate.","rollback_reason":"Primary metric was 7.63 ms/eval, faster than the original hand-kernel baseline but slightly worse than the current mixed-tvm-ffn keep at 7.60 ms/eval. It also increased dispatch_count from 160 to 180, so the full packed-f16 path is not clearly preferable for this workload.","next_action_hint":"Prefer mixed-tvm-ffn over tvm-packed-f16 and mixed-tvm-ffn-outproj for now. Next iteration should confirm mixed-tvm-ffn again, try mixed-tvm-ffn at batchSize=8, or run a stronger 32-position/5-rep check before any promotion claims.","artifact":"/tmp/lc0_autoresearch/20260605_125050_23005_rep3.json","input_backend":"wasm","encoder_kernel":"tvm-packed-f16","batch_size":4,"batch_pipeline_depth":1,"comparison_current_best_mixed_tvm_ffn_ms_per_eval":7.60110803335107,"dispatch_count_increased":true}}
{"run":59,"commit":"ecadf81","metric":7.6854932129113385,"metrics":{"evals_per_second":130.11526681463172,"visits_per_position":72,"evals_per_position":69.0625,"total_eval_ms":7.8841009375,"readback_synced_ms":7.639516125,"readback_map_async_ms":7.682309124999999,"readback_map_wait_ms":7.6380050625,"readback_overlap_hidden_ms":0.0055407500000000005,"legal_priors_prep_ms":0.0055407500000000005,"readback_bytes":7444,"readback_maps":0.1455171875,"dispatch_count":160},"status":"discard","description":"mixed-tvm-ffn WASM-input depth1 batch-size b8 screen","timestamp":1780689173691,"segment":2,"confidence":2.2825322560782983,"asi":{"hypothesis":"Combine the current opt-in mixed-tvm-ffn encoder kernel with batchSize=8 at depth1 under WASM input/WGSL heads. Since b8 reduces readback map pressure, the faster encoder might make larger physical batches beneficial despite prior hand-kernel b8 noise.","rollback_reason":"Primary metric was 7.69 ms/eval, faster than the old hand-kernel b4 baseline but slower than the current mixed-tvm-ffn b4 keep at 7.60 ms/eval. Lower readback_maps (~0.15) did not beat b4 E2E throughput.","next_action_hint":"Keep mixed-tvm-ffn at batchSize=4 as the preferred candidate. Avoid further batch-size sweeps unless paired with a stronger alternating matrix; next useful work is stronger 32-position or 5-rep mixed-tvm-ffn confirmation before promotion claims.","artifact":"/tmp/lc0_autoresearch/20260605_125206_23611_rep3.json","input_backend":"wasm","encoder_kernel":"mixed-tvm-ffn","batch_size":8,"batch_pipeline_depth":1,"comparison_current_best_mixed_tvm_ffn_b4_ms_per_eval":7.60110803335107,"readback_map_reduction_without_best_e2e_gain":true}}
{"run":60,"commit":"ecadf81","metric":6.892406630305948,"metrics":{"evals_per_second":145.0872030101931,"visits_per_position":74.375,"evals_per_position":74.46875,"total_eval_ms":6.80931103125,"readback_synced_ms":6.683951093750001,"readback_map_async_ms":6.723616812500001,"readback_map_wait_ms":6.681789312499999,"readback_overlap_hidden_ms":0.010123093749999998,"legal_priors_prep_ms":0.010123093749999998,"readback_bytes":7444,"readback_maps":0.26330824999999997,"dispatch_count":160},"status":"discard","description":"32-position stronger check for mixed-tvm-ffn WASM-input b4","timestamp":1780689272048,"segment":2,"confidence":1.988964071905199,"asi":{"hypothesis":"Run a stronger 32-position, 3-repetition fixed-suite check for the current opt-in mixed-tvm-ffn WASM-input WGSL-head b4/depth1 candidate to test whether the speed signal persists beyond the default 16-position workload before making promotion claims.","rollback_reason":"This used LC0_AR_MAX_POSITIONS=32, which is stronger diagnostic evidence but not the default primary workload/baseline, and no implementation changed; log as calibration rather than a new keep despite the excellent metric.","next_action_hint":"Mixed-tvm-ffn remains strongly promising on 32 positions. Next, run an adjacent 32-position hand-kernel control or a 32-position ONNX b1 comparison before documenting/promotion claims; keep stable defaults unchanged.","artifact":"/tmp/lc0_autoresearch/20260605_125321_24207_rep3.json","input_backend":"wasm","encoder_kernel":"mixed-tvm-ffn","batch_size":4,"batch_pipeline_depth":1,"max_positions":32,"reps":3,"stronger_check":true,"non_comparable_to_default_primary":true}}
{"run":61,"commit":"ecadf81","metric":8.82990990982652,"metrics":{"evals_per_second":113.25143860042472,"visits_per_position":58.875,"evals_per_position":58.96875,"total_eval_ms":8.849625968750003,"readback_synced_ms":8.70076725,"readback_map_async_ms":8.7480135,"readback_map_wait_ms":8.698198062499998,"readback_overlap_hidden_ms":0.01203265625,"legal_priors_prep_ms":0.01203265625,"readback_bytes":7444,"readback_maps":0.26690953125000005,"dispatch_count":160},"status":"discard","description":"32-position hand-kernel control for mixed-tvm-ffn stronger check","timestamp":1780689364975,"segment":2,"confidence":2.2825322560782983,"asi":{"hypothesis":"Run an adjacent 32-position, 3-repetition hand-kernel control for the WASM-input WGSL-head b4/depth1 lane, matching the prior 32-position mixed-tvm-ffn stronger check, to avoid overfitting to a single stronger-workload result.","rollback_reason":"No implementation changed and this 32-position hand-kernel control is diagnostic/non-comparable to the default 16-position primary baseline. It is slower than the adjacent 32-position mixed-tvm-ffn result (8.83 vs 6.89 ms/eval), strengthening mixed-tvm-ffn evidence but not a new optimization to keep.","next_action_hint":"Mixed-tvm-ffn is strongly favored over hand on adjacent 32-position evidence. Next, run a stronger ONNX b1 comparison or update documentation/notes only after one more confirmation; stable defaults must remain unchanged.","artifact":"/tmp/lc0_autoresearch/20260605_125449_24869_rep3.json","input_backend":"wasm","encoder_kernel":"hand","batch_size":4,"batch_pipeline_depth":1,"max_positions":32,"reps":3,"adjacent_mixed_tvm_ffn_32pos_ms_per_eval":6.892406630305948,"stronger_control":true,"non_comparable_to_default_primary":true}}
{"run":62,"commit":"ecadf81","metric":10.181867545532567,"metrics":{"evals_per_second":98.2138095519386,"visits_per_position":48.78125,"evals_per_position":49.78125,"total_eval_ms":0,"readback_synced_ms":0,"readback_map_async_ms":0,"readback_map_wait_ms":0,"readback_overlap_hidden_ms":0,"legal_priors_prep_ms":0,"readback_bytes":0,"readback_maps":0,"dispatch_count":0},"status":"discard","description":"32-position ONNX b1 control for mixed-tvm-ffn stronger check","timestamp":1780689462699,"segment":2,"confidence":2.2026615506009617,"asi":{"hypothesis":"Run a 32-position, 3-repetition ONNX b1 fixed-suite control adjacent to the mixed-tvm-ffn and hand-kernel 32-position checks, to compare the opt-in WGSL-head WASM b4 candidate against the stable ONNX runtime before any promotion or documentation claims.","rollback_reason":"This used LC0_AR_RUNTIME=onnx and batchSize=1, so it is a diagnostic control rather than the default hybrid_b4 primary workload. No implementation changed, and ONNX timing fields do not populate WGSL readback metrics.","next_action_hint":"Mixed-tvm-ffn b4 was faster than both adjacent 32-position hand (8.83 ms/eval) and ONNX b1 (10.18 ms/eval) controls under this fixed-suite setup. Next, run one more default 16-position mixed-tvm-ffn confirmation or update documentation with careful opt-in/non-default language.","artifact":"/tmp/lc0_autoresearch/20260605_125630_25553_rep3.json","runtime":"onnx","batch_size":1,"max_positions":32,"reps":3,"comparison_mixed_tvm_ffn_32pos_ms_per_eval":6.892406630305948,"comparison_hand_32pos_ms_per_eval":8.82990990982652,"diagnostic_control":true,"non_comparable_to_default_primary":true}}
{"run":63,"commit":"ecadf81","metric":7.737624179847685,"metrics":{"evals_per_second":129.23863666116762,"visits_per_position":66.5,"evals_per_position":66.6875,"total_eval_ms":7.678799875000001,"readback_synced_ms":7.546198374999999,"readback_map_async_ms":7.5877901875,"readback_map_wait_ms":7.543585250000001,"readback_overlap_hidden_ms":0.010728375,"legal_priors_prep_ms":0.010728375,"readback_bytes":7444,"readback_maps":0.26449274999999994,"dispatch_count":160},"status":"discard","description":"default 16-position mixed-tvm-ffn confirmation after stronger controls","timestamp":1780689533250,"segment":2,"confidence":1.9050341244568672,"asi":{"hypothesis":"Run another default 16-position, 3-repetition confirmation of the opt-in mixed-tvm-ffn encoder kernel after adjacent 32-position hand and ONNX controls, to check that the default-workload signal remains strong without changing code or defaults.","rollback_reason":"No implementation changed and the confirmation metric (7.74 ms/eval) was slower than the current mixed-tvm-ffn keep (7.60 ms/eval), so this is calibration/confirmation evidence rather than a new keep. It remains substantially faster than hand-kernel default controls and the original WASM-input b4 baseline.","next_action_hint":"The mixed-tvm-ffn candidate has repeated evidence (7.60 keep, 8.00 five-rep, 7.74 default confirmation, strong 32-position controls). Next iteration can update documentation/notes or run one lifecycle/browser smoke before finalization; keep stable defaults unchanged and present it as opt-in.","artifact":"/tmp/lc0_autoresearch/20260605_125804_26217_rep3.json","input_backend":"wasm","encoder_kernel":"mixed-tvm-ffn","batch_size":4,"batch_pipeline_depth":1,"max_positions":16,"reps":3,"confirmation_of_commit":"ecadf81","comparison_current_best_mixed_tvm_ffn_ms_per_eval":7.60110803335107,"comparison_five_rep_mixed_tvm_ffn_ms_per_eval":8.004607177497576}}
{"run":64,"commit":"ecadf81","metric":7.950250245345587,"metrics":{"evals_per_second":125.78220422501069,"visits_per_position":62.875,"evals_per_position":63.6875,"total_eval_ms":7.812115375,"readback_synced_ms":7.683110999999999,"readback_map_async_ms":7.727261062500001,"readback_map_wait_ms":7.6798266250000005,"readback_overlap_hidden_ms":0.021333624999999995,"legal_priors_prep_ms":0.021333624999999995,"readback_bytes":7444,"readback_maps":0.5093499375000001,"dispatch_count":160},"status":"discard","description":"mixed-tvm-ffn WASM-input depth1 batch-size b2 screen","timestamp":1780689605007,"segment":2,"confidence":1.6782641756820305,"asi":{"hypothesis":"Test whether the current opt-in mixed-tvm-ffn encoder kernel benefits from smaller physical batches at batchSize=2 under WASM input/WGSL heads/depth1. Faster encoder work might make lower-latency smaller batches competitive despite higher map pressure.","rollback_reason":"Primary metric was 7.95 ms/eval, slower than the current mixed-tvm-ffn b4 keep at 7.60 ms/eval and slower than recent default confirmations. Smaller b2 roughly doubled readback_maps to ~0.51 and did not improve E2E throughput.","next_action_hint":"Keep mixed-tvm-ffn at batchSize=4 as the preferred candidate; b2 and b8 both failed to beat b4. Next useful iteration should be documentation/lifecycle validation or a stronger alternating confirmation, not more batch-size sweeps.","artifact":"/tmp/lc0_autoresearch/20260605_125920_26831_rep3.json","input_backend":"wasm","encoder_kernel":"mixed-tvm-ffn","batch_size":2,"batch_pipeline_depth":1,"comparison_current_best_mixed_tvm_ffn_b4_ms_per_eval":7.60110803335107,"readback_map_pressure_higher":true}}
{"run":65,"commit":"55233e3","metric":7.496654578424645,"metrics":{"evals_per_second":133.3928340353306,"visits_per_position":68.75,"evals_per_position":68.9375,"total_eval_ms":7.467198937499999,"readback_synced_ms":7.3313618125,"readback_map_async_ms":7.331755562499999,"readback_map_wait_ms":7.328547250000001,"readback_overlap_hidden_ms":0,"legal_priors_prep_ms":0,"readback_bytes":3084,"readback_maps":0.2639365,"dispatch_count":161},"status":"keep","description":"opt-in GPU legal priors with mixed-tvm-ffn WASM-input b4","timestamp":1780689730066,"segment":2,"confidence":1.8238712978108786,"asi":{"hypothesis":"Revisit opt-in GPU legal priors only in combination with the now-faster mixed-tvm-ffn encoder kernel for WASM input/WGSL heads/b4/depth1. The faster encoder may make the compact legal-prior readback worthwhile by reducing readback bytes from full mapped policy despite one extra dispatch.","next_action_hint":"Run a 5-rep confirmation of mixed-tvm-ffn + GPU legal priors before treating it as preferred; compare against the mixed-tvm-ffn JS-legal confirmations because prior GPU legal-prior screens were negative and this win is modest.","artifact":"/tmp/lc0_autoresearch/20260605_130122_27588_rep3.json","input_backend":"wasm","encoder_kernel":"mixed-tvm-ffn","legal_priors_backend":"gpu","batch_size":4,"batch_pipeline_depth":1,"readback_bytes_reduced_from":7444,"readback_bytes_reduced_to":3084,"dispatch_count_delta_vs_js_legal":1,"defaults_changed":false,"plumbing_added":"fixed-suite --legal-priors-backend and arena query parsing are opt-in only"}}
{"run":66,"commit":"55233e3","metric":7.714858890084421,"metrics":{"evals_per_second":129.6199987902899,"visits_per_position":66.25,"evals_per_position":66.4375,"total_eval_ms":7.67402775,"readback_synced_ms":7.560909875000001,"readback_map_async_ms":7.5615825,"readback_map_wait_ms":7.5587825625,"readback_overlap_hidden_ms":0,"legal_priors_prep_ms":0,"readback_bytes":3084,"readback_maps":0.26454856250000003,"dispatch_count":161},"status":"discard","description":"five-rep confirmation of mixed-tvm-ffn plus GPU legal priors","timestamp":1780689824020,"segment":2,"confidence":1.795016074933743,"asi":{"hypothesis":"Run a five-repetition confirmation of the current opt-in mixed-tvm-ffn encoder kernel plus GPU legal-priors backend under WASM input/WGSL heads/b4/depth1 to test whether the prior 7.50 ms/eval keep is robust and not a noisy single-run win.","rollback_reason":"No implementation changed and the 5-rep confirmation metric (7.71 ms/eval) was slower than the current 7.50 ms/eval keep, so this is calibration/confirmation evidence rather than a new improvement. The result remains faster than the 8.00 ms/eval mixed-tvm-ffn JS-legal 5-rep confirmation while preserving the readback byte reduction to 3084.","next_action_hint":"GPU legal priors plus mixed-tvm-ffn remains promising but modest/noisy. Run an adjacent 5-rep mixed-tvm-ffn JS-legal control or a 32-position confirmation before treating GPU legal priors as preferred; keep it opt-in and do not change stable defaults.","artifact":"/tmp/lc0_autoresearch/20260605_130234_28218_rep5.json","input_backend":"wasm","encoder_kernel":"mixed-tvm-ffn","legal_priors_backend":"gpu","batch_size":4,"batch_pipeline_depth":1,"reps":5,"comparison_current_best_gpu_legal_ms_per_eval":7.496654578424645,"comparison_mixed_tvm_ffn_js_legal_5rep_ms_per_eval":8.004607177497576,"readback_bytes":3084,"dispatch_count":161,"defaults_changed":false}}
{"run":67,"commit":"55233e3","metric":8.16797151254062,"metrics":{"evals_per_second":122.42941818108196,"visits_per_position":63.5,"evals_per_position":63.625,"total_eval_ms":8.07483025,"readback_synced_ms":7.947178125000001,"readback_map_async_ms":7.984048625,"readback_map_wait_ms":7.944662125000001,"readback_overlap_hidden_ms":0.009999187500000001,"legal_priors_prep_ms":0.009999187500000001,"readback_bytes":7444,"readback_maps":0.265382,"dispatch_count":160},"status":"discard","description":"adjacent five-rep JS-legal control for GPU legal priors comparison","timestamp":1780689917601,"segment":2,"confidence":1.8238712978108786,"asi":{"hypothesis":"Run an adjacent five-repetition mixed-tvm-ffn JS-legal control under WASM input/WGSL heads/b4/depth1 to compare fairly against the prior five-rep GPU-legal confirmation and avoid overfitting to isolated runs.","rollback_reason":"No implementation changed and the JS-legal control metric (8.17 ms/eval) was slower than both the adjacent GPU-legal five-rep confirmation (7.71 ms/eval) and the current GPU-legal keep (7.50 ms/eval), so this is calibration/control evidence rather than a new improvement.","next_action_hint":"GPU legal priors plus mixed-tvm-ffn now has adjacent five-rep evidence over JS legal, but the margin is modest/noisy. Next run should use a 32-position confirmation for mixed-tvm-ffn + GPU legal priors or perform targeted browser lifecycle validation before documentation/finalization; keep all options opt-in and stable defaults unchanged.","artifact":"/tmp/lc0_autoresearch/20260605_130405_29015_rep5.json","input_backend":"wasm","encoder_kernel":"mixed-tvm-ffn","legal_priors_backend":"js","batch_size":4,"batch_pipeline_depth":1,"reps":5,"comparison_adjacent_gpu_legal_5rep_ms_per_eval":7.714858890084421,"comparison_current_gpu_legal_keep_ms_per_eval":7.496654578424645,"readback_bytes":7444,"dispatch_count":160,"control_run":true,"defaults_changed":false}}
{"run":68,"commit":"9b043f1","metric":7.822840962645128,"metrics":{"evals_per_second":127.83079763158973,"visits_per_position":66.125,"evals_per_position":66.21875,"total_eval_ms":7.745028687500001,"readback_synced_ms":7.5910132187500015,"readback_map_async_ms":7.592613937500003,"readback_map_wait_ms":7.58810521875,"readback_overlap_hidden_ms":0,"legal_priors_prep_ms":0,"readback_bytes":3084,"readback_maps":0.264842125,"dispatch_count":161},"status":"discard","description":"32-position confirmation of mixed-tvm-ffn plus GPU legal priors","timestamp":1780690910202,"segment":2,"confidence":1.786817975648461,"asi":{"hypothesis":"Run a stronger 32-position, 3-repetition confirmation of the current opt-in mixed-tvm-ffn encoder kernel plus GPU legal-priors backend under WASM input/WGSL heads/b4/depth1 to test whether the modest default-workload GPU-legal win persists on the stronger corpus.","rollback_reason":"This used LC0_AR_MAX_POSITIONS=32, so it is diagnostic/non-comparable to the default 16-position primary workload and no implementation changed. The 32-position GPU-legal result (7.82 ms/eval) was slower than the earlier 32-position mixed-tvm-ffn JS-legal result (6.89 ms/eval), so GPU legal priors should not be treated as clearly preferred despite the default-workload keep.","next_action_hint":"Do not over-promote GPU legal priors based on the 7.50 default keep. Run an adjacent 32-position JS-legal control under the current branch if needed, or favor mixed-tvm-ffn with JS legal as the more robust candidate until additional alternating evidence supports GPU legal. Keep GPU legal opt-in and stable defaults unchanged.","artifact":"/tmp/lc0_autoresearch/20260605_132034_33702_rep3.json","input_backend":"wasm","encoder_kernel":"mixed-tvm-ffn","legal_priors_backend":"gpu","batch_size":4,"batch_pipeline_depth":1,"max_positions":32,"reps":3,"comparison_mixed_tvm_ffn_js_legal_32pos_ms_per_eval":6.892406630305948,"comparison_gpu_legal_default_keep_ms_per_eval":7.496654578424645,"readback_bytes":3084,"dispatch_count":161,"stronger_check":true,"non_comparable_to_default_primary":true,"defaults_changed":false}}
{"run":69,"commit":"9b043f1","metric":7.663285980460029,"metrics":{"evals_per_second":130.49232438275385,"visits_per_position":67,"evals_per_position":67.09375,"total_eval_ms":7.464559062500001,"readback_synced_ms":7.324818062500002,"readback_map_async_ms":7.368187249999999,"readback_map_wait_ms":7.321749218749999,"readback_overlap_hidden_ms":0.010293718749999998,"legal_priors_prep_ms":0.010293718749999998,"readback_bytes":7444,"readback_maps":0.2646090625,"dispatch_count":160},"status":"discard","description":"adjacent 32-position JS-legal control for GPU legal-priors comparison","timestamp":1780691005654,"segment":2,"confidence":1.6977009716596463,"asi":{"hypothesis":"Run an adjacent 32-position, 3-repetition mixed-tvm-ffn JS-legal control under the current branch to compare fairly against the prior 32-position GPU-legal confirmation and avoid over-promoting the GPU legal-priors keep from default-workload evidence alone.","rollback_reason":"No implementation changed and this used LC0_AR_MAX_POSITIONS=32, so it is diagnostic/non-comparable to the default 16-position primary workload. The JS-legal 32-position control (7.66 ms/eval) was faster than the adjacent GPU-legal 32-position run (7.82 ms/eval), so GPU legal priors are not clearly preferred on the stronger corpus despite reducing readback bytes.","next_action_hint":"Favor opt-in mixed-tvm-ffn with JS legal priors as the more robust candidate, while keeping GPU legal priors as an opt-in low-confidence keep. Next iteration should either run a default 16-position JS-legal control under the current branch, update notes/docs with the mixed evidence, or pursue another structural attribution idea rather than more batch-size sweeps.","artifact":"/tmp/lc0_autoresearch/20260605_132209_34380_rep3.json","input_backend":"wasm","encoder_kernel":"mixed-tvm-ffn","legal_priors_backend":"js","batch_size":4,"batch_pipeline_depth":1,"max_positions":32,"reps":3,"comparison_adjacent_gpu_legal_32pos_ms_per_eval":7.822840962645128,"comparison_earlier_js_legal_32pos_ms_per_eval":6.892406630305948,"readback_bytes":7444,"dispatch_count":160,"stronger_control":true,"non_comparable_to_default_primary":true,"control_run":true,"defaults_changed":false}}
