{"run":33,"commit":"pending","metric":13.163211508449834,"metrics":{"evals_per_second":75.96930273118167,"visits_per_position":40,"evals_per_position":40.1875,"total_eval_ms":13.020362062500002,"readback_synced_ms":9.023687875,"readback_map_async_ms":9.078761375000001,"readback_map_wait_ms":9.0196865,"readback_overlap_hidden_ms":0.016476187500000006,"legal_priors_prep_ms":0.016476187500000006,"readback_bytes":7444,"readback_maps":0.27372156249999996,"dispatch_count":159},"status":"discard","description":"add deferred-readback attribution preflight and run stronger-loop benchmark","timestamp":1780684041637,"segment":1,"confidence":null,"asi":{"hypothesis":"Add a benchmark-only deferred-readback attribution preflight to autoresearch.sh and run it before the normal stronger fixed-suite benchmark, to measure whether double-buffered deferred readback can hide the command/fence floor without changing the parity-preserving batchPipelineDepth=1 primary workload.","rollback_reason":"The fixed-suite primary regressed to 13.16 ms/eval, so this run is not a keepable optimization; the attribution data is diagnostic only.","next_action_hint":"Deferred-readback microbench shows a large speedup (1.43x) with matching best moves in fixture mode, suggesting fence overlap is promising, but full search depth=2 timed out. Build a smaller dedicated scheduler/quality harness rather than retrying full-strength depth2 in this loop.","artifact":"/tmp/lc0_autoresearch/20260605_112623_16250_rep3.json","deferred_readback_attr_artifact":"/tmp/lc0_autoresearch/20260605_112623_16250_deferred_readback_attr.json","attr_immediate_ms_per_eval":10.38437500099341,"attr_deferred_ms_per_eval":7.246354166418314,"attr_deferred_over_immediate_speedup":1.4330482284619188,"attr_immediate_readback_synced_ms":7.581458331396182,"attr_deferred_readback_synced_ms":4.326666666815679,"attr_deferred_map_async_ms":10.862604168554148,"attr_all_best_moves_match":true}}
{"run":34,"commit":"pending","metric":16.519532442661642,"metrics":{"evals_per_second":60.53440092635449,"visits_per_position":32.5,"evals_per_position":32.75,"total_eval_ms":16.287648312500004,"readback_synced_ms":10.1373809375,"readback_map_async_ms":10.208105499999999,"readback_map_wait_ms":10.132913312500001,"readback_overlap_hidden_ms":0.026359375,"legal_priors_prep_ms":0.026359375,"readback_bytes":7444,"readback_maps":0.27877537500000005,"dispatch_count":159},"status":"discard","description":"unchanged stronger-loop rerun with attribution hook disabled","timestamp":1780684129172,"segment":1,"confidence":null,"asi":{"hypothesis":"Run the stronger 16-position/500ms/3-rep parity-preserving b4 workload with the optional deferred-readback attribution hook disabled, to recalibrate baseline variance after the diagnostic attribution run before making more runtime changes.","rollback_reason":"No runtime implementation changed and the primary metric regressed badly to 16.52 ms/eval, with fewer visits/evals per position and higher readback wait. This is calibration/noise evidence, not a keepable optimization.","next_action_hint":"Do not infer performance from single stronger-loop reruns. Continue toward dedicated benchmark-only attribution/scheduler harnesses, and avoid committing runtime hot-path changes without repeated evidence.","artifact":"/tmp/lc0_autoresearch/20260605_112758_16988_rep3.json"}}
{"run":35,"commit":"pending","metric":13.875787727967225,"metrics":{"evals_per_second":72.06798054314845,"visits_per_position":37.5,"evals_per_position":37.6875,"total_eval_ms":13.925177625,"readback_synced_ms":9.971954625,"readback_map_async_ms":10.029691187500001,"readback_map_wait_ms":9.96832525,"readback_overlap_hidden_ms":0.016666624999999997,"legal_priors_prep_ms":0.016666624999999997,"readback_bytes":7444,"readback_maps":0.275997,"dispatch_count":159},"status":"discard","description":"repeat deferred-readback attribution with longer microbench window","timestamp":1780684243856,"segment":1,"confidence":null,"asi":{"hypothesis":"Repeat the benchmark-only deferred-readback attribution preflight with a longer 24-iteration window to confirm whether double-buffered readback overlap consistently beats immediate readback before investing in a dedicated scheduler/quality harness. The normal parity-preserving fixed-suite benchmark still runs afterward for the primary metric.","rollback_reason":"The fixed-suite primary regressed to 13.88 ms/eval and the attribution hook is diagnostic, not a direct b4 depth1 optimization; do not keep based on this run.","next_action_hint":"Deferred-readback attribution again shows a material fixture-mode speedup (1.34x) with matching best moves, so the next high-ROI path is a dedicated smaller scheduler/quality harness rather than more readback micro-optimizations or full-strength depth2 retries.","artifact":"/tmp/lc0_autoresearch/20260605_112946_17853_rep3.json","deferred_readback_attr_artifact":"/tmp/lc0_autoresearch/20260605_112946_17853_deferred_readback_attr.json","attr_immediate_ms_per_eval":9.458385416616997,"attr_deferred_ms_per_eval":7.08026041649282,"attr_deferred_over_immediate_speedup":1.3358810072274392,"attr_immediate_readback_synced_ms":7.200677083805203,"attr_deferred_readback_synced_ms":4.688177083308498,"attr_deferred_map_async_ms":11.427552084128061,"attr_all_best_moves_match":true}}
{"run":36,"commit":"pending","metric":0,"metrics":{"evals_per_second":0,"visits_per_position":0,"evals_per_position":0,"total_eval_ms":0,"readback_synced_ms":0,"readback_map_async_ms":0,"readback_map_wait_ms":0,"readback_overlap_hidden_ms":0,"legal_priors_prep_ms":0,"readback_bytes":0,"readback_maps":0,"dispatch_count":0},"status":"crash","description":"small scheduler screening depth2 still times out","timestamp":1780684535281,"segment":1,"confidence":null,"asi":{"hypothesis":"Screen batchPipelineDepth=2 on a much smaller 4-position/250ms/1-rep fixed-suite workload with a raised browser timeout, to see whether deferred/scheduler overlap can be evaluated in a reduced harness after full-strength depth2 timed out. This is speculative scheduler exploration, not parity-preserving promotion evidence.","rollback_reason":"Even the reduced depth2 fixed-suite timed out after 240s before emitting metrics; the browser wait failed while looking for LC0_FIXED_SUITE_DONE. No performance data collected.","next_action_hint":"Stop using fixed-suite batchPipelineDepth=2 for scheduler exploration in this loop. Build a dedicated scheduler/quality harness around the existing deferred-readback fixture or diagnose why depth2 hangs before retrying.","error":"agent-browser wait timed out after 10531ms near the 240s script deadline; see /tmp/lc0_autoresearch/20260605_113115_18898_rep1.log","artifact":"/tmp/lc0_autoresearch/20260605_113115_18898_rep1.log"}}
{"run":37,"commit":"pending","metric":9.74811981029782,"metrics":{"evals_per_second":102.5838848373211,"visits_per_position":52.5,"evals_per_position":52.6875,"total_eval_ms":9.6568418125,"readback_synced_ms":9.5133713125,"readback_map_async_ms":9.5547154375,"readback_map_wait_ms":9.510252500000002,"readback_overlap_hidden_ms":0.0108715,"legal_priors_prep_ms":0.0108715,"readback_bytes":7444,"readback_maps":0.2680935,"dispatch_count":160},"status":"discard","description":"opt-in WASM input backend screening is non-comparable to JS-input primary","timestamp":1780684724733,"segment":1,"confidence":null,"asi":{"hypothesis":"Expose arena fixed-suite inputBackend plumbing and screen opt-in WASM input at b4/depth1 under the stronger 16-position/500ms/3-rep workload, as a separate scheduler/input-backend lane suggested by the attribution discussion. Stable defaults remain JS input.","rollback_reason":"Although the reported metric improved to 9.75 ms/eval, it used a different input backend than the current primary workload (WASM instead of JS), so keeping it would corrupt the JS-input b4 baseline and overclaim a non-comparable improvement.","next_action_hint":"This is strong evidence to start a separate input-backend or scheduler sweep experiment with its own config/baseline, or explicitly reinitialize autoresearch for WASM-input b4 before pursuing it further. Do not mix this result into the JS-input primary loop.","artifact":"/tmp/lc0_autoresearch/20260605_113737_20546_rep3.json","non_comparable_workload":true,"screened_input_backend":"wasm","current_primary_input_backend":"js"}}
{"type":"config","name":"LC0 WGSL-head WASM input b4 scheduler lane","metricName":"hybrid_b4_ms_per_eval","metricUnit":"ms","bestDirection":"lower"}
{"run":38,"commit":"c6e5a83","metric":8.593541881969081,"metrics":{"evals_per_second":116.36645445322074,"visits_per_position":60.25,"evals_per_position":60.4375,"total_eval_ms":8.456162687500003,"readback_synced_ms":8.3125373125,"readback_map_async_ms":8.356592875,"readback_map_wait_ms":8.3095824375,"readback_overlap_hidden_ms":0.011474062499999998,"legal_priors_prep_ms":0.011474062499999998,"readback_bytes":7444,"readback_maps":0.26573437499999997,"dispatch_count":160},"status":"keep","description":"baseline opt-in WASM input WGSL-head b4 depth1 lane","timestamp":1780685036112,"segment":2,"confidence":null,"asi":{"hypothesis":"Reinitialize autoresearch as a separate opt-in WASM-input/scheduler lane for hybrid-wgsl-heads b4 depth1, add fixed-suite inputBackend plumbing, and establish a clean 16-position/500ms/3-rep WASM-input baseline without mixing it into the previous JS-input readback objective.","next_action_hint":"Now confirm the WASM-input baseline with a 5-rep rerun or begin batch-size sweep at depth1 (b2/b4/b8), keeping batchPipelineDepth>1 as speculative scheduler exploration only.","artifact":"/tmp/lc0_autoresearch/20260605_114308_23125_rep3.json","input_backend":"wasm","batch_size":4,"batch_pipeline_depth":1,"why_keep":"This is the first baseline for the reinitialized WASM-input lane; checks passed and stable defaults remain unchanged because the backend is opt-in via query/CLI plumbing."}}
{"run":39,"commit":"pending","metric":9.207419354936835,"metrics":{"evals_per_second":108.60806502354211,"visits_per_position":56,"evals_per_position":56.1875,"total_eval_ms":9.1622385625,"readback_synced_ms":9.036370312499999,"readback_map_async_ms":9.073767625,"readback_map_wait_ms":9.033316249999999,"readback_overlap_hidden_ms":0.009838875000000002,"legal_priors_prep_ms":0.009838875000000002,"readback_bytes":7444,"readback_maps":0.2670914375,"dispatch_count":160},"status":"discard","description":"five-rep confirmation of WASM-input b4 depth1 baseline","timestamp":1780685932038,"segment":2,"confidence":null,"asi":{"hypothesis":"Run a five-repetition confirmation of the newly initialized opt-in WASM-input b4/depth1 baseline before making batch-size or scheduler changes, to estimate stronger-workload variance and avoid overfitting to the first 3-rep baseline.","rollback_reason":"No implementation change; the five-rep confirmation was slower than the 3-rep baseline (9.21 vs 8.59 ms/eval), so this is calibration evidence rather than a keepable optimization.","next_action_hint":"Proceed to WASM-input batch-size diagnostics at depth1 (b2 then b8) or a targeted b4 code change; require repeated evidence for any apparent small improvement because baseline variance is at least ~7%.","artifact":"/tmp/lc0_autoresearch/20260605_115743_28326_rep5.json","input_backend":"wasm","batch_size":4,"batch_pipeline_depth":1,"reps":5,"baseline_variance_note":"Five-rep metric is about 7.1% slower than the initial 3-rep baseline; do not overclaim tiny b4 improvements."}}
{"run":40,"commit":"pending","metric":8.664482942395118,"metrics":{"evals_per_second":115.41369596413223,"visits_per_position":58,"evals_per_position":58.8125,"total_eval_ms":8.578124875,"readback_synced_ms":8.471730312499998,"readback_map_async_ms":8.5074151875,"readback_map_wait_ms":8.468348624999999,"readback_overlap_hidden_ms":0.017185062499999997,"legal_priors_prep_ms":0.017185062499999997,"readback_bytes":7444,"readback_maps":0.5098163125,"dispatch_count":160},"status":"discard","description":"WASM-input depth1 batch-size sweep b2","timestamp":1780686381586,"segment":2,"confidence":null,"asi":{"hypothesis":"Sweep opt-in WASM-input hybrid-wgsl-heads at batchSize=2 with batchPipelineDepth=1 to test whether smaller physical batches improve full-search throughput by reducing per-batch latency or scheduler pressure compared with the b4 lane baseline.","rollback_reason":"Primary metric was slightly worse than the b4 baseline (8.66 vs 8.59 ms/eval), within noise but not an improvement; b2 also roughly doubled readback_maps versus b4.","next_action_hint":"Continue the depth1 WASM batch-size sweep with batchSize=8, then compare b2/b4/b8 using repeated confirmation only if one clearly beats the noisy b4 baseline.","artifact":"/tmp/lc0_autoresearch/20260605_120537_31437_rep3.json","input_backend":"wasm","batch_size":2,"batch_pipeline_depth":1,"readback_maps_vs_b4":"b2 readback_maps 0.51 vs b4 baseline 0.27, suggesting smaller batches increase map pressure without improving E2E throughput."}}
{"run":41,"commit":"adb40b0","metric":8.338765978344304,"metrics":{"evals_per_second":119.92182087817196,"visits_per_position":66.5,"evals_per_position":63.5625,"total_eval_ms":8.3710536875,"readback_synced_ms":8.210672375000001,"readback_map_async_ms":8.243499125,"readback_map_wait_ms":8.209198625,"readback_overlap_hidden_ms":0.005043375000000001,"legal_priors_prep_ms":0.005043375000000001,"readback_bytes":7444,"readback_maps":0.1468681875,"dispatch_count":160},"status":"keep","description":"WASM-input depth1 batch-size sweep b8","timestamp":1780686574741,"segment":2,"confidence":1.564400579301914,"asi":{"hypothesis":"Sweep opt-in WASM-input hybrid-wgsl-heads at batchSize=8 with batchPipelineDepth=1 to test whether larger physical batches reduce map pressure and improve full-search throughput compared with the b4 lane baseline.","next_action_hint":"Because the b8 improvement is modest and the five-rep b4 confirmation showed ~7% variance, run a 5-rep b8 confirmation before treating batchSize=8 as the preferred WASM lane setting or changing autoresearch defaults.","artifact":"/tmp/lc0_autoresearch/20260605_120841_34197_rep3.json","input_backend":"wasm","batch_size":8,"batch_pipeline_depth":1,"why_keep":"Primary metric improved from 8.59 to 8.34 ms/eval and checks passed; this is a configuration/scheduler finding, not a stable-default promotion.","readback_maps_vs_b4":"b8 readback_maps 0.15 vs b4 baseline 0.27, consistent with lower map pressure from larger physical batches.","noise_caution":"The observed ~2.9% improvement is smaller than recent b4 confirmation variance, so confirmation is required before building on it."}}
{"run":42,"commit":"pending","metric":8.61607392613109,"metrics":{"evals_per_second":116.06214252261343,"visits_per_position":65.5,"evals_per_position":62.5625,"total_eval_ms":8.621615749999998,"readback_synced_ms":8.424830499999999,"readback_map_async_ms":8.466360062500002,"readback_map_wait_ms":8.4232075625,"readback_overlap_hidden_ms":0.006085812499999999,"legal_priors_prep_ms":0.006085812499999999,"readback_bytes":7444,"readback_maps":0.14713781250000002,"dispatch_count":160},"status":"discard","description":"five-rep confirmation of WASM-input b8 depth1 sweep","timestamp":1780686724078,"segment":2,"confidence":5.262984528237526,"asi":{"hypothesis":"Confirm the modest b8 WASM-input depth1 sweep improvement with a five-repetition run before treating batchSize=8 as the preferred lane setting, because the b4 five-rep confirmation showed substantial variance.","rollback_reason":"The five-rep b8 confirmation was slower than the b8 three-rep keep and slightly worse than the b4 baseline (8.62 vs 8.59 ms/eval), so the earlier ~3% b8 win is not robust enough to build on.","next_action_hint":"Do not switch the lane default to b8 yet. Either run an alternating b4/b8 confirmation matrix or move to a more structural change/harness; b8 still has lower readback_maps, but E2E throughput is within noise.","artifact":"/tmp/lc0_autoresearch/20260605_121052_39458_rep5.json","input_backend":"wasm","batch_size":8,"batch_pipeline_depth":1,"reps":5,"auto_resume_limit_reset_to":100,"noise_caution":"b8 readback_maps stayed low (~0.147), but primary throughput did not confirm versus b4 baseline."}}
{"run":43,"commit":"pending","metric":9.115044150197216,"metrics":{"evals_per_second":109.70873903867637,"visits_per_position":56.5,"evals_per_position":56.625,"total_eval_ms":8.885539249999999,"readback_synced_ms":8.6221153125,"readback_map_async_ms":8.7059995,"readback_map_wait_ms":8.6175214375,"readback_overlap_hidden_ms":0.016524,"legal_priors_prep_ms":0.016524,"readback_bytes":7444,"readback_maps":0.26698531249999996,"dispatch_count":160},"status":"discard","description":"five-rep b4 control after b8 confirmation","timestamp":1780686825698,"segment":2,"confidence":1.463182364436642,"asi":{"hypothesis":"Run a five-repetition b4 WASM-input depth1 control adjacent to the b8 five-rep confirmation to compare configurations under nearby browser/GPU conditions instead of overfitting to isolated 3-rep medians.","rollback_reason":"No implementation change; the b4 control was slower than the lane baseline (9.12 vs 8.59 ms/eval), so this is calibration evidence rather than a keepable optimization.","next_action_hint":"Adjacent five-rep controls suggest b8 (8.62) may beat b4 (9.12) despite not beating the original 3-rep baseline; consider one more alternating/confirmation point or update the lane default to b8 only after stronger evidence. Avoid smaller b2 because it doubled map pressure.","artifact":"/tmp/lc0_autoresearch/20260605_121234_46146_rep5.json","input_backend":"wasm","batch_size":4,"batch_pipeline_depth":1,"reps":5,"comparison_note":"Recent five-rep b8 was 8.62 ms/eval with readback_maps ~0.147; adjacent five-rep b4 was 9.12 ms/eval with readback_maps ~0.267."}}
{"run":44,"commit":"pending","metric":8.810892687677091,"metrics":{"evals_per_second":113.49587782388943,"visits_per_position":74,"evals_per_position":65.8125,"total_eval_ms":9.0829374375,"readback_synced_ms":8.718475250000001,"readback_map_async_ms":8.775697437500002,"readback_map_wait_ms":8.717040625000001,"readback_overlap_hidden_ms":0.0033945,"legal_priors_prep_ms":0.0033945,"readback_bytes":7444,"readback_maps":0.0865535,"dispatch_count":160},"status":"discard","description":"WASM-input depth1 batch-size extrapolation b16","timestamp":1780686943296,"segment":2,"confidence":1.7401567302374548,"asi":{"hypothesis":"Extrapolate the WASM-input depth1 physical batch-size sweep to batchSize=16 to test whether further reducing readback map pressure improves full-search throughput beyond the b8 and b4 points.","rollback_reason":"Primary metric worsened to 8.81 ms/eval versus the b4 lane baseline and b8 screen, despite readback_maps dropping to ~0.087; larger batches reduce map pressure but appear to hurt E2E search throughput/latency balance.","next_action_hint":"Do not continue increasing batch size. Treat b8 as the upper useful range and prefer an alternating b4/b8 confirmation or structural scheduler/readback harness rather than b16/b32 sweeps.","artifact":"/tmp/lc0_autoresearch/20260605_121454_55035_rep3.json","input_backend":"wasm","batch_size":16,"batch_pipeline_depth":1,"auto_resume_limit_note":"Created leelaweb-arena-diagnostics/autoresearch.config.json with maxIterations=100; the separate Pi auto-resume turn cap may still require user-side restart/continue if the harness stops after 20 turns.","readback_maps_vs_b4_b8":"b16 readback_maps ~0.087 vs b8 ~0.147 and b4 ~0.267, but lower map count did not improve primary throughput."}}
{"run":45,"commit":"pending","metric":8.99922755740132,"metrics":{"evals_per_second":111.12064825803417,"visits_per_position":63,"evals_per_position":59.875,"total_eval_ms":8.8536083125,"readback_synced_ms":8.592362687500001,"readback_map_async_ms":8.655992812500001,"readback_map_wait_ms":8.59025875,"readback_overlap_hidden_ms":0.009102500000000001,"legal_priors_prep_ms":0.009102500000000001,"readback_bytes":7444,"readback_maps":0.1482353125,"dispatch_count":160},"status":"discard","description":"repeat WASM-input b8 depth1 after b16 sweep","timestamp":1780687069849,"segment":2,"confidence":1.2560261259080738,"asi":{"hypothesis":"Repeat the WASM-input batchSize=8 depth1 point after b16 and adjacent b4/b8 controls to test whether the earlier b8 improvement is robust enough to justify changing the lane default or continuing batch-size tuning.","rollback_reason":"The repeat b8 metric was 9.00 ms/eval, slower than the b4 lane baseline and consistent with the failed five-rep confirmation; the earlier b8 keep is likely noise or at least not robust.","next_action_hint":"Stop batch-size sweeps for now: b2 increased map pressure, b16 hurt throughput, and b8 lowers map count but does not reliably improve E2E. Move to structural scheduler/readback harness or another attribution-driven change.","artifact":"/tmp/lc0_autoresearch/20260605_121657_57793_rep3.json","input_backend":"wasm","batch_size":8,"batch_pipeline_depth":1,"auto_resume_counter_note":"Set both parent and working-directory autoresearch.config.json maxIterations to 100, but the Pi auto-resume 20-turn cap appears external to autoresearch tools and may require user-side resume/restart; continuing experiments after the user prompt effectively starts a new turn window.","metric_parse_note":"run_experiment display rounded the star line oddly, but the parsed exact metric recommendation was 8.99922755740132 from evals_per_second=111.12064825803417."}}
