{"type":"research_run","run_id":"R0020","node_id":"N0020","lane_id":"L006","phase":"explore","status":"keep","metric":16.90255,"metrics":{"distill_student_score":16.90255,"train_policy_ce":0.673765,"train_wdl_ce":0.068707,"dev_policy_ce":3.121585,"dev_wdl_ce":1.794682,"dev_policy_top1":0.666667,"teacher_rows":6,"move_vocab":20},"benchmark_id":"tiny_leela_phase_b_fixed_metrics_v1","commit":"af6230b1d121","hypothesis":"A first dependency-free student trained on real lc0 and Stockfish labels can establish measurable distillation losses and create a baseline for future model/training research.","implementation":"Generated stronger real teacher labels for 3 seed positions using lc0 nodes=64/multipv=4 and Stockfish depth=10/multipv=4. Added training/train_student.py, a pure-Python linear FEN-feature student with policy and WDL heads, npm distill:train, and tests/train_student.test.mjs.","learned":"The full teacher-to-student loop now runs. Baseline is intentionally weak and tiny: 6 teacher rows, 20-move vocabulary, dev_policy_ce=3.121585, dev_wdl_ce=1.794682, dev_policy_top1=0.666667. Lc0 labels were one-hot under the current UCI parser at nodes=64, while Stockfish produced richer MultiPV distributions. This is still data-pipeline/model-quality evidence, not Elo.","next_action":"Improve teacher label extraction quality (lc0 visit-policy/WDL if exposed, more seed positions), then compare student families or add a small neural/ONNX training backend.","timestamp":"2026-05-04T21:36:57.794Z"}
{"type":"research_run","run_id":"R0021","node_id":"N0021","lane_id":"L006","phase":"explore","status":"keep","metric":12.046814,"metrics":{"distill_student_score":12.046814,"train_policy_ce":1.506926,"train_wdl_ce":0.387755,"dev_policy_ce":6.566377,"dev_wdl_ce":0.734573,"dev_policy_top1":0,"teacher_rows":20,"move_vocab":44,"lc0_avg_policy_moves":3.3,"stockfish_avg_policy_moves":4},"benchmark_id":"tiny_leela_teacher_distill_seed_v2","commit":"4e1539e00580","hypothesis":"Expanding teacher seed positions and extracting lc0 verbose root visit distributions will create a more meaningful distillation dataset than the initial 3-position/one-hot labels.","implementation":"Added data/distill_seed_positions.fen with 10 curated opening/middlegame/endgame positions. Updated lc0 query parsing to prefer VerboseMoveStats root visits/WL/D and to overwrite final MultiPV lines instead of freezing early shallow PVs. Updated Stockfish parser similarly. Regenerated lc0 nodes=16 and Stockfish depth=8 labels for 10 positions and trained the linear baseline.","learned":"Dataset expanded from 6 to 20 teacher rows and move vocabulary from 20 to 44. Lc0 labels are no longer one-hot: avg_policy_moves=3.3; Stockfish avg_policy_moves=4.0. The linear student score fell from 16.90 on the tiny easy fixture to 12.05 on v2, with dev_policy_ce=6.57, showing the new dataset is harder and the linear FEN baseline is inadequate.","next_action":"Compare stronger student representations on v2: board-square features or a small MLP/conv implementation. Also consider more lc0 nodes now that verbose visit extraction works.","timestamp":"2026-05-04T21:43:22.260Z"}
{"type":"research_run","run_id":"R0022","node_id":"N0022","lane_id":"L007","phase":"explore","status":"discard","metric":11.555163,"metrics":{"distill_student_score":11.555163,"train_policy_ce":1.184344,"train_wdl_ce":0.310036,"dev_policy_ce":6.440227,"dev_wdl_ce":1.213913,"dev_policy_top1":0,"teacher_rows":20,"move_vocab":44,"feature_dim":770},"benchmark_id":"tiny_leela_teacher_distill_seed_v2","commit":"72ddb7bd879e","hypothesis":"Explicit 64-square piece/color linear features should improve over aggregate FEN counts on fixed v2 teacher labels.","implementation":"Added optional board_square feature extractor to the pure-Python linear student and tested it against the same 20-row lc0+Stockfish v2 labels.","learned":"Board-square linear features improved train losses and slightly improved dev_policy_ce (6.44 vs 6.57), but worsened dev_wdl_ce enough that primary distill_student_score fell from 12.046814 to 11.555163. With only 20 rows and 770 features, the linear board-square model appears to overfit; richer features need regularization or non-linear sharing, not a wider linear one-hot board.","next_action":"Discard as primary regression. Try a small MLP/shared representation or source/loss ablations rather than high-dimensional linear square features.","timestamp":"2026-05-04T21:50:46.213Z"}
{"type":"research_run","run_id":"R0023","node_id":"N0023","lane_id":"L008","phase":"explore","status":"discard","metric":9.60206,"metrics":{"distill_student_score":9.60206,"train_policy_ce":1.199587,"train_wdl_ce":0.310639,"dev_policy_ce":7.595354,"dev_wdl_ce":1.819077,"dev_policy_top1":0.1,"teacher_rows":20,"move_vocab":44,"feature_dim":15,"hidden_units":16},"benchmark_id":"tiny_leela_teacher_distill_seed_v2","commit":"d3e7d58d0907","hypothesis":"A dependency-free small hidden-layer student should improve over aggregate linear features on v2 teacher labels by modeling non-linear patterns.","implementation":"Added optional tanh MLP student with 16 hidden units to training/train_student.py and evaluated it on the fixed 20-row lc0+Stockfish v2 labels.","learned":"MLP overfit/failed on the tiny v2 dataset: train losses improved versus linear but dev_policy_ce worsened to 7.595354 and dev_wdl_ce to 1.819077, dropping score from 12.046814 to 9.602060. Non-linear capacity is premature without more data or regularization.","next_action":"Discard MLP candidate. Prefer teacher-source/loss ablations on the current linear baseline, or expand the dataset before adding capacity.","timestamp":"2026-05-04T21:52:19.576Z"}
{"type":"research_run","run_id":"R0024","node_id":"N0024","lane_id":"L009","phase":"explore","status":"keep","metric":12.046814,"metrics":{"distill_student_score":12.046814,"train_policy_ce":1.506926,"train_wdl_ce":0.387755,"dev_policy_ce":6.566377,"dev_wdl_ce":0.734573,"dev_policy_top1":0,"teacher_rows":20,"move_vocab":44,"lc0_only_score":10.643424,"stockfish_only_score":11.723282,"combined_score":12.046814},"benchmark_id":"tiny_leela_teacher_distill_seed_v2","commit":"e8edfc3e209d","hypothesis":"Training on lc0-only, Stockfish-only, and combined teacher labels will reveal whether the two teachers help or conflict on fixed v2 labels.","implementation":"Ran source ablation using existing linear aggregate student: lc0-only, Stockfish-only, and combined lc0+Stockfish labels. No code changes were required.","learned":"Combined labels remain best on the primary score: combined=12.046814, Stockfish-only=11.723282, lc0-only=10.643424. Stockfish-only had better dev_top1=0.2 and lower dev_wdl_ce=0.612093, while combined had better dev_policy_ce=6.566377. lc0-only is weakest with current low-node labels.","next_action":"Keep combined teacher data as default. If optimizing top1/WDL separately, Stockfish-only is interesting; otherwise run policy/WDL loss-mix ablations next.","timestamp":"2026-05-04T21:52:58.589Z"}
{"run":1,"commit":"e9fca8a","metric":130,"metrics":{"tiny_leela_score":130,"distill_student_score":12.889588,"baseline_distill_student_score":12.046814,"dev_policy_ce":5.994677,"dev_wdl_ce":0.763523,"dev_policy_top1":0,"teacher_rows":10,"raw_teacher_rows":20,"move_vocab":44},"status":"keep","description":"Add FEN-consensus teacher-label merge for linear distillation student; autoresearch readiness benchmark/checks still pass","timestamp":1777931668939,"segment":0,"confidence":null,"asi":{"hypothesis":"Averaging lc0 and Stockfish labels per identical FEN before train/dev splitting will reduce teacher disagreement while preserving both teachers' signal, improving fixed v2 distillation score without adding model capacity.","implementation":"Added --merge-fen to training/train_student.py, which averages policy/WDL targets for duplicate FEN rows and renormalizes policy targets. Updated the trainer test to exercise the merged path.","evidence":"Manual paired run on the fixed combined v2 labels improved distill_student_score from 12.046814 to 12.889588; dev_policy_ce improved from 6.566377 to 5.994677 while dev_wdl_ce moved from 0.734573 to 0.763523. ./dovetail.sh and checks passed with tiny_leela_score=130.","overfit_guard":"No benchmark weakening or label deletion: raw_teacher_rows remains reported as 20, merged teacher_rows=10 because the two teacher labels cover the same 10 FENs. The benchmark/check suite was not weakened.","next_action_hint":"Evaluate whether merged consensus should become the default training path or remain an explicit option; then try a source-aware consensus that retains teacher provenance without duplicating rows."}}
{"type":"config","name":"Tiny Leela fixed teacher distillation score","metricName":"distill_student_score","metricUnit":"","bestDirection":"higher"}
{"run":2,"commit":"7eb5087","metric":12.889588,"metrics":{"train_policy_ce":1.631705,"train_wdl_ce":0.45462,"dev_policy_ce":5.994677,"dev_wdl_ce":0.763523,"dev_policy_top1":0,"teacher_rows":10,"raw_teacher_rows":20,"move_vocab":44},"status":"keep","description":"Switch saturated bootstrap benchmark to fixed teacher-distillation score baseline using current consensus-label student workload","timestamp":1777931740579,"segment":1,"confidence":null,"asi":{"hypothesis":"The bootstrap readiness score is saturated, so the most promising next step is to promote the fixed v2 teacher-distillation workload to the primary benchmark before further model/loss iterations.","implementation":"Reinitialized autoresearch with primary metric distill_student_score (higher is better) and changed dovetail.sh to run the deterministic dependency-free linear student on frozen lc0+Stockfish v2 labels with --merge-fen consensus targets.","evidence":"./dovetail.sh emitted distill_student_score=12.889588 with checks passing; secondary metrics match the prior manual consensus run: dev_policy_ce=5.994677, dev_wdl_ce=0.763523, raw_teacher_rows=20, teacher_rows=10.","overfit_guard":"The fixed workload uses existing frozen label files and reports raw_teacher_rows separately from merged rows; it does not edit labels, tests, or correctness checks. This is a benchmark-segment transition, not a benchmark weakening.","next_action_hint":"Now run actual Phase C iterations against distill_student_score, starting with non-scalar feature additions such as FEN state/castling/en-passant features or source-aware consensus variants."}}
{"run":3,"commit":"7eb5087","metric":12.232594,"metrics":{"train_policy_ce":1.37702,"train_wdl_ce":0.410439,"dev_policy_ce":6.129904,"dev_wdl_ce":1.044977,"dev_policy_top1":0,"teacher_rows":10,"raw_teacher_rows":20,"move_vocab":44,"feature_dim":30},"status":"discard","description":"Add FEN state/castling/en-passant/move-clock features to linear student; rejected due WDL validation regression","timestamp":1777931787527,"segment":1,"confidence":null,"asi":{"hypothesis":"Adding chess-state FEN features (castling rights, en-passant file, halfmove/fullmove clocks) will give the linear aggregate student legal-context signal missing from piece counts and improve fixed teacher distillation.","implementation":"Extended fen_features from 15 to 30 dimensions with castling flags, no-castling bit, en-passant file one-hot, and normalized move clocks; kept the same fixed consensus-label benchmark.","evidence":"./dovetail.sh passed checks but distill_student_score dropped from 12.889588 to 12.232594. Training losses improved, but dev_wdl_ce worsened from 0.763523 to 1.044977 and dev_policy_ce also worsened from 5.994677 to 6.129904.","rollback_reason":"Primary metric regressed; extra sparse state features likely overfit the 10-position merged seed set and especially harmed WDL validation.","next_action_hint":"Try source-aware consensus or data split/validation robustness before adding more dimensions; avoid sparse feature expansion until the label set is larger."}}
{"run":4,"commit":"7eb5087","metric":12.606374,"metrics":{"train_policy_ce":1.509742,"train_wdl_ce":0.387149,"dev_policy_ce":6.187411,"dev_wdl_ce":0.745084,"dev_policy_top1":0,"teacher_rows":10,"raw_teacher_rows":20,"move_vocab":44,"feature_dim":28},"status":"discard","description":"Add low-dimensional side-to-move piece/material interaction features to linear student; rejected due policy validation regression","timestamp":1777931844511,"segment":1,"confidence":null,"asi":{"hypothesis":"Side-to-move interactions with piece counts and material edge should let the linear student represent tempo/color context while avoiding sparse FEN-state overfit.","implementation":"Extended fen_features from 15 to 28 dimensions by multiplying existing normalized piece-count features and material edge by side-to-move sign; kept the fixed consensus-label benchmark unchanged.","evidence":"./dovetail.sh passed checks but distill_student_score fell from 12.889588 to 12.606374. dev_wdl_ce slightly improved from 0.763523 to 0.745084, but dev_policy_ce worsened from 5.994677 to 6.187411, reducing the primary score.","rollback_reason":"Primary metric regressed; the added interactions helped WDL a little but hurt policy enough to lose overall.","next_action_hint":"Try structural objective separation such as training policy and WDL on separate feature sets/heads, so WDL-only contextual features do not degrade policy logits."}}
{"run":5,"commit":"44ea0a2","metric":12.922135,"metrics":{"train_policy_ce":1.631707,"train_wdl_ce":0.387171,"dev_policy_ce":5.993176,"dev_wdl_ce":0.745483,"dev_policy_top1":0,"teacher_rows":10,"raw_teacher_rows":20,"move_vocab":44,"feature_dim":15,"wdl_feature_dim":28},"status":"keep","description":"Use separate WDL feature set with compact side-to-move interactions while leaving policy features unchanged","timestamp":1777931902300,"segment":1,"confidence":0.20614958782117354,"asi":{"hypothesis":"Side-to-move interaction features helped WDL but hurt policy when shared; using them only for the WDL head should improve value loss while preserving policy logits.","implementation":"Added wdl_features() as base aggregate FEN features plus side-sign interactions for piece counts/material. Policy head still uses the original 15-dimensional fen_features; WDL head uses 28 dimensions. Serialized both dimensions for artifact consumers.","evidence":"./dovetail.sh and checks passed. distill_student_score improved from 12.889588 to 12.922135; dev_wdl_ce improved from 0.763523 to 0.745483 while dev_policy_ce stayed essentially unchanged/slightly better at 5.993176 vs 5.994677.","overfit_guard":"This does not change labels, split, test checks, or the fixed benchmark workload; it separates existing low-dimensional aggregate signals by head rather than adding sparse square/state features.","next_action_hint":"Try other head-specific representations cautiously: e.g. WDL-only FEN-state features, or policy-only move-family priors, while monitoring that unchanged head metrics do not regress."}}
{"run":6,"commit":"44ea0a2","metric":12.307315,"metrics":{"train_policy_ce":1.631701,"train_wdl_ce":0.360297,"dev_policy_ce":5.994196,"dev_wdl_ce":1.131053,"dev_policy_top1":0,"teacher_rows":10,"raw_teacher_rows":20,"move_vocab":44,"feature_dim":15,"wdl_feature_dim":34},"status":"discard","description":"Add WDL-only phase/material summary features; rejected due value validation overfit","timestamp":1777931940593,"segment":1,"confidence":0.10883136772342858,"asi":{"hypothesis":"WDL-only game-phase/material summary features should improve value loss while preserving the policy head, since earlier head separation allowed WDL-specific features to help without hurting policy.","implementation":"Extended wdl_features with total material, pawn material, queen presence, and side-to-move interactions for those phase features. Policy features and fixed consensus benchmark were unchanged.","evidence":"./dovetail.sh and checks passed, but distill_student_score dropped from 12.922135 to 12.307315. train_wdl_ce improved from 0.387171 to 0.360297, while dev_wdl_ce regressed sharply from 0.745483 to 1.131053; policy CE stayed roughly unchanged.","rollback_reason":"Primary metric regressed; phase/material additions overfit WDL on the tiny 10-position merged seed set despite being head-specific.","next_action_hint":"Avoid adding WDL dimensions without more data/regularization. Confirm the current best head-separated interaction model or try changes that reduce overfitting, such as deterministic cross-fold reporting rather than new features."}}
{"run":7,"commit":"8cc07dd","metric":12.922135,"metrics":{"train_policy_ce":1.631707,"train_wdl_ce":0.387171,"dev_policy_ce":5.993176,"dev_wdl_ce":0.745483,"dev_policy_top1":0,"teacher_rows":10,"raw_teacher_rows":20,"move_vocab":44,"feature_dim":15,"wdl_feature_dim":28},"status":"keep","description":"Confirmation rerun of head-separated WDL interaction model on fixed distillation benchmark","timestamp":1777931993228,"segment":1,"confidence":0.18688631900502267,"asi":{"hypothesis":"Because the prior kept improvement was within estimated noise, rerunning the unchanged head-separated WDL interaction model should confirm whether the gain is deterministic/stable under the fixed benchmark.","implementation":"No code changes; reran ./dovetail.sh at commit 44ea0a2 with the fixed consensus-label distillation workload.","evidence":"The rerun reproduced exactly distill_student_score=12.922135, dev_policy_ce=5.993176, and dev_wdl_ce=0.745483 with checks passing, confirming the deterministic benchmark output for this candidate.","overfit_guard":"This was a confirmation run only; no benchmark, label, split, or check changes were made.","next_action_hint":"Continue with overfit-reduction or robustness-oriented changes rather than adding more WDL feature dimensions."}}
{"type":"research_run","run_id":"R0025","node_id":"N0025","lane_id":"L006","phase":"explore","status":"discard","metric":12.890689,"metrics":{"distill_student_score":12.890689,"train_policy_ce":1.631707,"train_wdl_ce":0.411843,"dev_policy_ce":5.993176,"dev_wdl_ce":0.764361,"dev_policy_top1":0,"teacher_rows":10,"raw_teacher_rows":20,"move_vocab":44,"feature_dim":15,"wdl_feature_dim":28,"wdl_draw_regularization":0.1},"benchmark_id":"tiny_leela_teacher_distill_seed_v2","commit":"8cc07dd","base_commit":"8cc07dd","hypothesis":"Training-only draw regularization for the WDL head should reduce overfitting while preserving the fixed consensus-label evaluation target.","implementation":"Added train_wdl_target() with a fixed draw_regularized mode that shifts 10% WDL training mass to draw, and ran the fixed distillation benchmark through the internal dovetail runner.","learned":"Draw regularization did not help the current head-separated model: score fell from 12.922135 to 12.890689. Policy CE was unchanged, but dev_wdl_ce regressed from 0.745483 to 0.764361, so the prior best WDL interactions should remain unchanged.","next_action":"Discard and revert. Avoid WDL regularization on this tiny fixed seed unless validated across a broader cross-fold or larger label set.","timestamp":"2026-05-04T22:02:26.284Z"}
{"type":"research_run","run_id":"R0026","node_id":"N0027","lane_id":"L006","phase":"explore","status":"discarded","metric":12.841531,"metrics":{"distill_student_score":12.841531,"train_policy_ce":1.631707,"train_wdl_ce":0.435944,"dev_policy_ce":5.993176,"dev_wdl_ce":0.794058,"dev_policy_top1":0,"teacher_rows":10,"raw_teacher_rows":20,"move_vocab":44,"feature_dim":15,"wdl_feature_dim":28,"wdl_train_source_stockfish":1},"benchmark_id":"tiny_leela_fixed_teacher_distill_consensus_v1","commit":"11bf83c","base_commit":"11bf83c","hypothesis":"Training the WDL head from Stockfish-only value targets while keeping consensus policy/evaluation should exploit Stockfish's lower WDL validation loss without sacrificing combined policy labels.","implementation":"Added source-aware merged rows that retain per-teacher WDL labels and a --wdl-train-source option; ran the fixed dovetail distillation benchmark with --wdl-train-source stockfish.","learned":"Stockfish-only WDL training hurt the consensus evaluation target: score fell from current best 12.922135 to 12.841531, with dev_wdl_ce worsening from 0.745483 to 0.794058 while policy CE stayed unchanged. The consensus WDL label is better aligned with the current benchmark than Stockfish-only WDL despite earlier raw-source ablation hints.","next_action":"Discard and revert. Do not specialize WDL to Stockfish under the consensus benchmark; next try robustness/cross-fold reporting or increase teacher-label coverage in a new segment.","timestamp":"2026-05-04T22:35:42.084Z"}
