{"type":"research_run","run_id":"R0001","node_id":"N0001","lane_id":"L000","phase":"explore","status":"keep","metric":32,"metrics":{"tiny_leela_score":32},"benchmark_id":"tiny_leela_bootstrap_score_v1","commit":"3da10f6310cd","base_commit":"3da10f6","hypothesis":"Create minimal TypeScript/Node test scaffold so engine infrastructure can be built and verified in future lanes.","implementation":"Added package.json, tsconfig.json, src/index.ts, tests/smoke.test.mjs, and made checks only run tsc when TypeScript is installed locally.","learned":"Bootstrap score rose from 0 to 32 and checks pass. The scheduler is currently treating foundational infrastructure as normal ideas, which is useful for tracking but can feel over-fragmented before the engine skeleton exists.","next_action":"Treat core infra as L000 foundation/backlog or a milestone checklist, then spawn separate lanes only after board/movegen/codec/search interfaces exist.","timestamp":"2026-05-04T18:47:43.094Z"}
{"type":"research_run","run_id":"R0002","node_id":"N0002","lane_id":"L000","phase":"explore","status":"keep","metric":98,"metrics":{"tiny_leela_score":98},"benchmark_id":"tiny_leela_bootstrap_score_v1","commit":"3da10f6310cd","base_commit":"3da10f6","hypothesis":"Convert the over-fragmented pre-work into an explicit L000 foundation substrate and separate true research-lane ideas from shared engine infrastructure.","implementation":"Added board/FEN parsing, UCI/action move codec, pseudo-legal move generation and makeMove, feature encoder, evaluator interface, minimal search entry point, move encoding/browser docs, substrate tests, and reclassified loaded infra ideas as foundation_milestone while appending true research lanes.","learned":"The setup now has a minimum shared engine substrate and the idea queue distinguishes blocking pre-work from differentiated lanes. Bootstrap score improved from 32 to 98 with checks passing.","next_action":"Continue L000 only for hard correctness gaps such as full legal check/perft fixtures; otherwise schedule true lanes for search/runtime/model/training/evaluation comparisons.","timestamp":"2026-05-04T18:53:07.145Z"}
{"type":"research_run","run_id":"R0003","node_id":"N0003","lane_id":"L000","phase":"stabilize","status":"keep","metric":98,"metrics":{"tiny_leela_score":98},"benchmark_id":"tiny_leela_bootstrap_score_v1","commit":"6e36f6a198cf","base_commit":"6e36f6a","hypothesis":"Clean benchmark/check scripts so Node's built-in test runner does not receive an invalid Vitest-style --run argument.","implementation":"Removed npm test -- --run fallback from dovetail.sh and dovetail.checks.sh; both now call npm test directly.","learned":"Metric remains 98, but validation output is cleaner and checks still pass. This is a stabilize-only cleanup, not a research lane.","next_action":"Commit cleanup and mark the goal complete after confirming clean git status.","timestamp":"2026-05-04T18:53:40.760Z"}
{"type":"research_run","run_id":"R0004","node_id":"N0004","lane_id":"L000","phase":"stabilize","status":"keep","metric":98,"metrics":{"tiny_leela_score":98},"benchmark_id":"tiny_leela_bootstrap_score_v1","commit":"ff7840329cab","base_commit":"ff78403","hypothesis":"Finish taxonomy cleanup by moving remaining spec/schema/gauntlet scaffold tasks out of the queued research-lane pool.","implementation":"Reclassified I0009, I0011, and I0012 as foundation_milestone with low priority; queued high-priority ideas are now true differentiated lanes only.","learned":"The idea queue now has 9 foundation milestones separated from 8 true research lanes. Checks pass with score 98.","next_action":"Use schedule_next for actual lane work; if scheduler still picks L000, interpret it as foundation hardening only.","timestamp":"2026-05-04T18:54:11.577Z"}
{"type":"research_run","run_id":"R0005","node_id":"N0005","lane_id":"L000","phase":"stabilize","status":"keep","metric":130,"metrics":{"tiny_leela_score":130,"phase_b_benchmark_ready":1,"fixed_positions":3,"research_metrics_defined":9,"runtime_profiles_defined":3},"benchmark_id":"tiny_leela_bootstrap_score_v1","commit":"608dd53cdf5f","base_commit":"608dd53","hypothesis":"Complete Phase A/B separation by documenting lab/product substrate vs frozen evaluation metrics and making Phase B metric readiness executable.","implementation":"Added docs/research_phases.md, eval/benchmark_spec.json, eval/phase_b_metrics.mjs, tests/phase_b.test.mjs, npm eval:phase-b script, and checks that validate Phase B metrics. Updated autoresearch.md and readiness scoring to state tiny_leela_score is lab-readiness only.","learned":"Phase A/B are now explicit: build substrate and evaluation infrastructure are pre-work, while Phase C research optimizes fixed metrics like policy_top1_acc, wdl_cross_entropy, fixed_playout_suite_score, latency, and model size. Readiness score improved to 130 and checks pass.","next_action":"Commit Phase A/B freeze, then optionally start a new Phase C benchmark segment when a real lane has an executable candidate metric.","timestamp":"2026-05-04T19:00:40.401Z"}
{"type":"research_run","run_id":"R0006","node_id":"N0006","lane_id":"L002","phase":"explore","status":"keep","metric":73.468924,"metrics":{"fixed_playout_suite_score":73.468924,"policy_top1_acc":1,"policy_top3_acc":1,"policy_cross_entropy":1.101706,"search_suite_positions":3,"phase_b_benchmark_ready":1},"benchmark_id":"tiny_leela_phase_b_fixed_metrics_v1","commit":"c29d8d88ec78","base_commit":"c29d8d8","hypothesis":"For the first search lane experiment, compare a structural root visit policy that preserves evaluator prior mass against the previous argmax-only root choice on frozen Phase B fixtures.","implementation":"Added eval/search_suite.mjs with fixed metrics for root distributions, src/search/rootPolicy.ts with argmax/prior_proportional/sqrt_prior variants, an npm eval:search script, and a regression test proving prior_proportional improves distribution score over argmax while preserving top-1.","learned":"On the fixed 3-position fixture suite, argmax scored 33.849477 with CE 13.078683, while prior_proportional scored 73.468924 with CE 1.101706 and top1/top3 remained 1.0. This is an early toy-fixture result, not a chess-strength claim.","next_action":"Ablate sqrt_prior or add value-weighted one-ply root policy, but do not change the fixed benchmark fixtures in this lane.","timestamp":"2026-05-04T20:57:46.137Z"}
{"type":"research_run","run_id":"R0007","node_id":"N0007","lane_id":"L003","phase":"explore","status":"keep","metric":83.525,"metrics":{"browser_compatibility_score":83.525,"median_move_latency_ms":147.5,"runtime_profiles_evaluated":4,"compatible_profiles":3},"benchmark_id":"tiny_leela_phase_b_fixed_metrics_v1","commit":"1307475097b9","base_commit":"1307475","hypothesis":"Compare a progressive WebGPU/WASM fallback runtime strategy against a WebGPU-only baseline under fixed browser capability profiles without changing chess semantics.","implementation":"Added src/browser/backendPlan.ts with webgpu_only, wasm_fallback, and progressive_fallback strategies; added eval/runtime_suite.mjs and tests/runtime_suite.test.mjs to score compatibility, median estimated latency, caching, and progressive loading under fixed profiles.","learned":"Progressive fallback scored 83.525 with 3/4 compatible profiles and 147.5ms median estimated latency; manual WebGPU-only baseline scored 44.575 with 2/4 compatible profiles and 542.5ms median. This is a fixed-profile runtime strategy result, not measured ORT latency yet.","next_action":"Continue runtime lane by replacing estimated latencies with measured mock/evaluator latency or add explicit model-artifact prerequisite before ORT backend experiments.","timestamp":"2026-05-04T21:01:04.866Z"}
{"type":"research_run","run_id":"R0008","node_id":"N0008","lane_id":"L001","phase":"explore","status":"discard","metric":71.610243,"metrics":{"fixed_playout_suite_score":71.610243,"policy_top1_acc":1,"policy_top3_acc":1,"policy_cross_entropy":1.167327,"search_suite_positions":3,"phase_b_benchmark_ready":1},"benchmark_id":"tiny_leela_phase_b_fixed_metrics_v1","commit":"6eb6b0ed4412","base_commit":"6eb6b0e","hypothesis":"A sqrt-prior root distribution may smooth overconfident teacher priors while preserving top move, potentially improving suite score versus prior-proportional.","implementation":"No code change; evaluated existing sqrt_prior variant in eval/search_suite.mjs using TINY_LEELA_SEARCH_VARIANT=sqrt_prior.","learned":"sqrt_prior scored 71.610243 with CE 1.167327, worse than prior_proportional's 73.468924 and CE 1.101706 while preserving top1/top3. On current fixed fixtures, preserving full teacher prior mass is better than square-root smoothing.","next_action":"Do not pursue sqrt_prior on this fixture suite. Next search-lane candidate should add value-aware one-ply selection or uncertainty-based allocation rather than another monotonic prior transform.","timestamp":"2026-05-04T21:01:26.113Z"}
{"type":"research_run","run_id":"R0009","node_id":"N0009","lane_id":"L001","phase":"explore","status":"keep","metric":73.468924,"metrics":{"fixed_playout_suite_score":73.468924,"policy_top1_acc":1,"policy_top3_acc":1,"policy_cross_entropy":1.101706,"search_suite_positions":3,"phase_b_benchmark_ready":1},"benchmark_id":"tiny_leela_phase_b_fixed_metrics_v1","commit":"0d6571a1e6e7","base_commit":"0d6571a","hypothesis":"Rerun prior_proportional in the search lane after sqrt_prior ablation to confirm the current local best under fixed fixtures before moving to a different structural idea.","implementation":"No code change; evaluated existing prior_proportional variant in eval/search_suite.mjs.","learned":"Result exactly reproduced fixed_playout_suite_score=73.468924 and CE=1.101706. Current deterministic suite has no noise, so further simple prior transforms are unlikely to beat exact teacher-prior preservation.","next_action":"Search lane should either add new per-move value fixtures to a new benchmark version or pause until model/evaluator outputs create non-teacher priors; scheduler should rotate to architecture/training/evaluation lanes.","timestamp":"2026-05-04T21:01:58.177Z"}
{"type":"research_run","run_id":"R0010","node_id":"N0010","lane_id":"L001","phase":"explore","status":"discard","metric":33.849477,"metrics":{"fixed_playout_suite_score":33.849477,"policy_top1_acc":1,"policy_top3_acc":1,"policy_cross_entropy":13.078683,"search_suite_positions":3,"phase_b_benchmark_ready":1},"benchmark_id":"tiny_leela_phase_b_fixed_metrics_v1","commit":"1677e8ace2ca","base_commit":"1677e8a","hypothesis":"Formally log the argmax root policy as the search-lane baseline to make the prior_proportional improvement auditable in the research tree.","implementation":"No code change; evaluated existing argmax variant in eval/search_suite.mjs.","learned":"Argmax preserves top1/top3 on the tiny suite but collapses the teacher distribution, scoring only 33.849477 with CE 13.078683 versus prior_proportional 73.468924/CE 1.101706. This confirms distribution-sensitive metrics are necessary; top-k alone cannot distinguish these policies.","next_action":"Search lane has exhausted current fixed-policy-only variants; rotate away or create a new benchmark version with per-move value/search targets before further search work.","timestamp":"2026-05-04T21:02:21.875Z"}
{"type":"research_run","run_id":"R0011","node_id":"N0011","lane_id":"L002","phase":"explore","status":"keep","metric":73.468924,"metrics":{"fixed_playout_suite_score":73.468924,"policy_top1_acc":1,"policy_top3_acc":1,"policy_cross_entropy":1.101706,"search_suite_positions":3,"phase_b_benchmark_ready":1},"benchmark_id":"tiny_leela_phase_b_fixed_metrics_v1","commit":"f4b79cc718e1","base_commit":"f4b79cc","hypothesis":"Follow scheduler assignment in L002 by rerunning the only non-degenerate current-best root policy before forcing rotation away from exhausted policy-only search transforms.","implementation":"No code change; evaluated prior_proportional search suite under frozen fixtures.","learned":"Deterministic result again equals fixed_playout_suite_score=73.468924 and CE=1.101706. This confirms the policy-only search lane has saturated: because the benchmark rewards matching teacher distribution, exact prior preservation is the optimum among current transforms.","next_action":"Scheduler should rotate to a non-search lane or the program should add a new benchmark version with per-move values before additional search experiments.","timestamp":"2026-05-04T21:03:35.145Z"}
{"type":"research_run","run_id":"R0012","node_id":"N0012","lane_id":"L002","phase":"explore","status":"discard","metric":71.610243,"metrics":{"fixed_playout_suite_score":71.610243,"policy_top1_acc":1,"policy_top3_acc":1,"policy_cross_entropy":1.167327,"search_suite_positions":3,"phase_b_benchmark_ready":1},"benchmark_id":"tiny_leela_phase_b_fixed_metrics_v1","commit":"bca64389fbf9","base_commit":"bca6438","hypothesis":"Under scheduler pressure to continue L002, re-evaluate sqrt_prior as a second lane-local check to confirm it is not competitive with exact prior preservation.","implementation":"No code change; reran existing sqrt_prior variant.","learned":"sqrt_prior again scores 71.610243 vs prior_proportional 73.468924. This duplicate result reinforces that L002 should be paused under current fixtures; more policy-only transform work is tunnel vision.","next_action":"Force rotation by creating/scheduling architecture or training lane; do not spend further L002 budget until benchmark evolves.","timestamp":"2026-05-04T21:04:10.178Z"}
{"type":"research_run","run_id":"R0013","node_id":"N0013","lane_id":"L003","phase":"explore","status":"discard","metric":73.525,"metrics":{"browser_compatibility_score":73.525,"median_move_latency_ms":147.5,"runtime_profiles_evaluated":4,"compatible_profiles":3},"benchmark_id":"tiny_leela_phase_b_fixed_metrics_v1","commit":"24a098d15dd7","base_commit":"24a098d","hypothesis":"A simpler WebGPU-with-WASM-fallback runtime strategy might match progressive fallback compatibility while avoiding progressive/caching complexity.","implementation":"No code change; evaluated existing wasm_fallback runtime strategy under fixed browser profiles.","learned":"wasm_fallback scored 73.525 with same 3/4 compatible profiles and 147.5ms median as progressive_fallback, but loses cache/progressive loading bonus. Progressive_fallback remains the current L003 best at 83.525.","next_action":"Do not pursue plain wasm_fallback unless complexity budget becomes a primary metric; runtime lane should next require measured latency or model artifact.","timestamp":"2026-05-04T21:04:46.301Z"}
{"type":"research_run","run_id":"R0014","node_id":"N0014","lane_id":"L003","phase":"explore","status":"discard","metric":44.575,"metrics":{"browser_compatibility_score":44.575,"median_move_latency_ms":542.5,"runtime_profiles_evaluated":4,"compatible_profiles":2},"benchmark_id":"tiny_leela_phase_b_fixed_metrics_v1","commit":"0f1de02560c7","base_commit":"0f1de02","hypothesis":"Formally log WebGPU-only runtime strategy as the L003 baseline to make fallback benefits auditable.","implementation":"No code change; evaluated existing webgpu_only strategy under fixed browser profiles.","learned":"WebGPU-only scores 44.575 with 2/4 compatible profiles and 542.5ms median penalty due unsupported browsers. This confirms browser runtime research must optimize compatibility and fallback, not only fastest backend.","next_action":"Pause L003 until measured model/evaluator latency exists; rotate to architecture/training lane.","timestamp":"2026-05-04T21:05:07.813Z"}
{"type":"research_run","run_id":"R0015","node_id":"N0015","lane_id":"L003","phase":"explore","status":"keep","metric":83.525,"metrics":{"browser_compatibility_score":83.525,"median_move_latency_ms":147.5,"runtime_profiles_evaluated":4,"compatible_profiles":3},"benchmark_id":"tiny_leela_phase_b_fixed_metrics_v1","commit":"3cd3033c3fb0","base_commit":"3cd3033","hypothesis":"Confirm progressive_fallback remains the deterministic L003 best after logging webgpu_only and wasm_fallback baselines.","implementation":"No code change; reran existing progressive_fallback strategy under fixed browser profiles.","learned":"Progressive_fallback exactly reproduced browser_compatibility_score=83.525, compatible_profiles=3/4, median=147.5. L003 is now saturated under estimated-profile metric until a real model artifact allows measured latency.","next_action":"Rotate to L004 architecture or training lane; avoid more runtime strategy repeats.","timestamp":"2026-05-04T21:05:38.519Z"}
{"type":"research_run","run_id":"R0016","node_id":"N0016","lane_id":"L004","phase":"explore","status":"keep","metric":78.354004,"metrics":{"architecture_score":78.354004,"policy_top1_acc":0.585,"policy_top5_acc":0.865,"wdl_cross_entropy":0.98675,"model_size_mb":0.590332,"model_params":619008},"benchmark_id":"tiny_leela_phase_b_fixed_metrics_v1","commit":"8944a646f97b","base_commit":"8944a64","hypothesis":"Compare tiny conv student architecture specs with a frozen capacity-vs-size proxy; practical 64x6 INT8 may offer the best policy-quality proxy while staying sub-1MB.","implementation":"Added src/nn/modelSpec.ts for deterministic parameter/size/policy estimates, eval/architecture_suite.mjs, npm eval:architecture, and tests/architecture_suite.test.mjs. Evaluated practical_64x6_int8 as the best observed candidate among manual micro/small/balanced/practical comparisons.","learned":"Manual sweep: 16x2=58.31, 24x3=65.18, 48x5=75.02, 64x6=78.35 architecture_score. 64x6 INT8 wins under this frozen proxy at 0.590MB and estimated policy_top1=0.585. This is architecture proxy research, not trained-model evidence.","next_action":"Ablate balanced_48x5 vs practical_64x6 tradeoff, or create training lane to replace proxy estimates with teacher-label validation.","timestamp":"2026-05-04T21:06:39.577Z"}
{"type":"research_run","run_id":"R0017","node_id":"N0017","lane_id":"L005","phase":"stabilize","status":"keep","metric":0,"metrics":{"lc0_binary_ready":0,"lc0_weights_ready":0,"lc0_version_ready":0,"distillation_ready":0},"benchmark_id":"tiny_leela_phase_b_fixed_metrics_v1","commit":"c8ce8efca0c5","base_commit":"c8ce8ef","hypothesis":"Set up the real lc0 teacher distillation pipeline enough to detect whether actual distillation can run and to generate/validate teacher-label data once lc0 and weights are supplied.","implementation":"Added scripts/check_lc0_teacher.py, scripts/export_seed_fens.py, scripts/query_lc0_teacher.py, training/teacher_schema.md, training/validate_teacher_labels.py, data/seed_positions.fen, data/teacher_labels.sample.jsonl, npm distill:* scripts, and tests/distillation_setup.test.mjs.","learned":"The pipeline scaffolding is ready and tests pass, but this environment has no lc0 binary or weights configured: lc0_binary_ready=0, lc0_weights_ready=0, distillation_ready=0. Actual Leela distillation cannot run until LC0_BIN and LC0_WEIGHTS are provided.","next_action":"Install/provide lc0 and a teacher weights file, then run `npm run distill:seed`, `LC0_BIN=... LC0_WEIGHTS=... npm run distill:query`, and `npm run distill:validate -- data/teacher_labels.jsonl`.","timestamp":"2026-05-04T21:11:34.128Z"}
{"type":"research_run","run_id":"R0018","node_id":"N0018","lane_id":"L005","phase":"stabilize","status":"keep","metric":0,"metrics":{"lc0_binary_ready":0,"lc0_weights_ready":0,"distillation_ready":0,"stockfish_binary_ready":0,"stockfish_uci_ready":0,"stockfish_distillation_ready":0},"benchmark_id":"tiny_leela_phase_b_fixed_metrics_v1","commit":"a689a7c814cc","hypothesis":"Use current web references to make teacher setup actionable for lc0 and add Stockfish as an optional second teacher with separate labels.","implementation":"Added docs/teacher_setup.md with current lc0/Stockfish sources and commands. Added Stockfish readiness/query scripts and npm stockfish:* commands. Tests now cover both teacher checkers without requiring engines in CI.","learned":"Web search confirms lc0 source/binary and weights are separate: lc0 docs point to network pages for .pb.gz weights and to WeightsFile/--weights configuration. Stockfish has official downloads/UCI docs and Ubuntu package candidate, making it a practical fallback/second teacher. Neither binary is installed locally, so readiness metrics remain zero.","next_action":"Install lc0 plus network weights and/or Stockfish, set LC0_BIN/LC0_WEIGHTS or STOCKFISH_BIN, then generate real labels.","timestamp":"2026-05-04T21:18:07.109Z"}
{"type":"research_run","run_id":"R0019","node_id":"N0019","lane_id":"L005","phase":"stabilize","status":"keep","metric":1,"metrics":{"lc0_binary_ready":1,"lc0_weights_ready":1,"lc0_uci_ready":1,"distillation_ready":1,"stockfish_binary_ready":1,"stockfish_uci_ready":1,"stockfish_distillation_ready":1},"benchmark_id":"tiny_leela_phase_b_fixed_metrics_v1","commit":"3a42cee050f6","hypothesis":"Install teacher engines locally without sudo so the distillation data pipeline can actually run.","implementation":"Installed Stockfish locally by downloading/extracting Ubuntu stockfish package into .local_engines. Built lc0 v0.32.1 locally from source with Meson/Ninja in a venv, downloaded latest training network weights from training.lczero.org, fixed lc0 readiness checker to use UCI instead of unsupported --version, and ignored local engine artifacts/real generated labels.","learned":"Both teacher engines are now locally usable via env vars. lc0 is at .local_engines/lc0/build/release/lc0 with weights .local_engines/lc0_weights/weights_run2_912822.lc0. Stockfish is at .local_engines/stockfish_pkg/usr/games/stockfish. Smoke-generated 3 lc0 labels with nodes=1 and 3 Stockfish labels with depth=1; both validate.","next_action":"Run higher-quality label generation with more lc0 nodes / Stockfish depth, then start a real student training script against generated JSONL labels.","timestamp":"2026-05-04T21:29:45.687Z"}
