{"type":"research_run","run_id":"R0027","node_id":"N0028","lane_id":"L006","phase":"explore","status":"kept","metric":13.309426,"metrics":{"distill_student_score":13.309426,"train_policy_ce":1.689969,"train_wdl_ce":0.413288,"dev_policy_ce":5.757296,"dev_wdl_ce":0.756176,"dev_policy_top1":0,"teacher_rows":10,"raw_teacher_rows":20,"move_vocab":44,"feature_dim":15,"wdl_feature_dim":28,"weight_average_count":600},"benchmark_id":"tiny_leela_fixed_teacher_distill_consensus_v1","commit":"0dadb9a","base_commit":"0dadb9a","hypothesis":"Polyak/SWA-style weight averaging over the second half of training should reduce tiny-dataset SGD overfit/variance while preserving the fixed consensus-label benchmark.","implementation":"Added --average-weights to the dependency-free student trainer. During the second half of training it accumulates policy and WDL weights each epoch, evaluates/serializes their average, and the fixed dovetail benchmark now enables this option.","learned":"Weight averaging improved the fixed consensus benchmark from current best 12.922135 to 13.309426. The gain came from better dev_policy_ce (5.993176 -> 5.757296) while dev_wdl_ce slightly worsened (0.745483 -> 0.756176). Training losses rose, consistent with reduced overfit rather than stronger memorization.","next_action":"Keep averaged weights as the new baseline. Confirm determinism once, then try robustness/cross-fold reporting or mild objective regularization only if it improves validation without adding feature dimensions.","timestamp":"2026-05-04T22:38:24.870Z"}
{"type":"research_run","run_id":"R0028","node_id":"N0029","lane_id":"L006","phase":"explore","status":"kept","metric":13.309426,"metrics":{"distill_student_score":13.309426,"train_policy_ce":1.689969,"train_wdl_ce":0.413288,"dev_policy_ce":5.757296,"dev_wdl_ce":0.756176,"dev_policy_top1":0,"teacher_rows":10,"raw_teacher_rows":20,"move_vocab":44,"feature_dim":15,"wdl_feature_dim":28,"weight_average_count":600},"benchmark_id":"tiny_leela_fixed_teacher_distill_consensus_v1","commit":"c300245","base_commit":"c300245","hypothesis":"A deterministic confirmation rerun of the averaged-weight student should reproduce the current best fixed consensus distillation score before further exploration.","implementation":"No code changes. Reran the current dovetail benchmark ./dovetail.sh at commit c300245 with --average-weights enabled.","learned":"The averaged-weight candidate exactly reproduced distill_student_score=13.309426, dev_policy_ce=5.757296, and dev_wdl_ce=0.756176 with checks passing. The current benchmark is deterministic for this candidate, so the improvement over 12.922135 is stable under rerun.","next_action":"Continue automated dovetail exploration. Prefer robustness/cross-fold reporting or data-coverage improvements over adding more WDL feature dimensions or teacher-source specialization.","timestamp":"2026-05-04T22:40:23.385Z"}
{"type":"research_run","run_id":"R0029","node_id":"N0030","lane_id":"L000","phase":"explore","status":"kept","metric":13.309426,"metrics":{"distill_student_score":13.309426,"train_policy_ce":1.689969,"train_wdl_ce":0.413288,"dev_policy_ce":5.757296,"dev_wdl_ce":0.756176,"dev_policy_top1":0,"teacher_rows":10,"raw_teacher_rows":20,"move_vocab":44,"feature_dim":15,"wdl_feature_dim":28,"weight_average_count":600},"benchmark_id":"tiny_leela_fixed_teacher_distill_consensus_v1","commit":"c300245","base_commit":"c300245","hypothesis":"The baseline trajectory should adopt the current averaged-weight distillation benchmark result so L000 reflects the active Phase C segment best rather than the pre-averaging baseline.","implementation":"No code changes. Ran the scheduler-assigned L000 quantum against the current fixed dovetail benchmark ./dovetail.sh, which includes consensus labels, WDL head interactions, and averaged weights.","learned":"L000 reproduces the current best distill_student_score=13.309426 with checks passing. This synchronizes the baseline trajectory with the kept L006 averaged-weight candidate; no new model behavior was introduced.","next_action":"Scheduler should return to L006 or spawn a new data/robustness lane for non-duplicate improvements such as cross-fold reporting or larger teacher-label coverage.","timestamp":"2026-05-04T22:40:56.210Z"}
{"type":"research_run","run_id":"R0030","node_id":"N0031","lane_id":"L000","phase":"explore","status":"kept","metric":13.309426,"metrics":{"distill_student_score":13.309426,"train_policy_ce":1.689969,"train_wdl_ce":0.413288,"dev_policy_ce":5.757296,"dev_wdl_ce":0.756176,"dev_policy_top1":0,"teacher_rows":10,"raw_teacher_rows":20,"move_vocab":44,"feature_dim":15,"wdl_feature_dim":28,"weight_average_count":600,"fold_score_mean":12.742533,"fold_score_std":0.566893},"benchmark_id":"tiny_leela_fixed_teacher_distill_consensus_v1","commit":"52dcae7","base_commit":"52dcae7","hypothesis":"Adding explicit alternate-holdout fold reporting should improve robustness visibility without changing the fixed primary benchmark score or training target.","implementation":"Refactored training into train_once() and added --report-folds. The primary metric remains the original holdout offset 0 score; when reporting is enabled the trainer also trains alternate holdout offsets and emits fold_score_mean/std as secondary diagnostics. dovetail.sh enables the reporting flag.","learned":"Primary distill_student_score stayed exactly 13.309426, preserving benchmark comparability. The two-fold mean is 12.742533 with std 0.566893, showing the tiny 10-position consensus split is sensitive to holdout choice; future improvements should be checked against fold robustness, not only the primary split.","next_action":"Keep robustness reporting as diagnostics. Next structural work should try to improve fold_score_mean or add more teacher-label coverage in a new segment, while leaving the fixed primary metric intact.","timestamp":"2026-05-04T22:42:14.474Z"}
{"type":"research_run","run_id":"R0031","node_id":"N0032","lane_id":"L000","phase":"explore","status":"kept","metric":13.309426,"metrics":{"distill_student_score":13.309426,"train_policy_ce":1.689969,"train_wdl_ce":0.413288,"dev_policy_ce":5.757296,"dev_wdl_ce":0.756176,"dev_policy_top1":0,"teacher_rows":10,"raw_teacher_rows":20,"move_vocab":44,"feature_dim":15,"wdl_feature_dim":28,"weight_average_count":600,"fold_score_mean":12.742533,"fold_score_std":0.566893},"benchmark_id":"tiny_leela_fixed_teacher_distill_consensus_v1","commit":"327d0b4","base_commit":"327d0b4","hypothesis":"A deterministic rerun after adding fold robustness reporting should reproduce both the primary score and the new fold diagnostics before rotating back to model research.","implementation":"No code changes. Reran ./dovetail.sh with --report-folds enabled at commit 327d0b4.","learned":"Primary and robustness diagnostics reproduced exactly: distill_student_score=13.309426, fold_score_mean=12.742533, fold_score_std=0.566893. Reporting is deterministic and safe to keep as a secondary diagnostic.","next_action":"End the L000 duplicate quantum and rotate to a true model/data lane. Next useful work should improve fold_score_mean or expand teacher-label coverage rather than repeating baseline confirmations.","timestamp":"2026-05-04T22:42:44.149Z"}
{"type":"research_run","run_id":"R0032","node_id":"N0033","lane_id":"L006","phase":"explore","status":"kept","metric":13.328393,"metrics":{"distill_student_score":13.328393,"train_policy_ce":1.689969,"train_wdl_ce":0.387171,"dev_policy_ce":5.757296,"dev_wdl_ce":0.745483,"dev_policy_top1":0,"teacher_rows":10,"raw_teacher_rows":20,"move_vocab":44,"feature_dim":15,"wdl_feature_dim":28,"weight_average_count":600,"average_policy_only":1,"fold_score_mean":12.76422,"fold_score_std":0.564173},"benchmark_id":"tiny_leela_fixed_teacher_distill_consensus_v1","commit":"320ba45","base_commit":"320ba45","hypothesis":"Because full weight averaging improved policy validation but slightly worsened WDL, averaging only the policy head while leaving final WDL weights should preserve both benefits under the fixed consensus benchmark.","implementation":"Added --average-policy-only. The trainer still accumulates second-half weights, averages policy weights, but uses the final WDL weights when this mode is enabled. dovetail.sh runs this policy-only averaging mode with fold reporting.","learned":"Policy-only averaging improved the primary score from 13.309426 to 13.328393. dev_policy_ce stayed at the averaged-policy value 5.757296, while dev_wdl_ce returned to the stronger final-WDL value 0.745483. Fold diagnostics also improved slightly: mean 12.742533 -> 12.764220 and std 0.566893 -> 0.564173.","next_action":"Keep policy-only averaging as the new baseline. Confirm deterministic rerun, then explore head-specific averaging or larger data only if fold robustness improves.","timestamp":"2026-05-04T22:43:32.725Z"}
{"type":"research_run","run_id":"R0033","node_id":"N0034","lane_id":"L011","phase":"explore","status":"kept","metric":13.328393,"metrics":{"distill_student_score":13.328393,"train_policy_ce":1.689969,"train_wdl_ce":0.387171,"dev_policy_ce":5.757296,"dev_wdl_ce":0.745483,"dev_policy_top1":0,"teacher_rows":10,"raw_teacher_rows":20,"move_vocab":44,"feature_dim":15,"wdl_feature_dim":28,"weight_average_count":600,"average_policy_only":1,"fold_score_mean":12.76422,"fold_score_std":0.564173,"conv_16x2_score":12.85193,"conv_16x2_score_per_kb":0.504152,"conv_24x3_score":13.308346,"conv_24x3_score_per_kb":0.204572,"conv_48x5_score":13.322949,"conv_48x5_score_per_kb":0.035743,"conv_64x6_score":13.436814,"conv_64x6_score_per_kb":0.01712,"best_conv_channels":16,"best_conv_layers":2,"best_conv_score":12.85193,"best_conv_bytes":26104,"best_conv_score_per_kb":0.504152},"benchmark_id":"tiny_leela_fixed_teacher_distill_consensus_v1","commit":"93c1c8e","base_commit":"93c1c8e","hypothesis":"Comparing frozen conv-tower feature students at 16x2/24x3/48x5/64x6 under the same move encoding and teacher-label split can reveal the best strength-per-byte architecture without weakening the fixed benchmark.","implementation":"Added deterministic board-plane frozen-conv feature extraction plus --compare-conv-archs diagnostics. dovetail.sh now trains the existing policy-only averaged linear baseline as the primary artifact/metric, then trains 16x2, 24x3, 48x5, and 64x6 frozen-conv feature students and reports score and score-per-KB diagnostics.","learned":"Primary comparable distill_student_score stayed at the current best 13.328393. Among conv diagnostics, 64x6 reached the highest raw score at 13.436814, but its byte efficiency was lowest. 16x2 had the best strength-per-byte at 0.504152 score/KB, though raw score 12.851930 trails the baseline. This reveals a raw-strength vs size-efficiency tradeoff and suggests a separate candidate could switch the primary artifact to 64x6 if raw metric is prioritized.","next_action":"Commit kept architecture diagnostics. Then scheduler should either confirm determinism or run a structural candidate that makes 64x6 the primary student artifact if raw distill_student_score remains the priority despite size cost.","timestamp":"2026-05-04T22:57:06.908Z"}
{"type":"research_run","run_id":"R0034","node_id":"N0035","lane_id":"L010","phase":"explore","status":"discarded","metric":13.328319,"metrics":{"distill_student_score":13.328319,"train_policy_ce":1.689949,"train_wdl_ce":0.387152,"dev_policy_ce":5.757882,"dev_wdl_ce":0.74494,"dev_policy_top1":0,"teacher_rows":10,"raw_teacher_rows":20,"move_vocab":44,"feature_dim":15,"wdl_feature_dim":28,"weight_average_count":600,"average_policy_only":1,"separate_head_training":1,"fold_score_mean":12.76584,"fold_score_std":0.562479,"conv_16x2_score":12.85054,"conv_16x2_score_per_kb":0.504097,"conv_24x3_score":13.307756,"conv_24x3_score_per_kb":0.204563,"conv_48x5_score":13.320943,"conv_48x5_score_per_kb":0.035738,"conv_64x6_score":13.435362,"conv_64x6_score_per_kb":0.017118,"best_conv_channels":16,"best_conv_layers":2,"best_conv_score":12.85054,"best_conv_bytes":26104,"best_conv_score_per_kb":0.504097},"benchmark_id":"tiny_leela_fixed_teacher_distill_consensus_v1","commit":"dd3fc39","base_commit":"dd3fc39","hypothesis":"Separating policy and WDL training into independent deterministic streams may reveal objective conflict or improve the fixed distillation score by decoupling head initialization and row order.","implementation":"Added --separate-head-training to initialize and shuffle policy and WDL heads with separate deterministic RNG streams, while keeping policy-only averaging and fixed benchmark labels/split. dovetail.sh enabled the separated-head mode for the run.","learned":"Separated head training slightly worsened the primary score from 13.328393 to 13.328319. It marginally improved dev_wdl_ce (0.745483 -> 0.744940) and fold mean/std (12.764220/0.564173 -> 12.765840/0.562479), but worsened dev_policy_ce (5.757296 -> 5.757882), so the fixed primary objective shows a small policy-vs-WDL tradeoff and does not justify replacing the current best.","next_action":"Discard and revert separated-head primary mode. Keep the insight that WDL can improve at policy cost; if revisited, use diagnostics only or search structural policy-preserving value improvements rather than changing shared training streams.","timestamp":"2026-05-04T23:01:40.986Z"}
{"type":"research_run","run_id":"R0035","node_id":"N0036","lane_id":"L010","phase":"explore","status":"kept","metric":13.328393,"metrics":{"distill_student_score":13.328393,"train_policy_ce":1.689969,"train_wdl_ce":0.387171,"dev_policy_ce":5.757296,"dev_wdl_ce":0.745483,"dev_policy_only_score":14.798818,"dev_wdl_only_score":57.290722,"dev_loss_balance_gap":5.011813,"dev_policy_top1":0,"teacher_rows":10,"raw_teacher_rows":20,"move_vocab":44,"feature_dim":15,"wdl_feature_dim":28,"weight_average_count":600,"average_policy_only":1,"fold_score_mean":12.76422,"fold_score_std":0.564173,"conv_16x2_score":12.85193,"conv_16x2_score_per_kb":0.504152,"conv_24x3_score":13.308346,"conv_24x3_score_per_kb":0.204572,"conv_48x5_score":13.322949,"conv_48x5_score_per_kb":0.035743,"conv_64x6_score":13.436814,"conv_64x6_score_per_kb":0.01712,"best_conv_channels":16,"best_conv_layers":2,"best_conv_score":12.85193,"best_conv_bytes":26104,"best_conv_score_per_kb":0.504152},"benchmark_id":"tiny_leela_fixed_teacher_distill_consensus_v1","commit":"071f229","base_commit":"071f229","hypothesis":"Explicit policy-only, WDL-only, and loss-balance diagnostics can reveal objective conflict while preserving the current best primary student.","implementation":"Added derived dev_policy_only_score, dev_wdl_only_score, and dev_loss_balance_gap metrics. These diagnostics decompose the current combined distillation score without changing training, labels, split, artifact selection, or the primary benchmark metric.","learned":"Primary score reproduced at 13.328393 with checks passing. Diagnostics show the policy term dominates the combined loss: dev_policy_ce=5.757296 vs dev_wdl_ce=0.745483, with dev_policy_only_score=14.798818 and dev_wdl_only_score=57.290722. This supports prioritizing policy-preserving changes; small WDL gains can easily be erased by policy CE regressions.","next_action":"Commit kept loss-balance diagnostics. Avoid separated-head changes that harm policy CE; consider raw-best conv64 primary candidate or policy-target smoothing/coverage only if scheduler assigns it.","timestamp":"2026-05-04T23:06:04.375Z"}
{"type":"research_run","run_id":"R0036","node_id":"N0037","lane_id":"L010","phase":"explore","status":"kept","metric":13.328393,"metrics":{"distill_student_score":13.328393,"train_policy_ce":1.689969,"train_wdl_ce":0.387171,"dev_policy_ce":5.757296,"dev_wdl_ce":0.745483,"dev_policy_only_score":14.798818,"dev_wdl_only_score":57.290722,"dev_loss_balance_gap":5.011813,"dev_policy_top1":0,"teacher_rows":10,"raw_teacher_rows":20,"move_vocab":44,"feature_dim":15,"wdl_feature_dim":28,"weight_average_count":600,"average_policy_only":1,"fold_score_mean":12.76422,"fold_score_std":0.564173,"conv_16x2_score":12.85193,"conv_16x2_score_per_kb":0.504152,"conv_24x3_score":13.308346,"conv_24x3_score_per_kb":0.204572,"conv_48x5_score":13.322949,"conv_48x5_score_per_kb":0.035743,"conv_64x6_score":13.436814,"conv_64x6_score_per_kb":0.01712,"best_conv_channels":16,"best_conv_layers":2,"best_conv_score":12.85193,"best_conv_bytes":26104,"best_conv_score_per_kb":0.504152},"benchmark_id":"tiny_leela_fixed_teacher_distill_consensus_v1","commit":"a44b066","base_commit":"a44b066","hypothesis":"A deterministic rerun of the separated-loss diagnostics should reproduce the loss-balance and conv architecture measurements before the scheduler pivots away from L010.","implementation":"No code changes. Reran ./dovetail.sh at commit a44b066 with policy-only averaging, fold diagnostics, conv architecture diagnostics, and loss-balance metrics enabled.","learned":"All primary and secondary diagnostics reproduced exactly: distill_student_score=13.328393, dev_loss_balance_gap=5.011813, fold_score_mean=12.764220, and conv_64x6_score=13.436814. L010 diagnostics are deterministic; further L010 work should be a structural policy-preserving improvement rather than more confirmations.","next_action":"Commit dovetail confirmation logs. Scheduler should rotate or consider a raw-best conv64 primary artifact candidate in an architecture lane.","timestamp":"2026-05-04T23:10:19.950Z"}
{"type":"research_run","run_id":"R0037","node_id":"N0038","lane_id":"L011","phase":"explore","status":"kept","metric":13.436814,"metrics":{"distill_student_score":13.436814,"train_policy_ce":2.158718,"train_wdl_ce":0.672846,"dev_policy_ce":5.645547,"dev_wdl_ce":0.796693,"dev_policy_only_score":15.047671,"dev_wdl_only_score":55.657797,"dev_loss_balance_gap":4.848853,"dev_policy_top1":0,"teacher_rows":10,"raw_teacher_rows":20,"move_vocab":44,"feature_dim":194,"wdl_feature_dim":194,"weight_average_count":600,"average_policy_only":1,"primary_conv_channels":64,"primary_conv_layers":6,"fold_score_mean":13.040061,"fold_score_std":0.396754,"conv_16x2_score":12.85193,"conv_16x2_score_per_kb":0.504152,"conv_24x3_score":13.308346,"conv_24x3_score_per_kb":0.204572,"conv_48x5_score":13.322949,"conv_48x5_score_per_kb":0.035743,"conv_64x6_score":13.436814,"conv_64x6_score_per_kb":0.01712,"best_conv_channels":16,"best_conv_layers":2,"best_conv_score":12.85193,"best_conv_bytes":26104,"best_conv_score_per_kb":0.504152},"benchmark_id":"tiny_leela_fixed_teacher_distill_consensus_v1","commit":"d0ac858","base_commit":"d0ac858","hypothesis":"The raw-best 64x6 frozen-conv feature student found in L011 diagnostics can improve the primary fixed distillation score if promoted from diagnostic-only to the primary artifact, despite lower strength-per-byte.","implementation":"Added --primary-conv-arch with choices for frozen-conv architecture features and switched dovetail.sh to --primary-conv-arch 64x6 while retaining policy-only averaging, fold reporting, and architecture diagnostics. The output artifact now records frozen_conv_fen_student metadata and conv shape when selected.","learned":"Promoting 64x6 conv features improved the primary distill_student_score from 13.328393 to 13.436814. Policy CE improved (5.757296 -> 5.645547), WDL CE worsened (0.745483 -> 0.796693), and fold robustness improved substantially (mean 12.764220 -> 13.040061, std 0.564173 -> 0.396754). Because the primary metric is dominated by policy CE, the raw-best conv architecture is a clear fixed-benchmark improvement even with larger artifact/features.","next_action":"Commit the kept 64x6 primary candidate and run a deterministic confirmation. Future architecture work can seek smaller conv features that retain the policy CE gain or improve best_conv_score_per_kb.","timestamp":"2026-05-04T23:19:17.826Z"}
{"type":"research_run","run_id":"R0038","node_id":"N0039","lane_id":"L011","phase":"explore","status":"kept","metric":13.436814,"metrics":{"distill_student_score":13.436814,"train_policy_ce":2.158718,"train_wdl_ce":0.672846,"dev_policy_ce":5.645547,"dev_wdl_ce":0.796693,"dev_policy_only_score":15.047671,"dev_wdl_only_score":55.657797,"dev_loss_balance_gap":4.848853,"dev_policy_top1":0,"teacher_rows":10,"raw_teacher_rows":20,"move_vocab":44,"feature_dim":194,"wdl_feature_dim":194,"weight_average_count":600,"average_policy_only":1,"primary_conv_channels":64,"primary_conv_layers":6,"fold_score_mean":13.040061,"fold_score_std":0.396754,"conv_16x2_score":12.85193,"conv_16x2_score_per_kb":0.504152,"conv_24x3_score":13.308346,"conv_24x3_score_per_kb":0.204572,"conv_48x5_score":13.322949,"conv_48x5_score_per_kb":0.035743,"conv_64x6_score":13.436814,"conv_64x6_score_per_kb":0.01712,"best_conv_channels":16,"best_conv_layers":2,"best_conv_score":12.85193,"best_conv_bytes":26104,"best_conv_score_per_kb":0.504152},"benchmark_id":"tiny_leela_fixed_teacher_distill_consensus_v1","commit":"492a9fe","base_commit":"492a9fe","hypothesis":"A deterministic rerun should reproduce the newly promoted 64x6 primary conv student and architecture diagnostics before further structural changes.","implementation":"No code changes. Reran ./dovetail.sh with --primary-conv-arch 64x6, fold reporting, and conv architecture diagnostics enabled at commit 492a9fe.","learned":"The promoted 64x6 primary score reproduced exactly at 13.436814, with fold_score_mean=13.040061 and fold_score_std=0.396754. This confirms the new best is deterministic and stable under the fixed benchmark.","next_action":"Commit confirmation logs. Avoid more duplicate 64x6 confirmations; rotate or explore smaller policy-preserving conv features/architecture compression if scheduler remains on L011.","timestamp":"2026-05-04T23:25:53.634Z"}
