{"type":"research_run","run_id":"R0048","node_id":"N0051","lane_id":"L017","phase":"explore","status":"crash","metric":0.5,"metrics":{"selfplay_backend_rust":1,"selfplay_games":2,"selfplay_positions":16,"selfplay_avg_plies":8,"selfplay_decisive_rate":1,"selfplay_adjudicated_rate":1,"selfplay_policy_mass":1,"mix_selfplay_backend_rust":1,"mix_selfplay_games":2,"mix_selfplay_positions":16,"mix_selfplay_decisive_rate":1,"mix_selfplay_adjudicated_rate":1,"mix_0_arena_score_rate":0.5,"mix_0_arena_illegal_losses":0,"mix_0p05_arena_score_rate":0.5,"mix_0p05_arena_illegal_losses":0,"mix_0p1_arena_score_rate":0.5,"mix_0p1_arena_illegal_losses":0,"mix_0p25_arena_score_rate":0.5,"mix_0p25_arena_illegal_losses":0,"mix_backend_rust":1,"mix_weights_tested":4,"mix_best_selfplay_weight":0,"mix_best_arena_score_rate":0.5,"mix_best_distill_student_score":17.012288,"legal_move_selection_rate":1,"legal_policy_mass":1,"playable_shell_ready":1},"benchmark_id":"tiny_leela_rust_selfplay_mix_arena_v1","commit":"0aad6ab","hypothesis":"A small weighted mix of Rust PUCT self-play examples with teacher labels can improve head-to-head arena score versus the current teacher-only baseline without illegal moves.","implementation":"Ran the new Rust-default self-play mix arena segment with backend=rust, 32-visit self-play and 32-visit arena, value adjudication, fixed weights 0/0.05/0.1/0.25, and the existing 64x6 retraining workload.","learned":"The run exceeded the time budget before checks completed (duration 1152s). It still emitted full benchmark metrics: Rust backend was used, generated 2 games/16 positions, all value-adjudicated/decisive, all mix weights tied arena_score_rate=0.5 with zero illegal losses. The current Rust integration shells out to the Rust eval binary per move/evaluation, so process startup and repeated artifact loading likely erase much of native Rust speed during self-play/arena.","next_action":"Do not rerun this workload unchanged. Add periodic progress logs immediately. Then speed up Rust self-play by keeping Rust evaluator/search in-process or batching positions, and/or parallelize independent games/arena games; reduce checks/runtime before the next scheduler run.","timestamp":"2026-05-05T03:53:53.186Z","wall_time_seconds":1152.192}
{"type":"research_run","run_id":"R0049","node_id":"N0052","lane_id":"L017","phase":"explore","status":"crash","metric":0.75,"metrics":{"selfplay_backend_rust":1,"selfplay_games":2,"selfplay_positions":16,"selfplay_avg_plies":8,"selfplay_decisive_rate":1,"selfplay_adjudicated_rate":1,"selfplay_policy_mass":1,"selfplay_output_bytes":8497,"mix_selfplay_backend_rust":1,"mix_selfplay_games":2,"mix_selfplay_positions":16,"mix_selfplay_avg_plies":8,"mix_selfplay_decisive_rate":1,"mix_selfplay_adjudicated_rate":1,"mix_selfplay_policy_mass":1,"mix_0_arena_score_rate":0.75,"mix_0_arena_candidate_elo_estimate":190.848502,"mix_0_arena_illegal_losses":0,"mix_0p05_arena_score_rate":0.5,"mix_0p05_arena_illegal_losses":0,"mix_0p1_arena_score_rate":0.5,"mix_0p1_arena_illegal_losses":0,"mix_0p25_arena_score_rate":0.5,"mix_0p25_arena_illegal_losses":0,"mix_backend_rust":1,"mix_weights_tested":4,"mix_best_selfplay_weight":0,"mix_best_arena_score_rate":0.75,"mix_best_distill_student_score":17.012288,"legal_move_selection_rate":1,"legal_policy_mass":1,"playable_shell_ready":1},"benchmark_id":"tiny_leela_rust_selfplay_mix_arena_v1","commit":"d9d242a","hypothesis":"A small weighted mix of Rust PUCT self-play examples with teacher labels can improve head-to-head arena score versus the current teacher-only baseline without illegal moves.","implementation":"Moved the self-play and arena inner loops into native Rust binaries that load model artifacts once per process, emit progress logs, and are invoked by the existing JS wrappers for Rust backend self-play/mix/arena. Ran dovetail.sh under S0003.","learned":"The benchmark still exceeded the wall-time budget before checks completed (1136s), despite native Rust self-play/arena. Metrics were emitted and showed mix_best_arena_score_rate=0.75 at weight 0 with zero illegal losses, but this is not valid for promotion because the run crashed/timed out and all arena games were value-adjudicated. The lack of visible self-play logs in the run tail is because run_research_experiment only surfaced the final tail; self-play/arena progress occurred early and was pushed out by later Python training/arena output. Remaining slowness is dominated by repeated Python retraining for 4 weights at 40 epochs plus checks, not by self-play move generation alone.","next_action":"Make progress logs durable and visible by teeing self-play/mix/arena logs to artifacts/logs with explicit phase markers in dovetail.sh, and reduce or restructure the expensive repeated training phase before rerunning. Do not treat the 0.75 timed-out/adjudicated result as a kept improvement.","timestamp":"2026-05-05T04:19:10.185Z","wall_time_seconds":1136.012}
{"type":"research_run","run_id":"R0050","node_id":"N0053","lane_id":"L018","phase":"explore","status":"kept","metric":0.75,"metrics":{"selfplay_backend_rust":1,"selfplay_games":2,"selfplay_positions":16,"selfplay_avg_plies":8,"selfplay_decisive_rate":1,"selfplay_adjudicated_rate":1,"selfplay_policy_mass":1,"selfplay_output_bytes":8497,"rust_feature_cache_entries":24,"rust_feature_cache_new_entries":24,"mix_rust_feature_cache_entries":24,"mix_rust_feature_cache_new_entries":24,"mix_0_arena_score_rate":0.75,"mix_0_arena_illegal_losses":0,"mix_0_arena_adjudicated_rate":1,"mix_0p05_arena_score_rate":0.5,"mix_0p05_arena_illegal_losses":0,"mix_0p1_arena_score_rate":0.5,"mix_0p1_arena_illegal_losses":0,"mix_0p25_arena_score_rate":0.5,"mix_0p25_arena_illegal_losses":0,"mix_backend_rust":1,"mix_weights_tested":4,"mix_best_selfplay_weight":0,"mix_best_arena_score_rate":0.75,"mix_best_distill_student_score":17.012288,"legal_move_selection_rate":1,"legal_policy_mass":1,"playable_shell_ready":1},"benchmark_id":"tiny_leela_rust_selfplay_mix_arena_v1","commit":"90daeaa","hypothesis":"A small amount of PUCT self-play visit-policy data mixed with teacher distillation can improve arena score over the current 64x6 baseline while preserving legality and avoiding self-play collapse.","implementation":"Added a Rust frozen-conv feature cache prewarmer, disk-backed Python feature cache support, and parallel candidate weight training/arena evaluation in the mix sweep. dovetail.sh now uses the feature cache and --parallel-candidates with the existing Rust self-play/arena backend.","learned":"The same S0003 workload that previously timed out now completes in 17.2s with checks passing. Native Rust self-play generated 2 games/16 positions, Rust feature cache prewarmed 24 entries, four candidate weights ran in parallel, and all legality/playable checks passed. Primary metric was 0.75 with zero illegal losses, but best weight remained 0 and all arena games were value-adjudicated, so this validates infrastructure speed and legal Rust arena operation more than it proves self-play mix strength.","next_action":"Do not over-interpret weight=0/adjudicated 0.75 as self-play learning. Next, either remove/reduce value adjudication for a true-play arena or increase arena games/starts now that the sweep is fast; implement a real Rust trainer or tinygrad trainer only if scaling beyond cached frozen features becomes a bottleneck.","timestamp":"2026-05-05T04:39:05.741Z","wall_time_seconds":17.185}
{"type":"research_run","run_id":"R0051","node_id":"N0054","lane_id":"L019","phase":"explore","status":"discarded","metric":0.75,"metrics":{"mix_best_arena_score_rate":0.75,"mix_best_selfplay_weight":0,"mix_best_distill_student_score":17.575958,"mix_backend_rust":1,"mix_weights_tested":4,"rust_feature_cache_entries":24,"rust_feature_cache_new_entries":0,"mix_0_arena_score_rate":0.75,"mix_0p05_arena_score_rate":0.5,"mix_0p1_arena_score_rate":0.5,"mix_0p25_arena_score_rate":0.5,"mix_0_arena_adjudicated_rate":1,"mix_0p05_arena_adjudicated_rate":1,"mix_0p1_arena_adjudicated_rate":1,"mix_0p25_arena_adjudicated_rate":1,"legal_move_selection_rate":1,"playable_shell_ready":1,"tinygrad_dev_python_run_seconds":316.731},"benchmark_id":"tiny_leela_rust_selfplay_mix_arena_v1","commit":"6e446b1","hypothesis":"Changing self-play visits and policy temperature may produce less overfit or more diverse training targets, improving arena score at the same teacher/self-play mix.","implementation":"Installed tinygrad into a local .venv-tinygrad, added --trainer=tinygrad to training/train_student.py, threaded --trainer/--python through selfplay_mix_sweep and dovetail.sh, and ran the S0003 sweep using tinygrad DEV=PYTHON because CUDA required nvcc and CPU backend required clang.","learned":"Tinygrad integration is functionally wired but not useful without a compiled GPU/CPU backend. CUDA selection failed due to missing nvcc; CPU backend failed due to missing clang; forced DEV=PYTHON completed but took 316.7s versus 17.2s for the cached Python/parallel baseline. Primary metric stayed 0.75 with best weight 0 and all arena games value-adjudicated, so there is no self-play quality improvement and the backend is slower in current configuration.","next_action":"Install or expose a real tinygrad GPU backend/toolchain (nvcc/CUDA or another supported GPU runtime) and rerun only a trainer A/B before using it in the full dovetail sweep. If GPU backend cannot be installed without sudo/system packages, keep normal Python trainer as default.","timestamp":"2026-05-05T04:50:24.707Z","wall_time_seconds":316.731}
{"type":"research_run","run_id":"R0052","node_id":"N0055","lane_id":"L019","phase":"explore","status":"kept","metric":0.75,"metrics":{"mix_best_arena_score_rate":0.75,"mix_best_selfplay_weight":0,"mix_best_distill_student_score":17.575958,"mix_backend_rust":1,"mix_weights_tested":4,"rust_feature_cache_entries":24,"rust_feature_cache_new_entries":0,"mix_0_arena_score_rate":0.75,"mix_0p05_arena_score_rate":0.5,"mix_0p1_arena_score_rate":0.5,"mix_0p25_arena_score_rate":0.5,"legal_move_selection_rate":1,"playable_shell_ready":1,"tinygrad_cuda_single_candidate_seconds":5.43,"tinygrad_cuda_full_sweep_seconds":21.97,"python_cached_full_sweep_baseline_seconds":17.185},"benchmark_id":"tiny_leela_rust_selfplay_mix_arena_v1","commit":"df56b6e","hypothesis":"Changing self-play visits and policy temperature may produce less overfit or more diverse training targets, improving arena score at the same teacher/self-play mix.","implementation":"Installed user-space CUDA 13 pip packages into .venv-tinygrad (nvidia-cuda-nvcc/runtime/cupti), exported CUDA_HOME/PATH/LD_LIBRARY_PATH from dovetail.sh when TINY_LEELA_TRAINER=tinygrad, verified tinygrad selects the NV backend on the RTX 3090, then reran the full S0003 sweep using tinygrad CUDA.","learned":"GPU backend is now usable without sudo/system CUDA install. A single 40-epoch cached candidate improved from tinygrad DEV=PYTHON ~50.1s to tinygrad CUDA ~5.4s. Full S0003 tinygrad CUDA sweep completed with checks in 22.0s, far faster than DEV=PYTHON 316.7s but still slightly slower than the cached pure-Python parallel baseline of 17.2s for this tiny dataset. Primary metric remained 0.75, best weight 0, all arena games value-adjudicated.","next_action":"Keep normal Python trainer as default for the current tiny dataset. Use tinygrad CUDA only for larger batches/models where launch/compile overhead is amortized, or add a larger trainer-only A/B workload before switching defaults. Next quality-focused step remains a more discriminating non-adjudicated/larger arena.","timestamp":"2026-05-05T04:52:17.701Z","wall_time_seconds":21.97}
{"type":"research_run","run_id":"R0053","node_id":"N0056","lane_id":"L018","phase":"explore","status":"kept","metric":0.75,"metrics":{"mix_best_arena_score_rate":0.75,"mix_best_selfplay_weight":0,"mix_0_arena_score_rate":0.75,"mix_0_arena_true_play_score_rate":0.5,"mix_0_arena_adjudicated_score_rate":0.75,"mix_0_arena_adjudicated_rate":1,"mix_0p05_arena_score_rate":0.5,"mix_0p05_arena_true_play_score_rate":0.5,"mix_0p05_arena_adjudicated_score_rate":0.5,"mix_0p1_arena_score_rate":0.5,"mix_0p1_arena_true_play_score_rate":0.5,"mix_0p1_arena_adjudicated_score_rate":0.5,"mix_0p25_arena_score_rate":0.5,"mix_0p25_arena_true_play_score_rate":0.5,"mix_0p25_arena_adjudicated_score_rate":0.5,"legal_move_selection_rate":1,"playable_shell_ready":1},"benchmark_id":"tiny_leela_rust_selfplay_mix_arena_v1","commit":"ad11610","hypothesis":"A small amount of PUCT self-play visit-policy data mixed with teacher distillation can improve arena score over the current 64x6 baseline while preserving legality and avoiding self-play collapse.","implementation":"Added infrastructure metrics to Rust arena and mix sweep that split arena_score_rate into arena_true_play_score_rate and arena_adjudicated_score_rate while retaining existing primary metric compatibility. Also queued research ideas for larger mirrored opening-start arenas, cached baseline control, Rust WASM browser path, and opening diversity/noise.","learned":"The previous 0.75 best is fully explained by adjudication: weight=0 has true_play_score_rate=0.5 and adjudicated_score_rate=0.75 with adjudicated_rate=1.0. Positive self-play mix weights all have true_play_score_rate=0.5 and adjudicated_score_rate=0.5. This confirms benchmark discrimination was needed; current primary remains compatible but should not be interpreted as true-play strength.","next_action":"Run a new or updated segment using true-play/non-adjudicated arena or larger mirrored opening starts as the primary discriminating metric. Also improve dovetail log surfacing so run_research_experiment returns durable log path and useful tail/head snippets.","timestamp":"2026-05-05T04:57:28.731Z","wall_time_seconds":17.491}
{"type":"research_run","run_id":"R0054","node_id":"N0057","lane_id":"L018","phase":"explore","status":"kept","metric":0.75,"metrics":{"mix_best_arena_score_rate":0.75,"mix_best_selfplay_weight":0,"mix_0_arena_true_play_score_rate":0.5,"mix_0_arena_adjudicated_score_rate":0.75,"mix_0_arena_adjudicated_rate":1,"mix_0p05_arena_true_play_score_rate":0.5,"mix_0p1_arena_true_play_score_rate":0.5,"mix_0p25_arena_true_play_score_rate":0.5,"dovetail_log_started":1,"dovetail_log_bytes":9976,"legal_move_selection_rate":1,"checks_pass":1},"benchmark_id":"tiny_leela_rust_selfplay_mix_arena_v1","commit":"e249169","hypothesis":"A small amount of PUCT self-play visit-policy data mixed with teacher distillation can improve arena score over the current 64x6 baseline while preserving legality and avoiding self-play collapse.","implementation":"Ran the scheduled L018 S0003 Rust self-play mix arena benchmark after enabling explicit dovetail log discoverability and creating scale/discrimination lanes. No scalar tuning changes were made.","learned":"The run reproduced mix_best_arena_score_rate=0.75 with best self-play weight still 0. Split metrics again show the apparent win is value-adjudication driven: weight=0 true-play score is 0.5, adjudicated score is 0.75, adjudicated rate is 1.0. Positive self-play weights remain true-play 0.5. New dovetail logging metrics are visible: dovetail_log_started=1 and dovetail_log_bytes=9976.","next_action":"Scheduler should pivot to the new discrimination/scaling lanes, preferably L020 scaled true-play arena, because further L018 mix-ratio runs on S0003 remain adjudication-contaminated.","timestamp":"2026-05-05T05:07:54.329Z","wall_time_seconds":17.385}
{"type":"research_run","run_id":"R0055","node_id":"N0059","lane_id":"L020","phase":"explore","status":"kept","metric":0.5,"metrics":{"mix_best_arena_true_play_score_rate":0.5,"mix_best_arena_score_rate":0.5,"mix_best_selfplay_weight":0,"mix_selection_metric_arena_true_play_score_rate":1,"mix_0_arena_true_play_score_rate":0.5,"mix_0p05_arena_true_play_score_rate":0.5,"mix_0p1_arena_true_play_score_rate":0.5,"mix_0p25_arena_true_play_score_rate":0.5,"mix_0_arena_adjudicated_rate":0,"mix_0p05_arena_adjudicated_rate":0,"mix_0p1_arena_adjudicated_rate":0,"mix_0p25_arena_adjudicated_rate":0,"selfplay_positions":80,"mix_selfplay_positions":80,"rust_feature_cache_entries":95,"dovetail_log_bytes":120444,"legal_move_selection_rate":1,"checks_pass":1},"benchmark_id":"tiny_leela_scaled_trueplay_arena_v1","commit":"4d2470a","base_commit":"e249169","hypothesis":"Increasing arena games to 32-128 with terminal/true-play scoring will reduce variance and prevent value-adjudication artifacts from being mistaken for real strength gains.","implementation":"Changed the mix sweep to support selecting best candidate by arena_true_play_score_rate and emit mix_best_arena_true_play_score_rate. Updated dovetail.sh for S0004 to run 32 arena games, max_plies=40, adjudicate=terminal, and selection-metric=arena_true_play_score_rate.","learned":"The scaled true-play benchmark removed adjudication contamination: adjudicated_rate was 0 for all weights. However all candidates scored exactly 0.5 true-play score rate over 32 games, with best weight still 0. At max_plies=40 the games appear to be fixed-budget draws rather than decisive strength evidence, so true-play is cleaner but still not discriminative enough yet.","next_action":"Continue in L020/L022 by adding mirrored opening starts or increasing plies/visits/game diversity so terminal/true-play games produce non-identical outcomes without returning to value-adjudication bias.","timestamp":"2026-05-05T05:18:13.538Z","wall_time_seconds":391.649}
{"type":"research_run","run_id":"R0056","node_id":"N0060","lane_id":"L020","phase":"explore","status":"kept","metric":0.5,"metrics":{"mix_best_arena_true_play_score_rate":0.5,"mix_best_arena_max_ply_draw_rate":1,"mix_best_selfplay_weight":0,"mix_0_arena_max_ply_draw_rate":1,"mix_0p05_arena_max_ply_draw_rate":1,"mix_0p1_arena_max_ply_draw_rate":1,"mix_0p25_arena_max_ply_draw_rate":1,"mix_0_arena_avg_plies":40,"mix_0p05_arena_avg_plies":40,"mix_0p1_arena_avg_plies":40,"mix_0p25_arena_avg_plies":40,"mix_0_arena_true_play_score_rate":0.5,"mix_0p05_arena_true_play_score_rate":0.5,"mix_0p1_arena_true_play_score_rate":0.5,"mix_0p25_arena_true_play_score_rate":0.5,"checks_pass":1},"benchmark_id":"tiny_leela_scaled_trueplay_arena_v1","commit":"bb21820","base_commit":"4d2470a","hypothesis":"Increasing arena games to 32-128 with terminal/true-play scoring will reduce variance and prevent value-adjudication artifacts from being mistaken for real strength gains.","implementation":"Added arena_max_ply_draw_rate and per-weight mix forwarding so S0004 can distinguish clean true-play draws from non-discriminative max-ply timeouts. Also queued/created a teacher-assisted correction buffer lane for the user's next desired research direction, but the scheduler kept this quantum on L020.","learned":"The user's concern was exactly right: every candidate and every game hit the ply cap. mix_best_arena_max_ply_draw_rate=1.0 and avg_plies=40 for all weights, so S0004 is currently measuring legal survival to timeout, not strength or conversion. Pure true-play full games should be blocked as a promotion metric until progress/tactical/teacher-assisted readiness improves.","next_action":"Pivot scheduler to teacher-assisted correction buffer or tactical/progress gauntlet. Do not spend more time scaling full-game true-play from start position while max_ply_draw_rate remains 1.0.","timestamp":"2026-05-05T05:34:55.513Z","wall_time_seconds":390.437}
{"type":"research_run","run_id":"R0057","node_id":"N0061","lane_id":"L021","phase":"explore","status":"kept","metric":0.5,"metrics":{"teacher_correction_rows":32,"mix_best_arena_true_play_score_rate":0.5,"mix_best_arena_max_ply_draw_rate":1,"mix_best_selfplay_weight":0,"mix_0_distill_student_score":14.985298,"mix_0p05_distill_student_score":14.802289,"mix_0p1_distill_student_score":14.805103,"mix_0p25_distill_student_score":14.794749,"mix_0_arena_true_play_score_rate":0.5,"mix_0p05_arena_true_play_score_rate":0.5,"mix_0p1_arena_true_play_score_rate":0.5,"mix_0p25_arena_true_play_score_rate":0.5,"checks_pass":1},"benchmark_id":"tiny_leela_scaled_trueplay_arena_v1","commit":"22ed6b8","base_commit":"bb21820","hypothesis":"Generating 64-512 Rust self-play games with longer plies, opening starts, and early-ply stochasticity will produce a replay buffer diverse enough for self-play mix weights to improve true-play arena results.","implementation":"Applied Stockfish teacher corrections to the timeout self-play buffer from the previous run by extracting 32 unique self-play FENs, querying the local packaged Stockfish at depth 6/MultiPV 4, committing data/teacher_corrections_selfplay_mix_arena.jsonl, and adding it to the training inputs in dovetail.sh alongside the existing teacher labels.","learned":"Teacher corrections can be applied to the self-play we just generated, and the pipeline remains valid/check-passing. However simply adding 32 Stockfish-corrected rows as extra teacher data did not change the current full-game true-play result: every arena game still hit max plies and all weights scored 0.5. The offline distillation score shifted downward because the eval/train distribution now includes correction rows, so future runs need a tactical/progress metric rather than relying on full-game arena.","next_action":"Run the dedicated L024 teacher-assisted correction lane or initialize a tactical/progress gauntlet segment to measure whether correction rows improve move quality on the corrected FENs before expecting arena improvement.","timestamp":"2026-05-05T05:43:53.805Z","wall_time_seconds":393.117}
