{"type":"research_run","run_id":"R0039","node_id":"N0040","lane_id":"L011","phase":"explore","status":"discarded","metric":13.189171,"metrics":{"distill_student_score":13.189171,"train_policy_ce":2.103628,"train_wdl_ce":0.668209,"dev_policy_ce":5.760826,"dev_wdl_ce":0.821151,"dev_policy_only_score":14.791091,"dev_wdl_only_score":54.910323,"dev_loss_balance_gap":4.939675,"dev_policy_top1":0,"teacher_rows":10,"raw_teacher_rows":20,"move_vocab":44,"feature_dim":450,"wdl_feature_dim":450,"weight_average_count":600,"average_policy_only":1,"primary_conv_channels":64,"primary_conv_layers":6,"fold_score_mean":12.764961,"fold_score_std":0.42421,"conv_16x2_score":12.499224,"conv_16x2_score_per_kb":0.33562,"conv_24x3_score":13.022208,"conv_24x3_score_per_kb":0.157502,"conv_48x5_score":13.048285,"conv_48x5_score_per_kb":0.031982,"conv_64x6_score":13.189171,"conv_64x6_score_per_kb":0.015855,"best_conv_channels":16,"best_conv_layers":2,"best_conv_score":12.499224,"best_conv_bytes":38136,"best_conv_score_per_kb":0.33562},"benchmark_id":"tiny_leela_fixed_teacher_distill_consensus_v1","commit":"2bfee1e","base_commit":"2bfee1e","hypothesis":"Adding structured center/edge/light/dark pooled conv features to each frozen conv channel might preserve the 64x6 policy gain while improving architecture comparison signal and strength-per-byte.","implementation":"Temporarily expanded conv_student_features from mean/max/min per channel to include center, edge, light-square, and dark-square pooled means for every channel. Ran the fixed benchmark with 64x6 as primary and all conv architecture diagnostics, then reverted the feature expansion after it underperformed.","learned":"The richer pooled conv feature fixture hurt the primary metric substantially: 13.436814 -> 13.189171. It increased feature_dim from 194 to 450, worsened dev_policy_ce from 5.645547 to 5.760826 and dev_wdl_ce from 0.796693 to 0.821151, and reduced strength-per-KB for all conv sizes. The simple mean/max/min pooling appears better matched to the tiny fixed label set.","next_action":"Keep the reverted 64x6 mean/max/min pooling baseline. Avoid adding broad pooled features; if scheduler stays on L011, try compression that preserves the existing pooling rather than feature expansion.","timestamp":"2026-05-04T23:41:50.132Z"}
{"type":"research_run","run_id":"R0040","node_id":"N0041","lane_id":"L000","phase":"explore","status":"kept","metric":13.436814,"metrics":{"distill_student_score":13.436814,"train_policy_ce":2.158718,"train_wdl_ce":0.672846,"dev_policy_ce":5.645547,"dev_wdl_ce":0.796693,"dev_policy_only_score":15.047671,"dev_wdl_only_score":55.657797,"dev_loss_balance_gap":4.848853,"dev_policy_top1":0,"teacher_rows":10,"raw_teacher_rows":20,"move_vocab":44,"feature_dim":194,"wdl_feature_dim":194,"weight_average_count":600,"average_policy_only":1,"primary_conv_channels":64,"primary_conv_layers":6,"fold_score_mean":13.040061,"fold_score_std":0.396754,"conv_16x2_score":12.85193,"conv_16x2_score_per_kb":0.504152,"conv_24x3_score":13.308346,"conv_24x3_score_per_kb":0.204572,"conv_48x5_score":13.322949,"conv_48x5_score_per_kb":0.035743,"conv_64x6_score":13.436814,"conv_64x6_score_per_kb":0.01712,"best_conv_channels":16,"best_conv_layers":2,"best_conv_score":12.85193,"best_conv_bytes":26104,"best_conv_score_per_kb":0.504152},"benchmark_id":"tiny_leela_fixed_teacher_distill_consensus_v1","commit":"a9316d9","base_commit":"a9316d9","hypothesis":"The baseline trajectory lane should align with the promoted 64x6 conv primary artifact and reproduce the current best fixed distillation score after the discarded pooling experiment was reverted.","implementation":"No code changes. Reran ./dovetail.sh on the current committed 64x6 primary-conv benchmark state after the discarded expanded-pooling logs were committed.","learned":"L000 reproduced the current best exactly: distill_student_score=13.436814 with fold_score_mean=13.040061 and fold_score_std=0.396754. This confirms the baseline trajectory now points at the promoted 64x6 candidate and that the reverted discarded pooling run left the executable state clean.","next_action":"Commit L000 alignment logs. Continue scheduler rotation; avoid further duplicate confirmations unless assigned, and prefer structural compression or WDL repair that preserves policy CE.","timestamp":"2026-05-04T23:58:48.522Z"}
{"type":"research_run","run_id":"R0041","node_id":"N0042","lane_id":"L012","phase":"explore","status":"kept","metric":13.436814,"metrics":{"distill_student_score":13.436814,"train_policy_ce":2.158718,"train_wdl_ce":0.672846,"dev_policy_ce":5.645547,"dev_wdl_ce":0.796693,"dev_q_wdl_ce":0.685984,"dev_wdl_q_ce_gap":-0.110709,"dev_policy_only_score":15.047671,"dev_wdl_only_score":55.657797,"dev_loss_balance_gap":4.848853,"dev_policy_top1":0,"teacher_rows":10,"raw_teacher_rows":20,"move_vocab":44,"feature_dim":194,"wdl_feature_dim":194,"weight_average_count":600,"average_policy_only":1,"primary_conv_channels":64,"primary_conv_layers":6,"fold_score_mean":13.040061,"fold_score_std":0.396754,"conv_16x2_score":12.85193,"conv_16x2_score_per_kb":0.504152,"conv_24x3_score":13.308346,"conv_24x3_score_per_kb":0.204572,"conv_48x5_score":13.322949,"conv_48x5_score_per_kb":0.035743,"conv_64x6_score":13.436814,"conv_64x6_score_per_kb":0.01712,"best_conv_channels":16,"best_conv_layers":2,"best_conv_score":12.85193,"best_conv_bytes":26104,"best_conv_score_per_kb":0.504152},"benchmark_id":"tiny_leela_fixed_teacher_distill_consensus_v1","commit":"fb849fe","base_commit":"fb849fe","hypothesis":"Adding Q-derived WDL calibration diagnostics can reveal whether the current 64x6 value head aligns better with averaged WDL targets or with Q-implied targets while keeping architecture, primary labels, and runtime fixed.","implementation":"Preserved consensus WDL training/evaluation as the primary benchmark, but carried a derived q value through merged FEN rows and emitted dev_q_wdl_ce plus dev_wdl_q_ce_gap using a q_to_wdl calibration target. No training labels, primary metric, architecture, or artifact selection changed.","learned":"Primary score stayed at 13.436814. The Q-derived WDL calibration CE was 0.685984, which is 0.110709 lower than consensus dev_wdl_ce=0.796693. This indicates the current value head is closer to Q-implied WDL calibration than to full averaged teacher WDL, and the WDL weakness in the primary metric may come from draw-probability disagreement rather than pure win/loss Q.","next_action":"Commit diagnostics. If scheduler continues L012, test a structural WDL target-mix diagnostic or optional q-derived WDL training only if benchmark comparability is handled explicitly; otherwise preserve fixed primary WDL labels.","timestamp":"2026-05-05T00:05:39.633Z"}
{"type":"research_run","run_id":"R0042","node_id":"N0043","lane_id":"L013","phase":"explore","status":"kept","metric":13.436814,"metrics":{"distill_student_score":13.436814,"train_policy_ce":2.158718,"train_wdl_ce":0.672846,"dev_policy_ce":5.645547,"dev_wdl_ce":0.796693,"dev_q_wdl_ce":0.685984,"dev_wdl_q_ce_gap":-0.110709,"dev_policy_only_score":15.047671,"dev_wdl_only_score":55.657797,"dev_loss_balance_gap":4.848853,"dev_policy_top1":0,"teacher_rows":10,"raw_teacher_rows":20,"move_vocab":44,"feature_dim":194,"wdl_feature_dim":194,"weight_average_count":600,"average_policy_only":1,"primary_conv_channels":64,"primary_conv_layers":6,"model_json_bytes":191456,"model_weight_count":9118,"estimated_eval_ops":33694,"browser_json_compatible":1,"fold_score_mean":13.040061,"fold_score_std":0.396754,"conv_16x2_score":12.85193,"conv_16x2_score_per_kb":0.504152,"conv_24x3_score":13.308346,"conv_24x3_score_per_kb":0.204572,"conv_48x5_score":13.322949,"conv_48x5_score_per_kb":0.035743,"conv_64x6_score":13.436814,"conv_64x6_score_per_kb":0.01712,"best_conv_channels":16,"best_conv_layers":2,"best_conv_score":12.85193,"best_conv_bytes":26104,"best_conv_score_per_kb":0.504152},"benchmark_id":"tiny_leela_fixed_teacher_distill_consensus_v1","commit":"44ade80","base_commit":"44ade80","hypothesis":"Adding deterministic gauntlet-style size/runtime/browser diagnostics can make the fixed distillation benchmark more useful for later replacing bootstrap scores while keeping architecture and primary metric fixed.","implementation":"Added artifact-size and deterministic runtime-proxy metrics emitted by train_student.py: model_json_bytes, model_weight_count, estimated_eval_ops, and browser_json_compatible. The artifact content, training labels, architecture, and primary distillation score remain unchanged.","learned":"Primary score stayed at 13.436814. The promoted 64x6 conv artifact is JSON-compatible but relatively large for a browser target: 191456 bytes, 9118 learned weights, and estimated_eval_ops=33694. This quantifies the cost of the raw-score improvement and gives future compression lanes explicit secondary metrics to improve.","next_action":"Commit gauntlet diagnostics. Continue scheduler; prioritize candidates that reduce model_json_bytes or estimated_eval_ops while preserving distill_student_score and policy CE.","timestamp":"2026-05-05T00:12:20.219Z"}
{"type":"research_run","run_id":"R0043","node_id":"N0044","lane_id":"L014","phase":"explore","status":"discarded","metric":13.436814,"metrics":{"distill_student_score":13.436814,"train_policy_ce":2.158718,"train_wdl_ce":0.672846,"dev_policy_ce":5.645547,"dev_wdl_ce":0.796693,"dev_q_wdl_ce":0.685984,"dev_wdl_q_ce_gap":-0.110709,"dev_policy_only_score":15.047671,"dev_wdl_only_score":55.657797,"dev_loss_balance_gap":4.848853,"dev_policy_top1":0,"teacher_rows":10,"raw_teacher_rows":20,"move_vocab":44,"feature_dim":194,"wdl_feature_dim":194,"weight_average_count":600,"average_policy_only":1,"primary_conv_channels":64,"primary_conv_layers":6,"kept_feature_count":194,"dropped_feature_count":0,"model_json_bytes":192147,"model_weight_count":9118,"estimated_eval_ops":33694,"browser_json_compatible":1,"fold_score_mean":13.040061,"fold_score_std":0.396754,"conv_16x2_score":12.85193,"conv_16x2_score_per_kb":0.504152,"conv_24x3_score":13.308346,"conv_24x3_score_per_kb":0.204572,"conv_48x5_score":13.322949,"conv_48x5_score_per_kb":0.035743,"conv_64x6_score":13.436814,"conv_64x6_score_per_kb":0.01712,"best_conv_channels":16,"best_conv_layers":2,"best_conv_score":12.85193,"best_conv_bytes":26104,"best_conv_score_per_kb":0.504152},"benchmark_id":"tiny_leela_fixed_teacher_distill_consensus_v1","commit":"1829931","base_commit":"1829931","hypothesis":"Dropping non-bias feature dimensions that are constant over the fixed teacher rows might compress the primary 64x6 frozen-conv student without changing predictions or the fixed distillation score.","implementation":"Temporarily added --drop-constant-features, selected active feature indices over the fixed teacher rows, and enabled it for the primary 64x6 conv artifact. After the run showed no features were dropped and artifact JSON grew from storing indices, the code and script changes were reverted.","learned":"The structural compression attempt did not help: kept_feature_count remained 194 and dropped_feature_count was 0, so the 64x6 mean/max/min features all vary over the fixed teacher rows. Primary score stayed 13.436814, but model_json_bytes increased from 191456 to 192147 due to metadata, so the change is strictly worse as a compression strategy.","next_action":"Commit discarded-run logs only. Future compression should not rely on constant-feature pruning; try shared projections, smaller conv shapes, or quantized serialization instead.","timestamp":"2026-05-05T00:20:04.364Z"}
{"type":"research_run","run_id":"R0044","node_id":"N0045","lane_id":"L015","phase":"explore","status":"discarded","metric":7.411533,"metrics":{"distill_student_score":7.411533,"train_policy_ce":1.238284,"train_wdl_ce":0.371548,"dev_policy_ce":11.652797,"dev_wdl_ce":0.839688,"dev_q_wdl_ce":0.732599,"dev_wdl_q_ce_gap":-0.107088,"dev_policy_only_score":7.903391,"dev_wdl_only_score":54.357048,"dev_loss_balance_gap":10.813109,"dev_policy_top1":0,"teacher_rows":10,"raw_teacher_rows":20,"move_vocab":44,"feature_dim":194,"wdl_feature_dim":194,"weight_average_count":600,"average_policy_only":1,"optimizer_adam":1,"primary_conv_channels":64,"primary_conv_layers":6,"model_json_bytes":176949,"model_weight_count":9118,"estimated_eval_ops":33694,"browser_json_compatible":1,"fold_score_mean":7.059039,"fold_score_std":0.352494,"conv_16x2_score":7.177092,"conv_16x2_score_per_kb":0.281541,"conv_24x3_score":7.691452,"conv_24x3_score_per_kb":0.118231,"conv_48x5_score":7.525079,"conv_48x5_score_per_kb":0.020188,"conv_64x6_score":7.411533,"conv_64x6_score_per_kb":0.009443,"best_conv_channels":16,"best_conv_layers":2,"best_conv_score":7.177092,"best_conv_bytes":26104,"best_conv_score_per_kb":0.281541},"benchmark_id":"tiny_leela_fixed_teacher_distill_consensus_v1","commit":"146539f","base_commit":"146539f","hypothesis":"A materially different Adam optimizer recipe may improve the fixed distillation score or reveal that the current tiny-label 64x6 student depends on SGD-style optimization.","implementation":"Temporarily added an --optimizer choice and implemented standard Adam moment/variance updates for both policy and WDL heads while preserving the existing architecture, labels, split, averaging, and 64x6 primary artifact. Enabled --optimizer adam in dovetail.sh, then reverted after the run underperformed.","learned":"Adam was much worse under the existing recipe: distill_student_score fell from 13.436814 to 7.411533, driven by dev_policy_ce worsening from 5.645547 to 11.652797. Although training losses decreased, dev/fold scores collapsed, indicating severe overfit or mismatch with the tiny fixed label set. The smaller JSON size was incidental to different learned values and not worth the strength loss.","next_action":"Commit discarded-run logs only. Keep SGD as the optimizer baseline; avoid optimizer swaps without a separate regularization/validation strategy.","timestamp":"2026-05-05T00:28:22.205Z"}
{"type":"research_run","run_id":"R0045","node_id":"N0046","lane_id":"L006","phase":"refine","status":"kept","metric":13.436814,"metrics":{"distill_student_score":13.436814,"train_policy_ce":2.158718,"train_wdl_ce":0.672846,"dev_policy_ce":5.645547,"dev_wdl_ce":0.796693,"dev_q_wdl_ce":0.685984,"dev_wdl_q_ce_gap":-0.110709,"dev_policy_only_score":15.047671,"dev_wdl_only_score":55.657797,"dev_loss_balance_gap":4.848853,"dev_policy_top1":0,"teacher_rows":10,"raw_teacher_rows":20,"move_vocab":44,"feature_dim":194,"wdl_feature_dim":194,"weight_average_count":600,"average_policy_only":1,"primary_conv_channels":64,"primary_conv_layers":6,"model_json_bytes":191456,"model_weight_count":9118,"estimated_eval_ops":33694,"browser_json_compatible":1,"fold_score_mean":13.040061,"fold_score_std":0.396754,"conv_16x2_score":12.85193,"conv_16x2_score_per_kb":0.504152,"conv_24x3_score":13.308346,"conv_24x3_score_per_kb":0.204572,"conv_48x5_score":13.322949,"conv_48x5_score_per_kb":0.035743,"conv_64x6_score":13.436814,"conv_64x6_score_per_kb":0.01712,"best_conv_channels":16,"best_conv_layers":2,"best_conv_score":12.85193,"best_conv_bytes":26104,"best_conv_score_per_kb":0.504152},"benchmark_id":"tiny_leela_fixed_teacher_distill_consensus_v1","commit":"2199b7e","base_commit":"2199b7e","hypothesis":"The original teacher-distilled student lane should refine to and reproduce the current promoted 64x6 conv student after later architecture, calibration, and gauntlet diagnostics were integrated.","implementation":"No code changes. Ran ./dovetail.sh at commit 2199b7e under the current fixed benchmark with 64x6 primary conv artifact, Q calibration diagnostics, and deployment gauntlet metrics enabled.","learned":"The L006 refine lane reproduced the current best exactly at 13.436814 with all diagnostics stable. This confirms the first real teacher-distilled student lane has converged to the promoted conv student baseline after scheduler-spawned architecture work.","next_action":"Commit refine alignment logs. Continue scheduler rotation; future L006 refinements should be true structural improvements rather than more alignment confirmations.","timestamp":"2026-05-05T00:35:09.912Z"}
{"type":"research_run","run_id":"R0046","node_id":"N0048","lane_id":"L017","phase":"explore","status":"discarded","metric":0.5,"metrics":{"selfplay_games":2,"selfplay_positions":16,"selfplay_avg_plies":8,"selfplay_decisive_rate":0,"selfplay_policy_mass":1,"mix_0_selfplay_weight":0,"mix_0_distill_student_score":17.012288,"mix_0_arena_score_rate":0.5,"mix_0_arena_candidate_elo_estimate":0,"mix_0_arena_illegal_losses":0,"mix_0p05_selfplay_weight":0.05,"mix_0p05_distill_student_score":17.599568,"mix_0p05_arena_score_rate":0.5,"mix_0p05_arena_candidate_elo_estimate":0,"mix_0p05_arena_illegal_losses":0,"mix_0p1_selfplay_weight":0.1,"mix_0p1_distill_student_score":17.655724,"mix_0p1_arena_score_rate":0.5,"mix_0p1_arena_candidate_elo_estimate":0,"mix_0p1_arena_illegal_losses":0,"mix_0p25_selfplay_weight":0.25,"mix_0p25_distill_student_score":17.774182,"mix_0p25_arena_score_rate":0.5,"mix_0p25_arena_candidate_elo_estimate":0,"mix_0p25_arena_illegal_losses":0,"mix_weights_tested":4,"mix_best_selfplay_weight":0,"mix_best_arena_score_rate":0.5,"mix_best_distill_student_score":17.012288,"legal_move_selection_rate":1,"playable_shell_ready":1},"benchmark_id":"tiny_leela_selfplay_mix_arena_v1","commit":"2622fbd","base_commit":"2622fbd","hypothesis":"A small weighted mix of PUCT self-play examples with teacher labels can improve head-to-head arena score versus the current teacher-only baseline without illegal moves.","implementation":"Initialized Phase D self-play arena segment, paused non-self-play active lanes per user request, and changed dovetail.sh to a fixed CPU selfplay:mix-sweep benchmark over weights 0,0.05,0.1,0.25 with 2 generated games, 1-visit self-play, 8 max plies, 40 training epochs, 2 arena games, 1-visit arena, and 64x6 primary conv candidates; eval:playable runs as guard.","learned":"All tested self-play weights tied the teacher-only baseline at arena_score_rate=0.500000 with zero illegal losses and legal_move_selection_rate=1.0. The generated games were all non-decisive at this tiny budget, so WDL self-play result targets were draws; self-play weights improved the teacher holdout/distill score under the short-epoch sweep but did not produce arena evidence. The current arena is too draw-saturated/low-budget to distinguish mix ratios.","next_action":"Keep the Phase D benchmark scaffold but treat this mix candidate as non-improving. Next self-play lane should make the arena more discriminative with more games/plies, fixed tactical/opening starts, or decisive adjudication before relying on mix weights.","timestamp":"2026-05-05T02:26:59.937Z","wall_time_seconds":878.288}
{"type":"research_run","run_id":"R0047","node_id":"N0049","lane_id":"L017","phase":"explore","status":"discarded","metric":0.5,"metrics":{"selfplay_games":2,"selfplay_positions":16,"selfplay_avg_plies":8,"selfplay_decisive_rate":1,"selfplay_adjudicated_rate":1,"selfplay_policy_mass":1,"mix_selfplay_games":2,"mix_selfplay_positions":16,"mix_selfplay_decisive_rate":1,"mix_selfplay_adjudicated_rate":1,"mix_0_arena_score_rate":0.5,"mix_0_distill_student_score":17.012288,"mix_0p05_arena_score_rate":0.5,"mix_0p05_distill_student_score":18.083951,"mix_0p1_arena_score_rate":0.5,"mix_0p1_distill_student_score":18.093003,"mix_0p25_arena_score_rate":0.5,"mix_0p25_distill_student_score":18.111029,"mix_best_selfplay_weight":0,"mix_best_arena_score_rate":0.5,"mix_best_distill_student_score":17.012288,"legal_move_selection_rate":1,"legal_policy_mass":1,"playable_shell_ready":1},"benchmark_id":"tiny_leela_selfplay_mix_arena_v1","commit":"07f42ebd88c5fac7f35287054b97f68f9aa4ac10","hypothesis":"A small weighted mix of PUCT self-play examples with teacher labels can improve head-to-head arena score versus the current teacher-only baseline without illegal moves; improving benchmark discrimination with value adjudication may reveal non-draw differences.","implementation":"Added optional value adjudication to self-play generation and arena evaluation, surfaced adjudication metrics through the mix sweep, and enabled value adjudication in dovetail.sh while keeping the same fixed weights/workload.","learned":"Value adjudication made all tiny self-play and arena games decisive/adjudicated, but it did not improve the primary arena score: every tested self-play mix weight still tied baseline at 0.5 with zero illegal losses. Distillation scores rose numerically under the modified target/adjudication setup but did not translate to arena advantage. Runtime remained 878s, still too close to the 900s budget.","next_action":"Discard this run for primary metric. Commit or preserve logs only after deciding whether to keep value-adjudication instrumentation as benchmark infrastructure; next L017 pivot should reduce runtime and improve discrimination structurally, likely by using Rust search/self-play or tactical opening suites rather than another TS 64x6 retraining sweep.","timestamp":"2026-05-05T03:25:55.638Z","wall_time_seconds":878.158}
